{
  "lastUpdate": "2026-01-08T18:53:31.095Z",
  "categories": {
    "gov-it-btp": {
      "name": "BTP - Buoni Tesoro Poliennali",
      "description": "Titoli di Stato italiani a medio-lungo termine",
      "count": 115,
      "bonds": [
        {
          "isin": "IT0005668238",
          "name": "BTP 01/10/2055 4,65%",
          "type": "BTP",
          "country": "IT",
          "currency": "EUR",
          "maturity": "2055-10-01",
          "coupon": 4.65,
          "yield": 4.43,
          "price": 104.46,
          "change": "+0.00",
          "lastUpdate": "2026-01-08"
        },
        {
          "isin": "IT0005611741",
          "name": "BTP 01/10/2054 4,3%",
          "type": "BTP",
          "country": "IT",
          "currency": "EUR",
          "maturity": "2054-10-01",
          "coupon": 4.3,
          "yield": 4.38,
          "price": 99.5,
          "change": "+0.00",
          "lastUpdate": "2026-01-08"
        },
        {
          "isin": "IT0005534141",
          "name": "BTP 01/10/2053 4,5%",
          "type": "BTP",
          "country": "IT",
          "currency": "EUR",
          "maturity": "2053-10-01",
          "coupon": 4.5,
          "yield": 4.36,
          "price": 103,
          "change": "+0.00",
          "lastUpdate": "2026-01-08"
        },
        {
          "isin": "IT0005217390",
          "name": "BTP 01/03/2067 2,8%",
          "type": "BTP",
          "country": "IT",
          "currency": "EUR",
          "maturity": "2067-03-01",
          "coupon": 2.8,
          "yield": 4.33,
          "price": 71.37,
          "change": "+0.00",
          "lastUpdate": "2026-01-08"
        },
        {
          "isin": "IT0005480980",
          "name": "BTP 01/09/2052 2,15%",
          "type": "BTP",
          "country": "IT",
          "currency": "EUR",
          "maturity": "2052-09-01",
          "coupon": 2.15,
          "yield": 4.28,
          "price": 66.85,
          "change": "+0.00",
          "lastUpdate": "2026-01-08"
        },
        {
          "isin": "IT0005425233",
          "name": "BTP 01/09/2051 1,7%",
          "type": "BTP",
          "country": "IT",
          "currency": "EUR",
          "maturity": "2051-09-01",
          "coupon": 1.7,
          "yield": 4.26,
          "price": 60.77,
          "change": "+0.00",
          "lastUpdate": "2026-01-08"
        },
        {
          "isin": "IT0005398406",
          "name": "BTP 01/09/2050 2,45%",
          "type": "BTP",
          "country": "IT",
          "currency": "EUR",
          "maturity": "2050-09-01",
          "coupon": 2.45,
          "yield": 4.26,
          "price": 73.1,
          "change": "+0.00",
          "lastUpdate": "2026-01-08"
        },
        {
          "isin": "IT0005363111",
          "name": "BTP 01/09/2049 3,85%",
          "type": "BTP",
          "country": "IT",
          "currency": "EUR",
          "maturity": "2049-09-01",
          "coupon": 3.85,
          "yield": 4.21,
          "price": 95.25,
          "change": "+0.00",
          "lastUpdate": "2026-01-08"
        },
        {
          "isin": "IT0005273013",
          "name": "BTP 01/03/2048 3,45%",
          "type": "BTP",
          "country": "IT",
          "currency": "EUR",
          "maturity": "2048-03-01",
          "coupon": 3.45,
          "yield": 4.18,
          "price": 90.03,
          "change": "+0.00",
          "lastUpdate": "2026-01-08"
        },
        {
          "isin": "IT0005162828",
          "name": "BTP 01/03/2047 2,7%",
          "type": "BTP",
          "country": "IT",
          "currency": "EUR",
          "maturity": "2047-03-01",
          "coupon": 2.7,
          "yield": 4.16,
          "price": 80.13,
          "change": "+0.00",
          "lastUpdate": "2026-01-08"
        },
        {
          "isin": "IT0005441883",
          "name": "BTP 01/03/2072 2,15%",
          "type": "BTP",
          "country": "IT",
          "currency": "EUR",
          "maturity": "2072-03-01",
          "coupon": 2.15,
          "yield": 4.16,
          "price": 59.54,
          "change": "+0.00",
          "lastUpdate": "2026-01-08"
        },
        {
          "isin": "IT0005083057",
          "name": "BTP 01/09/2046 3,25%",
          "type": "BTP",
          "country": "IT",
          "currency": "EUR",
          "maturity": "2046-09-01",
          "coupon": 3.25,
          "yield": 4.15,
          "price": 88.18,
          "change": "+0.00",
          "lastUpdate": "2026-01-08"
        },
        {
          "isin": "IT0005631608",
          "name": "BTP GREEN BOND 30/04/2046 4,1%",
          "type": "BTP",
          "country": "IT",
          "currency": "EUR",
          "maturity": "2046-04-30",
          "coupon": 4.1,
          "yield": 4.13,
          "price": 100.1,
          "change": "+0.00",
          "lastUpdate": "2026-01-08"
        },
        {
          "isin": "IT0005438004",
          "name": "BTP Green 30/04/2045 1,5%",
          "type": "BTP",
          "country": "IT",
          "currency": "EUR",
          "maturity": "2045-04-30",
          "coupon": 1.5,
          "yield": 4.11,
          "price": 65.93,
          "change": "+0.00",
          "lastUpdate": "2026-01-08"
        },
        {
          "isin": "IT0005530032",
          "name": "BTP 01/09/2043 4,45%",
          "type": "BTP",
          "country": "IT",
          "currency": "EUR",
          "maturity": "2043-09-01",
          "coupon": 4.45,
          "yield": 4.07,
          "price": 105.29,
          "change": "+0.00",
          "lastUpdate": "2026-01-08"
        },
        {
          "isin": "IT0004923998",
          "name": "BTP 01/09/2044 4,75%",
          "type": "BTP",
          "country": "IT",
          "currency": "EUR",
          "maturity": "2044-09-01",
          "coupon": 4.75,
          "yield": 4.06,
          "price": 109.53,
          "change": "+0.00",
          "lastUpdate": "2026-01-08"
        },
        {
          "isin": "IT0005421703",
          "name": "BTP 01/03/2041 1,8%",
          "type": "BTP",
          "country": "IT",
          "currency": "EUR",
          "maturity": "2041-03-01",
          "coupon": 1.8,
          "yield": 3.94,
          "price": 76.18,
          "change": "+0.00",
          "lastUpdate": "2026-01-08"
        },
        {
          "isin": "IT0005635583",
          "name": "BTP 01/10/2040 3,85%",
          "type": "BTP",
          "country": "IT",
          "currency": "EUR",
          "maturity": "2040-10-01",
          "coupon": 3.85,
          "yield": 3.91,
          "price": 99.72,
          "change": "+0.00",
          "lastUpdate": "2026-01-08"
        },
        {
          "isin": "IT0004532559",
          "name": "BTP 01/09/2040 5%(No CACs)",
          "type": "BTP",
          "country": "IT",
          "currency": "EUR",
          "maturity": "2040-09-01",
          "coupon": 0,
          "yield": 3.86,
          "price": 113.1,
          "change": "+0.00",
          "lastUpdate": "2026-01-08"
        },
        {
          "isin": "IT0005377152",
          "name": "BTP 01/03/2040 3,1%",
          "type": "BTP",
          "country": "IT",
          "currency": "EUR",
          "maturity": "2040-03-01",
          "coupon": 3.1,
          "yield": 3.84,
          "price": 92.31,
          "change": "+0.00",
          "lastUpdate": "2026-01-08"
        },
        {
          "isin": "IT0005582421",
          "name": "BTP 01/10/2039 4,15%",
          "type": "BTP",
          "country": "IT",
          "currency": "EUR",
          "maturity": "2039-10-01",
          "coupon": 4.15,
          "yield": 3.84,
          "price": 103.7,
          "change": "+0.00",
          "lastUpdate": "2026-01-08"
        },
        {
          "isin": "IT0005442097",
          "name": "BTP FUTURA 27/04/2037 STEP UP 0,75% - 2%",
          "type": "BTP",
          "country": "IT",
          "currency": "EUR",
          "maturity": "2037-04-27",
          "coupon": 0.75,
          "yield": 3.83,
          "price": 80.05,
          "change": "+0.00",
          "lastUpdate": "2026-01-08"
        },
        {
          "isin": "IT0004286966",
          "name": "BTP 01/08/2039 5%(No CACs)",
          "type": "BTP",
          "country": "IT",
          "currency": "EUR",
          "maturity": "2039-08-01",
          "coupon": 0,
          "yield": 3.79,
          "price": 113.13,
          "change": "+0.00",
          "lastUpdate": "2026-01-08"
        },
        {
          "isin": "IT0005321325",
          "name": "BTP 01/09/2038 2,95%",
          "type": "BTP",
          "country": "IT",
          "currency": "EUR",
          "maturity": "2038-09-01",
          "coupon": 2.95,
          "yield": 3.73,
          "price": 92.54,
          "change": "+0.00",
          "lastUpdate": "2026-01-08"
        },
        {
          "isin": "IT0005496770",
          "name": "BTP 01/03/2038 3,25%",
          "type": "BTP",
          "country": "IT",
          "currency": "EUR",
          "maturity": "2038-03-01",
          "coupon": 3.25,
          "yield": 3.71,
          "price": 95.87,
          "change": "+0.00",
          "lastUpdate": "2026-01-08"
        },
        {
          "isin": "IT0005433195",
          "name": "BTP 01/03/2037 0,95%",
          "type": "BTP",
          "country": "IT",
          "currency": "EUR",
          "maturity": "2037-03-01",
          "coupon": 0.95,
          "yield": 3.62,
          "price": 76,
          "change": "+0.00",
          "lastUpdate": "2026-01-08"
        },
        {
          "isin": "IT0005596470",
          "name": "BTP 30/10/2037 4,05% GREEN BOND",
          "type": "BTP",
          "country": "IT",
          "currency": "EUR",
          "maturity": "2037-10-30",
          "coupon": 4.05,
          "yield": 3.6,
          "price": 104.59,
          "change": "+0.00",
          "lastUpdate": "2026-01-08"
        },
        {
          "isin": "IT0003934657",
          "name": "BTP 01/02/2037 4%(No CACs)",
          "type": "BTP",
          "country": "IT",
          "currency": "EUR",
          "maturity": "2037-02-01",
          "coupon": 0,
          "yield": 3.56,
          "price": 104.26,
          "change": "+0.00",
          "lastUpdate": "2026-01-08"
        },
        {
          "isin": "IT0005177909",
          "name": "BTP 01/09/2036 2,25%",
          "type": "BTP",
          "country": "IT",
          "currency": "EUR",
          "maturity": "2036-09-01",
          "coupon": 2.25,
          "yield": 3.54,
          "price": 88.89,
          "change": "+0.00",
          "lastUpdate": "2026-01-08"
        },
        {
          "isin": "IT0005676504",
          "name": "BTP 01/02/2036 3,45%",
          "type": "BTP",
          "country": "IT",
          "currency": "EUR",
          "maturity": "2036-02-01",
          "coupon": 3.45,
          "yield": 3.51,
          "price": 99.71,
          "change": "+0.00",
          "lastUpdate": "2026-01-08"
        },
        {
          "isin": "IT0005402117",
          "name": "BTP 01/03/2036 1,45%",
          "type": "BTP",
          "country": "IT",
          "currency": "EUR",
          "maturity": "2036-03-01",
          "coupon": 1.45,
          "yield": 3.49,
          "price": 82.96,
          "change": "+0.00",
          "lastUpdate": "2026-01-08"
        },
        {
          "isin": "IT0005648149",
          "name": "BTP 01/10/2035 3,6%",
          "type": "BTP",
          "country": "IT",
          "currency": "EUR",
          "maturity": "2035-10-01",
          "coupon": 3.6,
          "yield": 3.48,
          "price": 101.26,
          "change": "+0.00",
          "lastUpdate": "2026-01-08"
        },
        {
          "isin": "IT0005631590",
          "name": "BTP 01/08/2035 3,65%",
          "type": "BTP",
          "country": "IT",
          "currency": "EUR",
          "maturity": "2035-08-01",
          "coupon": 3.65,
          "yield": 3.46,
          "price": 101.76,
          "change": "+0.00",
          "lastUpdate": "2026-01-08"
        },
        {
          "isin": "IT0005607970",
          "name": "BTP 01/02/2035 3,85%",
          "type": "BTP",
          "country": "IT",
          "currency": "EUR",
          "maturity": "2035-02-01",
          "coupon": 3.85,
          "yield": 3.4,
          "price": 103.71,
          "change": "+0.00",
          "lastUpdate": "2026-01-08"
        },
        {
          "isin": "IT0005508590",
          "name": "BTP GREEN 30/04/2035 4%",
          "type": "BTP",
          "country": "IT",
          "currency": "EUR",
          "maturity": "2035-04-30",
          "coupon": 0,
          "yield": 3.37,
          "price": 105.18,
          "change": "+0.00",
          "lastUpdate": "2026-01-08"
        },
        {
          "isin": "IT0005358806",
          "name": "BTP 01/03/2035 3,35%",
          "type": "BTP",
          "country": "IT",
          "currency": "EUR",
          "maturity": "2035-03-01",
          "coupon": 3.35,
          "yield": 3.36,
          "price": 100.1,
          "change": "+0.00",
          "lastUpdate": "2026-01-08"
        },
        {
          "isin": "IT0005466351",
          "name": "BTP FUTURA 16/11/2033 STEP UP 0,75% - 1,7%",
          "type": "BTP",
          "country": "IT",
          "currency": "EUR",
          "maturity": "2033-11-16",
          "coupon": 0.75,
          "yield": 3.33,
          "price": 87.76,
          "change": "+0.00",
          "lastUpdate": "2026-01-08"
        },
        {
          "isin": "IT0005584856",
          "name": "BTP 01/07/2034 3,85%",
          "type": "BTP",
          "country": "IT",
          "currency": "EUR",
          "maturity": "2034-07-01",
          "coupon": 3.85,
          "yield": 3.32,
          "price": 104.09,
          "change": "+0.00",
          "lastUpdate": "2026-01-08"
        },
        {
          "isin": "IT0003535157",
          "name": "BTP 01/08/2034 5%(No CACs)",
          "type": "BTP",
          "country": "IT",
          "currency": "EUR",
          "maturity": "2034-08-01",
          "coupon": 0,
          "yield": 3.32,
          "price": 112.64,
          "change": "+0.00",
          "lastUpdate": "2026-01-08"
        },
        {
          "isin": "IT0005634800",
          "name": "BTP PIU' 25/02/2033 STEP UP 2,85% - 3,7%",
          "type": "BTP",
          "country": "IT",
          "currency": "EUR",
          "maturity": "2033-02-25",
          "coupon": 2.85,
          "yield": 3.29,
          "price": 100.31,
          "change": "+0.00",
          "lastUpdate": "2026-01-08"
        },
        {
          "isin": "IT0005560948",
          "name": "BTP 01/03/2034 4,2%",
          "type": "BTP",
          "country": "IT",
          "currency": "EUR",
          "maturity": "2034-03-01",
          "coupon": 4.2,
          "yield": 3.28,
          "price": 106.75,
          "change": "+0.00",
          "lastUpdate": "2026-01-08"
        },
        {
          "isin": "IT0005544082",
          "name": "BTP 01/11/2033 4,35%",
          "type": "BTP",
          "country": "IT",
          "currency": "EUR",
          "maturity": "2033-11-01",
          "coupon": 4.35,
          "yield": 3.24,
          "price": 107.79,
          "change": "+0.00",
          "lastUpdate": "2026-01-08"
        },
        {
          "isin": "IT0005240350",
          "name": "BTP 01/09/2033 2,45%",
          "type": "BTP",
          "country": "IT",
          "currency": "EUR",
          "maturity": "2033-09-01",
          "coupon": 2.45,
          "yield": 3.18,
          "price": 95.23,
          "change": "+0.00",
          "lastUpdate": "2026-01-08"
        },
        {
          "isin": "IT0005518128",
          "name": "BTP 01/05/2033 4,4%",
          "type": "BTP",
          "country": "IT",
          "currency": "EUR",
          "maturity": "2033-05-01",
          "coupon": 4.4,
          "yield": 3.16,
          "price": 108.18,
          "change": "+0.00",
          "lastUpdate": "2026-01-08"
        },
        {
          "isin": "IT0005672024",
          "name": "BTP VALORE 6 28/10/2032 STEP UP 2,6% - 4%",
          "type": "BTP",
          "country": "IT",
          "currency": "EUR",
          "maturity": "2032-10-28",
          "coupon": 2.6,
          "yield": 3.13,
          "price": 100.22,
          "change": "+0.00",
          "lastUpdate": "2026-01-08"
        },
        {
          "isin": "IT0003256820",
          "name": "BTP 01/02/2033 5,75%(No CACs)",
          "type": "BTP",
          "country": "IT",
          "currency": "EUR",
          "maturity": "2033-02-01",
          "coupon": 5.75,
          "yield": 3.11,
          "price": 116.76,
          "change": "+0.00",
          "lastUpdate": "2026-01-08"
        },
        {
          "isin": "IT0005668220",
          "name": "BTP 15/11/2032 3,25%",
          "type": "BTP",
          "country": "IT",
          "currency": "EUR",
          "maturity": "2032-11-15",
          "coupon": 3.25,
          "yield": 3.1,
          "price": 101.03,
          "change": "+0.00",
          "lastUpdate": "2026-01-08"
        },
        {
          "isin": "IT0005494239",
          "name": "BTP 01/12/2032 2,5%",
          "type": "BTP",
          "country": "IT",
          "currency": "EUR",
          "maturity": "2032-12-01",
          "coupon": 2.5,
          "yield": 3.09,
          "price": 96.52,
          "change": "+0.00",
          "lastUpdate": "2026-01-08"
        },
        {
          "isin": "IT0005647265",
          "name": "BTP 15/07/2032 3,25%",
          "type": "BTP",
          "country": "IT",
          "currency": "EUR",
          "maturity": "2032-07-15",
          "coupon": 3.25,
          "yield": 3.05,
          "price": 101.31,
          "change": "+0.00",
          "lastUpdate": "2026-01-08"
        },
        {
          "isin": "IT0005466013",
          "name": "BTP 01/06/2032 0,95%",
          "type": "BTP",
          "country": "IT",
          "currency": "EUR",
          "maturity": "2032-06-01",
          "coupon": 0.95,
          "yield": 3.01,
          "price": 88.26,
          "change": "+0.00",
          "lastUpdate": "2026-01-08"
        },
        {
          "isin": "IT0005094088",
          "name": "BTP 01/03/2032 1,65%",
          "type": "BTP",
          "country": "IT",
          "currency": "EUR",
          "maturity": "2032-03-01",
          "coupon": 1.65,
          "yield": 2.97,
          "price": 92.77,
          "change": "+0.00",
          "lastUpdate": "2026-01-08"
        },
        {
          "isin": "IT0005619546",
          "name": "BTP 15/11/2031 3,15%",
          "type": "BTP",
          "country": "IT",
          "currency": "EUR",
          "maturity": "2031-11-15",
          "coupon": 3.15,
          "yield": 2.94,
          "price": 101.22,
          "change": "+0.00",
          "lastUpdate": "2026-01-08"
        },
        {
          "isin": "IT0005449969",
          "name": "BTP 01/12/2031 0,95%",
          "type": "BTP",
          "country": "IT",
          "currency": "EUR",
          "maturity": "2031-12-01",
          "coupon": 0.95,
          "yield": 2.93,
          "price": 89.45,
          "change": "+0.00",
          "lastUpdate": "2026-01-08"
        },
        {
          "isin": "IT0005542359",
          "name": "BTP GREEN BOND 30/10/2031 4%",
          "type": "BTP",
          "country": "IT",
          "currency": "EUR",
          "maturity": "2031-10-30",
          "coupon": 0,
          "yield": 2.89,
          "price": 106.01,
          "change": "+0.00",
          "lastUpdate": "2026-01-08"
        },
        {
          "isin": "IT0005594483",
          "name": "BTP VALORE 4 14/05/2030 STEP UP 3,35% - 3,90%",
          "type": "BTP",
          "country": "IT",
          "currency": "EUR",
          "maturity": "2030-05-14",
          "coupon": 3.35,
          "yield": 2.88,
          "price": 103.55,
          "change": "+0.00",
          "lastUpdate": "2026-01-08"
        },
        {
          "isin": "IT0005595803",
          "name": "BTP 15/07/2031 3,45%",
          "type": "BTP",
          "country": "IT",
          "currency": "EUR",
          "maturity": "2031-07-15",
          "coupon": 3.45,
          "yield": 2.88,
          "price": 102.98,
          "change": "+0.00",
          "lastUpdate": "2026-01-08"
        },
        {
          "isin": "IT0005436693",
          "name": "BTP 01/08/2031 0,6%",
          "type": "BTP",
          "country": "IT",
          "currency": "EUR",
          "maturity": "2031-08-01",
          "coupon": 0.6,
          "yield": 2.88,
          "price": 88.47,
          "change": "+0.00",
          "lastUpdate": "2026-01-08"
        },
        {
          "isin": "IT0005583486",
          "name": "BTP VALORE 3 05/03/2030 STEP UP 3,25% - 4%",
          "type": "BTP",
          "country": "IT",
          "currency": "EUR",
          "maturity": "2030-03-05",
          "coupon": 3.25,
          "yield": 2.86,
          "price": 103.74,
          "change": "+0.00",
          "lastUpdate": "2026-01-08"
        },
        {
          "isin": "IT0005415291",
          "name": "BTP FUTURA 14/07/2030 STEP UP 1,15% - 1,45%",
          "type": "BTP",
          "country": "IT",
          "currency": "EUR",
          "maturity": "2030-07-14",
          "coupon": 1.15,
          "yield": 2.85,
          "price": 93.99,
          "change": "+0.00",
          "lastUpdate": "2026-01-08"
        },
        {
          "isin": "IT0005422891",
          "name": "BTP 01/04/2031 0,90%",
          "type": "BTP",
          "country": "IT",
          "currency": "EUR",
          "maturity": "2031-04-01",
          "coupon": 0.9,
          "yield": 2.82,
          "price": 90.83,
          "change": "+0.00",
          "lastUpdate": "2026-01-08"
        },
        {
          "isin": "IT0005580094",
          "name": "BTP 15/02/2031 3,5%",
          "type": "BTP",
          "country": "IT",
          "currency": "EUR",
          "maturity": "2031-02-15",
          "coupon": 3.5,
          "yield": 2.82,
          "price": 103.3,
          "change": "+0.00",
          "lastUpdate": "2026-01-08"
        },
        {
          "isin": "IT0005671273",
          "name": "BTP 01/02/2031 2,85%",
          "type": "BTP",
          "country": "IT",
          "currency": "EUR",
          "maturity": "2031-02-01",
          "coupon": 2.85,
          "yield": 2.82,
          "price": 100.25,
          "change": "+0.00",
          "lastUpdate": "2026-01-08"
        },
        {
          "isin": "IT0001444378",
          "name": "BTP 01/05/2031 6%(No CACs)",
          "type": "BTP",
          "country": "IT",
          "currency": "EUR",
          "maturity": "2031-05-01",
          "coupon": 0,
          "yield": 2.8,
          "price": 115.75,
          "change": "+0.00",
          "lastUpdate": "2026-01-08"
        },
        {
          "isin": "IT0005561888",
          "name": "BTP 15/11/2030 4%",
          "type": "BTP",
          "country": "IT",
          "currency": "EUR",
          "maturity": "2030-11-15",
          "coupon": 0,
          "yield": 2.78,
          "price": 105.58,
          "change": "+0.00",
          "lastUpdate": "2026-01-08"
        },
        {
          "isin": "IT0005413171",
          "name": "BTP 01/12/2030 1,65%",
          "type": "BTP",
          "country": "IT",
          "currency": "EUR",
          "maturity": "2030-12-01",
          "coupon": 1.65,
          "yield": 2.76,
          "price": 95.04,
          "change": "+0.00",
          "lastUpdate": "2026-01-08"
        },
        {
          "isin": "IT0005654642",
          "name": "BTP 01/10/2030 2,7%",
          "type": "BTP",
          "country": "IT",
          "currency": "EUR",
          "maturity": "2030-10-01",
          "coupon": 2.7,
          "yield": 2.75,
          "price": 99.86,
          "change": "+0.00",
          "lastUpdate": "2026-01-08"
        },
        {
          "isin": "IT0005637399",
          "name": "BTP 01/07/2030 2,95%",
          "type": "BTP",
          "country": "IT",
          "currency": "EUR",
          "maturity": "2030-07-01",
          "coupon": 2.95,
          "yield": 2.71,
          "price": 101.07,
          "change": "+0.00",
          "lastUpdate": "2026-01-08"
        },
        {
          "isin": "IT0005542797",
          "name": "BTP 15/06/2030 3,7%",
          "type": "BTP",
          "country": "IT",
          "currency": "EUR",
          "maturity": "2030-06-15",
          "coupon": 3.7,
          "yield": 2.7,
          "price": 104.21,
          "change": "+0.00",
          "lastUpdate": "2026-01-08"
        },
        {
          "isin": "IT0005403396",
          "name": "BTP 01/08/2030 0,95%",
          "type": "BTP",
          "country": "IT",
          "currency": "EUR",
          "maturity": "2030-08-01",
          "coupon": 0.95,
          "yield": 2.69,
          "price": 92.65,
          "change": "+0.00",
          "lastUpdate": "2026-01-08"
        },
        {
          "isin": "IT0005383309",
          "name": "BTP 01/04/2030 1,35%",
          "type": "BTP",
          "country": "IT",
          "currency": "EUR",
          "maturity": "2030-04-01",
          "coupon": 1.35,
          "yield": 2.64,
          "price": 94.96,
          "change": "+0.00",
          "lastUpdate": "2026-01-08"
        },
        {
          "isin": "IT0005024234",
          "name": "BTP 01/03/2030 3,5%",
          "type": "BTP",
          "country": "IT",
          "currency": "EUR",
          "maturity": "2030-03-01",
          "coupon": 3.5,
          "yield": 2.61,
          "price": 103.54,
          "change": "+0.00",
          "lastUpdate": "2026-01-08"
        },
        {
          "isin": "IT0005519787",
          "name": "BTP 15/12/2029 3,85%",
          "type": "BTP",
          "country": "IT",
          "currency": "EUR",
          "maturity": "2029-12-15",
          "coupon": 3.85,
          "yield": 2.6,
          "price": 104.69,
          "change": "+0.00",
          "lastUpdate": "2026-01-08"
        },
        {
          "isin": "IT0005611055",
          "name": "BTP 01/10/2029 3%",
          "type": "BTP",
          "country": "IT",
          "currency": "EUR",
          "maturity": "2029-10-01",
          "coupon": 0,
          "yield": 2.58,
          "price": 101.54,
          "change": "+0.00",
          "lastUpdate": "2026-01-08"
        },
        {
          "isin": "IT0005565400",
          "name": "BTP VALORE 2 10/10/2028 STEP UP 4,10%-4,50%",
          "type": "BTP",
          "country": "IT",
          "currency": "EUR",
          "maturity": "2028-10-10",
          "coupon": 4.1,
          "yield": 2.57,
          "price": 104.88,
          "change": "+0.00",
          "lastUpdate": "2026-01-08"
        },
        {
          "isin": "IT0005584849",
          "name": "BTP 01/07/2029 3,35%",
          "type": "BTP",
          "country": "IT",
          "currency": "EUR",
          "maturity": "2029-07-01",
          "coupon": 3.35,
          "yield": 2.54,
          "price": 102.72,
          "change": "+0.00",
          "lastUpdate": "2026-01-08"
        },
        {
          "isin": "IT0001278511",
          "name": "BTP 01/11/2029 5,25%(No CACs)",
          "type": "BTP",
          "country": "IT",
          "currency": "EUR",
          "maturity": "2029-11-01",
          "coupon": 5.25,
          "yield": 2.54,
          "price": 109.83,
          "change": "+0.00",
          "lastUpdate": "2026-01-08"
        },
        {
          "isin": "IT0005495731",
          "name": "BTP 15/06/2029 2,8%",
          "type": "BTP",
          "country": "IT",
          "currency": "EUR",
          "maturity": "2029-06-15",
          "coupon": 2.8,
          "yield": 2.51,
          "price": 100.99,
          "change": "+0.00",
          "lastUpdate": "2026-01-08"
        },
        {
          "isin": "IT0005365165",
          "name": "BTP 01/08/2029 3%",
          "type": "BTP",
          "country": "IT",
          "currency": "EUR",
          "maturity": "2029-08-01",
          "coupon": 0,
          "yield": 2.51,
          "price": 101.72,
          "change": "+0.00",
          "lastUpdate": "2026-01-08"
        },
        {
          "isin": "IT0005425761",
          "name": "BTP FUTURA 17/11/2028 STEP UP 0,35% - 1%",
          "type": "BTP",
          "country": "IT",
          "currency": "EUR",
          "maturity": "2028-11-17",
          "coupon": 0.35,
          "yield": 2.46,
          "price": 95.71,
          "change": "+0.00",
          "lastUpdate": "2026-01-08"
        },
        {
          "isin": "IT0005566408",
          "name": "BTP 01/02/2029 4,1%",
          "type": "BTP",
          "country": "IT",
          "currency": "EUR",
          "maturity": "2029-02-01",
          "coupon": 4.1,
          "yield": 2.46,
          "price": 104.84,
          "change": "+0.00",
          "lastUpdate": "2026-01-08"
        },
        {
          "isin": "IT0005467482",
          "name": "BTP 15/02/2029 0,45%",
          "type": "BTP",
          "country": "IT",
          "currency": "EUR",
          "maturity": "2029-02-15",
          "coupon": 0.45,
          "yield": 2.42,
          "price": 94.19,
          "change": "+0.00",
          "lastUpdate": "2026-01-08"
        },
        {
          "isin": "IT0005660052",
          "name": "BTP 15/01/2029 2,35%",
          "type": "BTP",
          "country": "IT",
          "currency": "EUR",
          "maturity": "2029-01-15",
          "coupon": 2.35,
          "yield": 2.42,
          "price": 99.85,
          "change": "+0.00",
          "lastUpdate": "2026-01-08"
        },
        {
          "isin": "IT0004889033",
          "name": "BTP 01/09/2028 4,75%",
          "type": "BTP",
          "country": "IT",
          "currency": "EUR",
          "maturity": "2028-09-01",
          "coupon": 4.75,
          "yield": 2.36,
          "price": 106.08,
          "change": "+0.00",
          "lastUpdate": "2026-01-08"
        },
        {
          "isin": "IT0005548315",
          "name": "BTP 01/08/2028 3,8%",
          "type": "BTP",
          "country": "IT",
          "currency": "EUR",
          "maturity": "2028-08-01",
          "coupon": 3.8,
          "yield": 2.36,
          "price": 103.59,
          "change": "+0.00",
          "lastUpdate": "2026-01-08"
        },
        {
          "isin": "IT0005340929",
          "name": "BTP 01/12/2028 2,8%",
          "type": "BTP",
          "country": "IT",
          "currency": "EUR",
          "maturity": "2028-12-01",
          "coupon": 2.8,
          "yield": 2.36,
          "price": 101.26,
          "change": "+0.00",
          "lastUpdate": "2026-01-08"
        },
        {
          "isin": "IT0005641029",
          "name": "BTP 15/06/2028 2,65%",
          "type": "BTP",
          "country": "IT",
          "currency": "EUR",
          "maturity": "2028-06-15",
          "coupon": 2.65,
          "yield": 2.36,
          "price": 100.72,
          "change": "+0.00",
          "lastUpdate": "2026-01-08"
        },
        {
          "isin": "IT0005547408",
          "name": "BTP VALORE 1 13/06/2027 STEP UP 3,25% - 4%",
          "type": "BTP",
          "country": "IT",
          "currency": "EUR",
          "maturity": "2027-06-13",
          "coupon": 3.25,
          "yield": 2.32,
          "price": 102.35,
          "change": "+0.00",
          "lastUpdate": "2026-01-08"
        },
        {
          "isin": "IT0005445306",
          "name": "BTP 15/07/2028 0,50%",
          "type": "BTP",
          "country": "IT",
          "currency": "EUR",
          "maturity": "2028-07-15",
          "coupon": 0.5,
          "yield": 2.31,
          "price": 95.64,
          "change": "+0.00",
          "lastUpdate": "2026-01-08"
        },
        {
          "isin": "IT0005521981",
          "name": "BTP 01/04/2028 3,4%",
          "type": "BTP",
          "country": "IT",
          "currency": "EUR",
          "maturity": "2028-04-01",
          "coupon": 3.4,
          "yield": 2.3,
          "price": 102.39,
          "change": "+0.00",
          "lastUpdate": "2026-01-08"
        },
        {
          "isin": "IT0005500068",
          "name": "BTP 01/12/2027 2,65%",
          "type": "BTP",
          "country": "IT",
          "currency": "EUR",
          "maturity": "2027-12-01",
          "coupon": 2.65,
          "yield": 2.24,
          "price": 100.77,
          "change": "+0.00",
          "lastUpdate": "2026-01-08"
        },
        {
          "isin": "IT0005433690",
          "name": "BTP 15/03/2028 0,25%",
          "type": "BTP",
          "country": "IT",
          "currency": "EUR",
          "maturity": "2028-03-15",
          "coupon": 0.25,
          "yield": 2.24,
          "price": 95.83,
          "change": "+0.00",
          "lastUpdate": "2026-01-08"
        },
        {
          "isin": "IT0001174611",
          "name": "BTP 01/11/2027 6,5%(No CACs)",
          "type": "BTP",
          "country": "IT",
          "currency": "EUR",
          "maturity": "2027-11-01",
          "coupon": 6.5,
          "yield": 2.22,
          "price": 107.53,
          "change": "+0.00",
          "lastUpdate": "2026-01-08"
        },
        {
          "isin": "IT0005622128",
          "name": "BTP 15/10/2027 2,7%",
          "type": "BTP",
          "country": "IT",
          "currency": "EUR",
          "maturity": "2027-10-15",
          "coupon": 2.7,
          "yield": 2.22,
          "price": 100.84,
          "change": "+0.00",
          "lastUpdate": "2026-01-08"
        },
        {
          "isin": "IT0005323032",
          "name": "BTP 01/02/2028 2%",
          "type": "BTP",
          "country": "IT",
          "currency": "EUR",
          "maturity": "2028-02-01",
          "coupon": 0,
          "yield": 2.21,
          "price": 99.6,
          "change": "+0.00",
          "lastUpdate": "2026-01-08"
        },
        {
          "isin": "IT0005657330",
          "name": "BTP 26/08/2027 2,1%",
          "type": "BTP",
          "country": "IT",
          "currency": "EUR",
          "maturity": "2027-08-26",
          "coupon": 2.1,
          "yield": 2.21,
          "price": 99.85,
          "change": "+0.00",
          "lastUpdate": "2026-01-08"
        },
        {
          "isin": "IT0005599904",
          "name": "BTP 15/07/2027 3,45%",
          "type": "BTP",
          "country": "IT",
          "currency": "EUR",
          "maturity": "2027-07-15",
          "coupon": 3.45,
          "yield": 2.2,
          "price": 101.87,
          "change": "+0.00",
          "lastUpdate": "2026-01-08"
        },
        {
          "isin": "IT0005633794",
          "name": "BTP 25/02/2027 2,55%",
          "type": "BTP",
          "country": "IT",
          "currency": "EUR",
          "maturity": "2027-02-25",
          "coupon": 2.55,
          "yield": 2.14,
          "price": 100.46,
          "change": "+0.00",
          "lastUpdate": "2026-01-08"
        },
        {
          "isin": "IT0005580045",
          "name": "BTP 15/02/2027 2,95%",
          "type": "BTP",
          "country": "IT",
          "currency": "EUR",
          "maturity": "2027-02-15",
          "coupon": 2.95,
          "yield": 2.14,
          "price": 100.88,
          "change": "+0.00",
          "lastUpdate": "2026-01-08"
        },
        {
          "isin": "IT0005274805",
          "name": "BTP 01/08/2027 2,05%",
          "type": "BTP",
          "country": "IT",
          "currency": "EUR",
          "maturity": "2027-08-01",
          "coupon": 2.05,
          "yield": 2.13,
          "price": 99.9,
          "change": "+0.00",
          "lastUpdate": "2026-01-08"
        },
        {
          "isin": "IT0005607269",
          "name": "BTP 28/08/2026 3,1%",
          "type": "BTP",
          "country": "IT",
          "currency": "EUR",
          "maturity": "2026-08-28",
          "coupon": 3.1,
          "yield": 2.12,
          "price": 100.62,
          "change": "+0.00",
          "lastUpdate": "2026-01-08"
        },
        {
          "isin": "IT0005484552",
          "name": "BTP 01/04/2027 1,10%",
          "type": "BTP",
          "country": "IT",
          "currency": "EUR",
          "maturity": "2027-04-01",
          "coupon": 1.1,
          "yield": 2.12,
          "price": 98.8,
          "change": "+0.00",
          "lastUpdate": "2026-01-08"
        },
        {
          "isin": "IT0005584302",
          "name": "BTP 28/01/2026 3,2%",
          "type": "BTP",
          "country": "IT",
          "currency": "EUR",
          "maturity": "2026-01-28",
          "coupon": 3.2,
          "yield": 2.11,
          "price": 100.05,
          "change": "+0.00",
          "lastUpdate": "2026-01-08"
        },
        {
          "isin": "IT0005556011",
          "name": "BTP 15/09/2026 3,85%",
          "type": "BTP",
          "country": "IT",
          "currency": "EUR",
          "maturity": "2026-09-15",
          "coupon": 3.85,
          "yield": 2.1,
          "price": 101.16,
          "change": "+0.00",
          "lastUpdate": "2026-01-08"
        },
        {
          "isin": "IT0005416570",
          "name": "BTP 15/09/2027 0,95%",
          "type": "BTP",
          "country": "IT",
          "currency": "EUR",
          "maturity": "2027-09-15",
          "coupon": 0.95,
          "yield": 2.1,
          "price": 98.14,
          "change": "+0.00",
          "lastUpdate": "2026-01-08"
        },
        {
          "isin": "IT0005538597",
          "name": "BTP 15/04/2026 3,8%",
          "type": "BTP",
          "country": "IT",
          "currency": "EUR",
          "maturity": "2026-04-15",
          "coupon": 3.8,
          "yield": 2.1,
          "price": 100.43,
          "change": "+0.00",
          "lastUpdate": "2026-01-08"
        },
        {
          "isin": "IT0001086567",
          "name": "BTP 01/11/2026 7,25%(No CACs)",
          "type": "BTP",
          "country": "IT",
          "currency": "EUR",
          "maturity": "2026-11-01",
          "coupon": 7.25,
          "yield": 2.08,
          "price": 104.09,
          "change": "+0.00",
          "lastUpdate": "2026-01-08"
        },
        {
          "isin": "IT0005240830",
          "name": "BTP 01/06/2027 2,2%",
          "type": "BTP",
          "country": "IT",
          "currency": "EUR",
          "maturity": "2027-06-01",
          "coupon": 2.2,
          "yield": 2.07,
          "price": 100.19,
          "change": "+0.00",
          "lastUpdate": "2026-01-08"
        },
        {
          "isin": "IT0005370306",
          "name": "BTP 15/07/2026 2,1%",
          "type": "BTP",
          "country": "IT",
          "currency": "EUR",
          "maturity": "2026-07-15",
          "coupon": 2.1,
          "yield": 2.06,
          "price": 100.03,
          "change": "+0.00",
          "lastUpdate": "2026-01-08"
        },
        {
          "isin": "IT0005390874",
          "name": "BTP 15/01/2027 0,85%",
          "type": "BTP",
          "country": "IT",
          "currency": "EUR",
          "maturity": "2027-01-15",
          "coupon": 0.85,
          "yield": 2.06,
          "price": 98.81,
          "change": "+0.00",
          "lastUpdate": "2026-01-08"
        },
        {
          "isin": "IT0004644735",
          "name": "BTP 01/03/2026 4,5%(No CACs)",
          "type": "BTP",
          "country": "IT",
          "currency": "EUR",
          "maturity": "2026-03-01",
          "coupon": 4.5,
          "yield": 2.05,
          "price": 100.32,
          "change": "+0.00",
          "lastUpdate": "2026-01-08"
        },
        {
          "isin": "IT0005454241",
          "name": "BTP 01/08/2026 0%",
          "type": "BTP",
          "country": "IT",
          "currency": "EUR",
          "maturity": "2026-08-01",
          "coupon": 0,
          "yield": 2.04,
          "price": 98.89,
          "change": "+0.00",
          "lastUpdate": "2026-01-08"
        },
        {
          "isin": "IT0005210650",
          "name": "BTP 01/12/2026 1,25%",
          "type": "BTP",
          "country": "IT",
          "currency": "EUR",
          "maturity": "2026-12-01",
          "coupon": 1.25,
          "yield": 2.03,
          "price": 99.33,
          "change": "+0.00",
          "lastUpdate": "2026-01-08"
        },
        {
          "isin": "IT0005419848",
          "name": "BTP 01/02/2026 0,50%",
          "type": "BTP",
          "country": "IT",
          "currency": "EUR",
          "maturity": "2026-02-01",
          "coupon": 0.5,
          "yield": 2.03,
          "price": 99.92,
          "change": "+0.00",
          "lastUpdate": "2026-01-08"
        },
        {
          "isin": "IT0005170839",
          "name": "BTP 01/06/2026 1,6%",
          "type": "BTP",
          "country": "IT",
          "currency": "EUR",
          "maturity": "2026-06-01",
          "coupon": 1.6,
          "yield": 2.02,
          "price": 99.84,
          "change": "+0.00",
          "lastUpdate": "2026-01-08"
        },
        {
          "isin": "IT0005437147",
          "name": "BTP 01/04/2026 0%",
          "type": "BTP",
          "country": "IT",
          "currency": "EUR",
          "maturity": "2026-04-01",
          "coupon": 0,
          "yield": 2.01,
          "price": 99.57,
          "change": "+0.00",
          "lastUpdate": "2026-01-08"
        }
      ]
    },
    "gov-it-bot": {
      "name": "BOT - Buoni Ordinari del Tesoro",
      "description": "Titoli di Stato italiani a breve termine",
      "count": 26,
      "bonds": [
        {
          "isin": "IT0005684888",
          "name": "BOT 14/12/2026 ZC",
          "type": "BOT",
          "country": "IT",
          "currency": "EUR",
          "maturity": "2026-12-14",
          "coupon": 0,
          "yield": 2.12,
          "price": 98.09,
          "change": "+0.00",
          "lastUpdate": "2026-01-08"
        },
        {
          "isin": "IT0005607269",
          "name": "BTP 28/08/2026 3,1%",
          "type": "BTP",
          "country": "IT",
          "currency": "EUR",
          "maturity": "2026-08-28",
          "coupon": 3.1,
          "yield": 2.12,
          "price": 100.62,
          "change": "+0.00",
          "lastUpdate": "2026-01-08"
        },
        {
          "isin": "IT0005678492",
          "name": "BOT 13/11/2026 ZC",
          "type": "BOT",
          "country": "IT",
          "currency": "EUR",
          "maturity": "2026-11-13",
          "coupon": 0,
          "yield": 2.12,
          "price": 98.27,
          "change": "+0.00",
          "lastUpdate": "2026-01-08"
        },
        {
          "isin": "IT0005584302",
          "name": "BTP 28/01/2026 3,2%",
          "type": "BTP",
          "country": "IT",
          "currency": "EUR",
          "maturity": "2026-01-28",
          "coupon": 3.2,
          "yield": 2.11,
          "price": 100.05,
          "change": "+0.00",
          "lastUpdate": "2026-01-08"
        },
        {
          "isin": "IT0005674335",
          "name": "BOT 14/10/2026 ZC",
          "type": "BOT",
          "country": "IT",
          "currency": "EUR",
          "maturity": "2026-10-14",
          "coupon": 0,
          "yield": 2.11,
          "price": 98.44,
          "change": "+0.00",
          "lastUpdate": "2026-01-08"
        },
        {
          "isin": "IT0005556011",
          "name": "BTP 15/09/2026 3,85%",
          "type": "BTP",
          "country": "IT",
          "currency": "EUR",
          "maturity": "2026-09-15",
          "coupon": 3.85,
          "yield": 2.1,
          "price": 101.16,
          "change": "+0.00",
          "lastUpdate": "2026-01-08"
        },
        {
          "isin": "IT0005669269",
          "name": "BOT 14/09/2026 ZC",
          "type": "BOT",
          "country": "IT",
          "currency": "EUR",
          "maturity": "2026-09-14",
          "coupon": 0,
          "yield": 2.1,
          "price": 98.61,
          "change": "+0.00",
          "lastUpdate": "2026-01-08"
        },
        {
          "isin": "IT0005666851",
          "name": "BOT 14/08/2026 ZC",
          "type": "BOT",
          "country": "IT",
          "currency": "EUR",
          "maturity": "2026-08-14",
          "coupon": 0,
          "yield": 2.1,
          "price": 98.79,
          "change": "+0.00",
          "lastUpdate": "2026-01-08"
        },
        {
          "isin": "IT0005538597",
          "name": "BTP 15/04/2026 3,8%",
          "type": "BTP",
          "country": "IT",
          "currency": "EUR",
          "maturity": "2026-04-15",
          "coupon": 3.8,
          "yield": 2.1,
          "price": 100.43,
          "change": "+0.00",
          "lastUpdate": "2026-01-08"
        },
        {
          "isin": "IT0001086567",
          "name": "BTP 01/11/2026 7,25%(No CACs)",
          "type": "BTP",
          "country": "IT",
          "currency": "EUR",
          "maturity": "2026-11-01",
          "coupon": 7.25,
          "yield": 2.08,
          "price": 104.09,
          "change": "+0.00",
          "lastUpdate": "2026-01-08"
        },
        {
          "isin": "IT0005660029",
          "name": "BOT 14/07/2026 ZC",
          "type": "BOT",
          "country": "IT",
          "currency": "EUR",
          "maturity": "2026-07-14",
          "coupon": 0,
          "yield": 2.07,
          "price": 98.98,
          "change": "+0.00",
          "lastUpdate": "2026-01-08"
        },
        {
          "isin": "IT0005670895",
          "name": "BOT 31/03/2026 ZC",
          "type": "BOT",
          "country": "IT",
          "currency": "EUR",
          "maturity": "2026-03-31",
          "coupon": 0,
          "yield": 2.07,
          "price": 99.56,
          "change": "+0.00",
          "lastUpdate": "2026-01-08"
        },
        {
          "isin": "IT0005370306",
          "name": "BTP 15/07/2026 2,1%",
          "type": "BTP",
          "country": "IT",
          "currency": "EUR",
          "maturity": "2026-07-15",
          "coupon": 2.1,
          "yield": 2.06,
          "price": 100.03,
          "change": "+0.00",
          "lastUpdate": "2026-01-08"
        },
        {
          "isin": "IT0005680639",
          "name": "BOT 29/05/2026 ZC",
          "type": "BOT",
          "country": "IT",
          "currency": "EUR",
          "maturity": "2026-05-29",
          "coupon": 0,
          "yield": 2.06,
          "price": 99.24,
          "change": "+0.00",
          "lastUpdate": "2026-01-08"
        },
        {
          "isin": "IT0005645509",
          "name": "BOT 14/04/2026 ZC",
          "type": "BOT",
          "country": "IT",
          "currency": "EUR",
          "maturity": "2026-04-14",
          "coupon": 0,
          "yield": 2.06,
          "price": 99.49,
          "change": "+0.00",
          "lastUpdate": "2026-01-08"
        },
        {
          "isin": "IT0005655037",
          "name": "BOT 12/06/2026 ZC",
          "type": "BOT",
          "country": "IT",
          "currency": "EUR",
          "maturity": "2026-06-12",
          "coupon": 0,
          "yield": 2.05,
          "price": 99.16,
          "change": "+0.00",
          "lastUpdate": "2026-01-08"
        },
        {
          "isin": "IT0004644735",
          "name": "BTP 01/03/2026 4,5%(No CACs)",
          "type": "BTP",
          "country": "IT",
          "currency": "EUR",
          "maturity": "2026-03-01",
          "coupon": 4.5,
          "yield": 2.05,
          "price": 100.32,
          "change": "+0.00",
          "lastUpdate": "2026-01-08"
        },
        {
          "isin": "IT0005664484",
          "name": "BOT 30/01/2026 ZC",
          "type": "BOT",
          "country": "IT",
          "currency": "EUR",
          "maturity": "2026-01-30",
          "coupon": 0,
          "yield": 2.05,
          "price": 99.9,
          "change": "+0.00",
          "lastUpdate": "2026-01-08"
        },
        {
          "isin": "IT0005454241",
          "name": "BTP 01/08/2026 0%",
          "type": "BTP",
          "country": "IT",
          "currency": "EUR",
          "maturity": "2026-08-01",
          "coupon": 0,
          "yield": 2.04,
          "price": 98.89,
          "change": "+0.00",
          "lastUpdate": "2026-01-08"
        },
        {
          "isin": "IT0005650574",
          "name": "BOT 14/05/2026 ZC",
          "type": "BOT",
          "country": "IT",
          "currency": "EUR",
          "maturity": "2026-05-14",
          "coupon": 0,
          "yield": 2.04,
          "price": 99.33,
          "change": "+0.00",
          "lastUpdate": "2026-01-08"
        },
        {
          "isin": "IT0005210650",
          "name": "BTP 01/12/2026 1,25%",
          "type": "BTP",
          "country": "IT",
          "currency": "EUR",
          "maturity": "2026-12-01",
          "coupon": 1.25,
          "yield": 2.03,
          "price": 99.33,
          "change": "+0.00",
          "lastUpdate": "2026-01-08"
        },
        {
          "isin": "IT0005640666",
          "name": "BOT 13/03/2026 ZC",
          "type": "BOT",
          "country": "IT",
          "currency": "EUR",
          "maturity": "2026-03-13",
          "coupon": 0,
          "yield": 2.03,
          "price": 99.67,
          "change": "+0.00",
          "lastUpdate": "2026-01-08"
        },
        {
          "isin": "IT0005419848",
          "name": "BTP 01/02/2026 0,50%",
          "type": "BTP",
          "country": "IT",
          "currency": "EUR",
          "maturity": "2026-02-01",
          "coupon": 0.5,
          "yield": 2.03,
          "price": 99.92,
          "change": "+0.00",
          "lastUpdate": "2026-01-08"
        },
        {
          "isin": "IT0005170839",
          "name": "BTP 01/06/2026 1,6%",
          "type": "BTP",
          "country": "IT",
          "currency": "EUR",
          "maturity": "2026-06-01",
          "coupon": 1.6,
          "yield": 2.02,
          "price": 99.84,
          "change": "+0.00",
          "lastUpdate": "2026-01-08"
        },
        {
          "isin": "IT0005437147",
          "name": "BTP 01/04/2026 0%",
          "type": "BTP",
          "country": "IT",
          "currency": "EUR",
          "maturity": "2026-04-01",
          "coupon": 0,
          "yield": 2.01,
          "price": 99.57,
          "change": "+0.00",
          "lastUpdate": "2026-01-08"
        },
        {
          "isin": "IT0005635351",
          "name": "BOT 13/02/2026 ZC",
          "type": "BOT",
          "country": "IT",
          "currency": "EUR",
          "maturity": "2026-02-13",
          "coupon": 0,
          "yield": 1.96,
          "price": 99.83,
          "change": "+0.00",
          "lastUpdate": "2026-01-08"
        }
      ]
    },
    "gov-it-cct": {
      "name": "CCT - Certificati di Credito del Tesoro",
      "description": "Titoli di Stato italiani a tasso variabile",
      "count": 0,
      "bonds": []
    },
    "gov-it-ctz": {
      "name": "CTZ - Certificati del Tesoro Zero Coupon",
      "description": "Titoli di Stato italiani zero coupon",
      "count": 0,
      "bonds": []
    },
    "gov-eu-germany": {
      "name": "Germania - Bund",
      "description": "Titoli di Stato tedeschi",
      "count": 71,
      "bonds": [
        {
          "isin": "DE0001102572",
          "name": "GERMANIA 15/08/2052 0%",
          "type": "BOND",
          "country": "DE",
          "currency": "EUR",
          "maturity": "2052-08-15",
          "coupon": 0,
          "yield": 3.49,
          "price": 40.17,
          "change": "+0.00",
          "lastUpdate": "2026-01-08"
        },
        {
          "isin": "DE0001102481",
          "name": "GERMANIA 15/08/2050 0%",
          "type": "BOND",
          "country": "DE",
          "currency": "EUR",
          "maturity": "2050-08-15",
          "coupon": 0,
          "yield": 3.48,
          "price": 43.1,
          "change": "+0.00",
          "lastUpdate": "2026-01-08"
        },
        {
          "isin": "DE000BU2D012",
          "name": "GERMANIA 15/08/2056 2,9%",
          "type": "BOND",
          "country": "DE",
          "currency": "EUR",
          "maturity": "2056-08-15",
          "coupon": 2.9,
          "yield": 3.47,
          "price": 89.37,
          "change": "+0.00",
          "lastUpdate": "2026-01-08"
        },
        {
          "isin": "DE0001102614",
          "name": "GERMANIA 15/08/2053 1,8%",
          "type": "BOND",
          "country": "DE",
          "currency": "EUR",
          "maturity": "2053-08-15",
          "coupon": 1.8,
          "yield": 3.47,
          "price": 70.69,
          "change": "+0.00",
          "lastUpdate": "2026-01-08"
        },
        {
          "isin": "DE000BU2D004",
          "name": "GERMANIA 15/08/2054 2,5%",
          "type": "BOND",
          "country": "DE",
          "currency": "EUR",
          "maturity": "2054-08-15",
          "coupon": 2.5,
          "yield": 3.46,
          "price": 82.75,
          "change": "+0.00",
          "lastUpdate": "2026-01-08"
        },
        {
          "isin": "DE0001030757",
          "name": "GERMANIA GREEN BOND 15/08/2053 1,8%",
          "type": "BOND",
          "country": "DE",
          "currency": "EUR",
          "maturity": "2053-08-15",
          "coupon": 1.8,
          "yield": 3.45,
          "price": 70.88,
          "change": "+0.00",
          "lastUpdate": "2026-01-08"
        },
        {
          "isin": "DE0001030724",
          "name": "GERMANIA GREEN BOND 15/08/2050 0%",
          "type": "BOND",
          "country": "DE",
          "currency": "EUR",
          "maturity": "2050-08-15",
          "coupon": 0,
          "yield": 3.45,
          "price": 43.4,
          "change": "+0.00",
          "lastUpdate": "2026-01-08"
        },
        {
          "isin": "DE0001102432",
          "name": "GERMANIA 15/08/2048 1,25%",
          "type": "BOND",
          "country": "DE",
          "currency": "EUR",
          "maturity": "2048-08-15",
          "coupon": 1.25,
          "yield": 3.42,
          "price": 66.19,
          "change": "+0.00",
          "lastUpdate": "2026-01-08"
        },
        {
          "isin": "DE0001102341",
          "name": "GERMANIA 15/08/2046 2,5%",
          "type": "BOND",
          "country": "DE",
          "currency": "EUR",
          "maturity": "2046-08-15",
          "coupon": 2.5,
          "yield": 3.37,
          "price": 87.24,
          "change": "+0.00",
          "lastUpdate": "2026-01-08"
        },
        {
          "isin": "DE0001135481",
          "name": "GERMANIA 04/07/2044 2,5%",
          "type": "BOND",
          "country": "DE",
          "currency": "EUR",
          "maturity": "2044-07-04",
          "coupon": 2.5,
          "yield": 3.32,
          "price": 88.76,
          "change": "+0.00",
          "lastUpdate": "2026-01-08"
        },
        {
          "isin": "DE0001135432",
          "name": "GERMANIA 04/07/2042 3,25%",
          "type": "BOND",
          "country": "DE",
          "currency": "EUR",
          "maturity": "2042-07-04",
          "coupon": 3.25,
          "yield": 3.26,
          "price": 99.89,
          "change": "+0.00",
          "lastUpdate": "2026-01-08"
        },
        {
          "isin": "DE000BU2F009",
          "name": "GERMANIA 15/05/2041 2,6%",
          "type": "BOND",
          "country": "DE",
          "currency": "EUR",
          "maturity": "2041-05-15",
          "coupon": 2.6,
          "yield": 3.21,
          "price": 92.66,
          "change": "+0.00",
          "lastUpdate": "2026-01-08"
        },
        {
          "isin": "DE0001135366",
          "name": "GERMANIA 04/07/2040 4,75%",
          "type": "BOND",
          "country": "DE",
          "currency": "EUR",
          "maturity": "2040-07-04",
          "coupon": 4.75,
          "yield": 3.15,
          "price": 118.4,
          "change": "+0.00",
          "lastUpdate": "2026-01-08"
        },
        {
          "isin": "DE0001135325",
          "name": "GERMANIA 04/07/2039 4,25%",
          "type": "BOND",
          "country": "DE",
          "currency": "EUR",
          "maturity": "2039-07-04",
          "coupon": 4.25,
          "yield": 3.1,
          "price": 112.55,
          "change": "+0.00",
          "lastUpdate": "2026-01-08"
        },
        {
          "isin": "DE0001102598",
          "name": "GERMANIA 15/05/2038 1%",
          "type": "BOND",
          "country": "DE",
          "currency": "EUR",
          "maturity": "2038-05-15",
          "coupon": 0,
          "yield": 3.09,
          "price": 78.84,
          "change": "+0.00",
          "lastUpdate": "2026-01-08"
        },
        {
          "isin": "DE0001135275",
          "name": "GERMANIA 04/01/2037 4%",
          "type": "BOND",
          "country": "DE",
          "currency": "EUR",
          "maturity": "2037-01-04",
          "coupon": 0,
          "yield": 2.95,
          "price": 109.73,
          "change": "+0.00",
          "lastUpdate": "2026-01-08"
        },
        {
          "isin": "DE0001102549",
          "name": "GERMANIA 15/05/2036 0%",
          "type": "BOND",
          "country": "DE",
          "currency": "EUR",
          "maturity": "2036-05-15",
          "coupon": 0,
          "yield": 2.93,
          "price": 74.21,
          "change": "+0.00",
          "lastUpdate": "2026-01-08"
        },
        {
          "isin": "DE0001102515",
          "name": "GERMANIA 15/05/2035 0%",
          "type": "BOND",
          "country": "DE",
          "currency": "EUR",
          "maturity": "2035-05-15",
          "coupon": 0,
          "yield": 2.84,
          "price": 77,
          "change": "+0.00",
          "lastUpdate": "2026-01-08"
        },
        {
          "isin": "DE000BU2Z056",
          "name": "GERMANIA 15/08/2035 2,6%",
          "type": "BOND",
          "country": "DE",
          "currency": "EUR",
          "maturity": "2035-08-15",
          "coupon": 2.6,
          "yield": 2.83,
          "price": 98.05,
          "change": "+0.00",
          "lastUpdate": "2026-01-08"
        },
        {
          "isin": "DE000BU2Z049",
          "name": "GERMANIA 15/02/2035 2,5%",
          "type": "BOND",
          "country": "DE",
          "currency": "EUR",
          "maturity": "2035-02-15",
          "coupon": 2.5,
          "yield": 2.79,
          "price": 97.7,
          "change": "+0.00",
          "lastUpdate": "2026-01-08"
        },
        {
          "isin": "DE000BU3Z047",
          "name": "GERMANIA GREEN BOND 15/02/2035 2,5%",
          "type": "BOND",
          "country": "DE",
          "currency": "EUR",
          "maturity": "2035-02-15",
          "coupon": 2.5,
          "yield": 2.77,
          "price": 97.85,
          "change": "+0.00",
          "lastUpdate": "2026-01-08"
        },
        {
          "isin": "DE000BU2Z031",
          "name": "GERMANIA 15/08/2034 2,6%",
          "type": "BOND",
          "country": "DE",
          "currency": "EUR",
          "maturity": "2034-08-15",
          "coupon": 2.6,
          "yield": 2.75,
          "price": 98.83,
          "change": "+0.00",
          "lastUpdate": "2026-01-08"
        },
        {
          "isin": "DE000BU2Z023",
          "name": "GERMANIA 15/02/2034 2,2%",
          "type": "BOND",
          "country": "DE",
          "currency": "EUR",
          "maturity": "2034-02-15",
          "coupon": 2.2,
          "yield": 2.72,
          "price": 96.24,
          "change": "+0.00",
          "lastUpdate": "2026-01-08"
        },
        {
          "isin": "DE0001135226",
          "name": "GERMANIA 04/07/2034 4,75%",
          "type": "BOND",
          "country": "DE",
          "currency": "EUR",
          "maturity": "2034-07-04",
          "coupon": 4.75,
          "yield": 2.7,
          "price": 115.29,
          "change": "+0.00",
          "lastUpdate": "2026-01-08"
        },
        {
          "isin": "DE000BU2Z015",
          "name": "GERMANIA 15/08/2033 2,6%",
          "type": "BOND",
          "country": "DE",
          "currency": "EUR",
          "maturity": "2033-08-15",
          "coupon": 2.6,
          "yield": 2.68,
          "price": 99.43,
          "change": "+0.00",
          "lastUpdate": "2026-01-08"
        },
        {
          "isin": "DE000BU2Z007",
          "name": "GERMANIA 15/02/2033 2,3%",
          "type": "BOND",
          "country": "DE",
          "currency": "EUR",
          "maturity": "2033-02-15",
          "coupon": 2.3,
          "yield": 2.63,
          "price": 97.91,
          "change": "+0.00",
          "lastUpdate": "2026-01-08"
        },
        {
          "isin": "DE000BU3Z005",
          "name": "GERMANIA GREEN BOND 15/02/2033 2,3%",
          "type": "BOND",
          "country": "DE",
          "currency": "EUR",
          "maturity": "2033-02-15",
          "coupon": 2.3,
          "yield": 2.62,
          "price": 97.93,
          "change": "+0.00",
          "lastUpdate": "2026-01-08"
        },
        {
          "isin": "DE0001102606",
          "name": "GERMANIA 15/08/2032 1,7%",
          "type": "BOND",
          "country": "DE",
          "currency": "EUR",
          "maturity": "2032-08-15",
          "coupon": 1.7,
          "yield": 2.57,
          "price": 94.78,
          "change": "+0.00",
          "lastUpdate": "2026-01-08"
        },
        {
          "isin": "DE000BU27014",
          "name": "GERMANIA 15/11/2032 2,5%",
          "type": "BOND",
          "country": "DE",
          "currency": "EUR",
          "maturity": "2032-11-15",
          "coupon": 2.5,
          "yield": 2.53,
          "price": 99.8,
          "change": "+0.00",
          "lastUpdate": "2026-01-08"
        },
        {
          "isin": "DE0001102580",
          "name": "GERMANIA 15/02/2032 0%",
          "type": "BOND",
          "country": "DE",
          "currency": "EUR",
          "maturity": "2032-02-15",
          "coupon": 0,
          "yield": 2.52,
          "price": 85.95,
          "change": "+0.00",
          "lastUpdate": "2026-01-08"
        },
        {
          "isin": "DE0001030732",
          "name": "GERMANIA GREEN BOND 15/08/2031 0%",
          "type": "BOND",
          "country": "DE",
          "currency": "EUR",
          "maturity": "2031-08-15",
          "coupon": 0,
          "yield": 2.46,
          "price": 87.31,
          "change": "+0.00",
          "lastUpdate": "2026-01-08"
        },
        {
          "isin": "DE0001102564",
          "name": "GERMANIA 15/08/2031 0%",
          "type": "BOND",
          "country": "DE",
          "currency": "EUR",
          "maturity": "2031-08-15",
          "coupon": 0,
          "yield": 2.46,
          "price": 87.31,
          "change": "+0.00",
          "lastUpdate": "2026-01-08"
        },
        {
          "isin": "DE0001135176",
          "name": "GERMANIA 04/01/2031 5,5%",
          "type": "BOND",
          "country": "DE",
          "currency": "EUR",
          "maturity": "2031-01-04",
          "coupon": 5.5,
          "yield": 2.44,
          "price": 114.2,
          "change": "+0.00",
          "lastUpdate": "2026-01-08"
        },
        {
          "isin": "DE000BU25059",
          "name": "GERMANIA 10/10/2030 2,2%",
          "type": "BOND",
          "country": "DE",
          "currency": "EUR",
          "maturity": "2030-10-10",
          "coupon": 2.2,
          "yield": 2.41,
          "price": 99.04,
          "change": "+0.00",
          "lastUpdate": "2026-01-08"
        },
        {
          "isin": "DE000BU27006",
          "name": "GERMANIA 15/11/2030 2,4%",
          "type": "BOND",
          "country": "DE",
          "currency": "EUR",
          "maturity": "2030-11-15",
          "coupon": 2.4,
          "yield": 2.41,
          "price": 99.94,
          "change": "+0.00",
          "lastUpdate": "2026-01-08"
        },
        {
          "isin": "DE0001102531",
          "name": "GERMANIA 15/02/2031 0%",
          "type": "BOND",
          "country": "DE",
          "currency": "EUR",
          "maturity": "2031-02-15",
          "coupon": 0,
          "yield": 2.41,
          "price": 88.59,
          "change": "+0.00",
          "lastUpdate": "2026-01-08"
        },
        {
          "isin": "DE000BU25042",
          "name": "GERMANIA 18/04/2030 2,4%",
          "type": "BOND",
          "country": "DE",
          "currency": "EUR",
          "maturity": "2030-04-18",
          "coupon": 2.4,
          "yield": 2.36,
          "price": 100.17,
          "change": "+0.00",
          "lastUpdate": "2026-01-08"
        },
        {
          "isin": "DE0001102507",
          "name": "GERMANIA 15/08/2030 0%",
          "type": "BOND",
          "country": "DE",
          "currency": "EUR",
          "maturity": "2030-08-15",
          "coupon": 0,
          "yield": 2.35,
          "price": 89.88,
          "change": "+0.00",
          "lastUpdate": "2026-01-08"
        },
        {
          "isin": "DE0001030708",
          "name": "GERMANIA GREEN BOND 15/08/2030 0%",
          "type": "BOND",
          "country": "DE",
          "currency": "EUR",
          "maturity": "2030-08-15",
          "coupon": 0,
          "yield": 2.35,
          "price": 89.9,
          "change": "+0.00",
          "lastUpdate": "2026-01-08"
        },
        {
          "isin": "DE0001102499",
          "name": "GERMANIA 15/02/2030 0%",
          "type": "BOND",
          "country": "DE",
          "currency": "EUR",
          "maturity": "2030-02-15",
          "coupon": 0,
          "yield": 2.33,
          "price": 91.02,
          "change": "+0.00",
          "lastUpdate": "2026-01-08"
        },
        {
          "isin": "DE0001135143",
          "name": "GERMANIA 04/01/2030 6,25%",
          "type": "BOND",
          "country": "DE",
          "currency": "EUR",
          "maturity": "2030-01-04",
          "coupon": 6.25,
          "yield": 2.32,
          "price": 114.79,
          "change": "+0.00",
          "lastUpdate": "2026-01-08"
        },
        {
          "isin": "DE000BU25034",
          "name": "GERMANIA 11/10/2029 2,5%",
          "type": "BOND",
          "country": "DE",
          "currency": "EUR",
          "maturity": "2029-10-11",
          "coupon": 2.5,
          "yield": 2.31,
          "price": 100.68,
          "change": "+0.00",
          "lastUpdate": "2026-01-08"
        },
        {
          "isin": "DE0001102622",
          "name": "GERMANIA 15/11/2029 2,1%",
          "type": "BOND",
          "country": "DE",
          "currency": "EUR",
          "maturity": "2029-11-15",
          "coupon": 2.1,
          "yield": 2.3,
          "price": 99.26,
          "change": "+0.00",
          "lastUpdate": "2026-01-08"
        },
        {
          "isin": "DE0001102473",
          "name": "GERMANIA 15/08/2029 0%",
          "type": "BOND",
          "country": "DE",
          "currency": "EUR",
          "maturity": "2029-08-15",
          "coupon": 0,
          "yield": 2.26,
          "price": 92.3,
          "change": "+0.00",
          "lastUpdate": "2026-01-08"
        },
        {
          "isin": "DE000BU35025",
          "name": "GERMANIA GREEN BOND 12/04/2029 2,1%",
          "type": "BOND",
          "country": "DE",
          "currency": "EUR",
          "maturity": "2029-04-12",
          "coupon": 2.1,
          "yield": 2.24,
          "price": 99.56,
          "change": "+0.00",
          "lastUpdate": "2026-01-08"
        },
        {
          "isin": "DE000BU25026",
          "name": "GERMANIA 12/04/2029 2,1%",
          "type": "BOND",
          "country": "DE",
          "currency": "EUR",
          "maturity": "2029-04-12",
          "coupon": 2.1,
          "yield": 2.24,
          "price": 99.57,
          "change": "+0.00",
          "lastUpdate": "2026-01-08"
        },
        {
          "isin": "DE0001102465",
          "name": "GERMANIA 15/02/2029 0,25%",
          "type": "BOND",
          "country": "DE",
          "currency": "EUR",
          "maturity": "2029-02-15",
          "coupon": 0.25,
          "yield": 2.2,
          "price": 94.24,
          "change": "+0.00",
          "lastUpdate": "2026-01-08"
        },
        {
          "isin": "DE000BU25018",
          "name": "GERMANIA 19/10/2028 2,4%",
          "type": "BOND",
          "country": "DE",
          "currency": "EUR",
          "maturity": "2028-10-19",
          "coupon": 2.4,
          "yield": 2.17,
          "price": 100.61,
          "change": "+0.00",
          "lastUpdate": "2026-01-08"
        },
        {
          "isin": "DE0001102556",
          "name": "GERMANIA 15/11/2028 0%",
          "type": "BOND",
          "country": "DE",
          "currency": "EUR",
          "maturity": "2028-11-15",
          "coupon": 0,
          "yield": 2.14,
          "price": 94.16,
          "change": "+0.00",
          "lastUpdate": "2026-01-08"
        },
        {
          "isin": "DE0001135069",
          "name": "GERMANIA 04/01/2028 5,625%",
          "type": "BOND",
          "country": "DE",
          "currency": "EUR",
          "maturity": "2028-01-04",
          "coupon": 5.625,
          "yield": 2.11,
          "price": 106.73,
          "change": "+0.00",
          "lastUpdate": "2026-01-08"
        },
        {
          "isin": "DE0001135085",
          "name": "GERMANIA 04/07/2028 4,75%",
          "type": "BOND",
          "country": "DE",
          "currency": "EUR",
          "maturity": "2028-07-04",
          "coupon": 4.75,
          "yield": 2.11,
          "price": 106.28,
          "change": "+0.00",
          "lastUpdate": "2026-01-08"
        },
        {
          "isin": "DE0001102457",
          "name": "GERMANIA 15/08/2028 0,25%",
          "type": "BOND",
          "country": "DE",
          "currency": "EUR",
          "maturity": "2028-08-15",
          "coupon": 0.25,
          "yield": 2.11,
          "price": 95.36,
          "change": "+0.00",
          "lastUpdate": "2026-01-08"
        },
        {
          "isin": "DE000BU25000",
          "name": "GERMANIA 13/04/2028 2,2%",
          "type": "BOND",
          "country": "DE",
          "currency": "EUR",
          "maturity": "2028-04-13",
          "coupon": 2.2,
          "yield": 2.1,
          "price": 100.2,
          "change": "+0.00",
          "lastUpdate": "2026-01-08"
        },
        {
          "isin": "DE0001135044",
          "name": "GERMANIA 04/07/2027 6,5%",
          "type": "BOND",
          "country": "DE",
          "currency": "EUR",
          "maturity": "2027-07-04",
          "coupon": 6.5,
          "yield": 2.08,
          "price": 106.33,
          "change": "+0.00",
          "lastUpdate": "2026-01-08"
        },
        {
          "isin": "DE0001141836",
          "name": "GERMANIA 10/04/2026 0%",
          "type": "BOND",
          "country": "DE",
          "currency": "EUR",
          "maturity": "2026-04-10",
          "coupon": 0,
          "yield": 2.06,
          "price": 99.51,
          "change": "+0.00",
          "lastUpdate": "2026-01-08"
        },
        {
          "isin": "DE0001102440",
          "name": "GERMANIA 15/02/2028 0,5%",
          "type": "BOND",
          "country": "DE",
          "currency": "EUR",
          "maturity": "2028-02-15",
          "coupon": 0.5,
          "yield": 2.06,
          "price": 96.84,
          "change": "+0.00",
          "lastUpdate": "2026-01-08"
        },
        {
          "isin": "DE0001102424",
          "name": "GERMANIA 15/08/2027 0,5%",
          "type": "BOND",
          "country": "DE",
          "currency": "EUR",
          "maturity": "2027-08-15",
          "coupon": 0.5,
          "yield": 2.05,
          "price": 97.6,
          "change": "+0.00",
          "lastUpdate": "2026-01-08"
        },
        {
          "isin": "DE000BU22080",
          "name": "GERMANIA 11/03/2027 2,2%",
          "type": "BOND",
          "country": "DE",
          "currency": "EUR",
          "maturity": "2027-03-11",
          "coupon": 2.2,
          "yield": 2.05,
          "price": 100.17,
          "change": "+0.00",
          "lastUpdate": "2026-01-08"
        },
        {
          "isin": "DE000BU22049",
          "name": "GERMANIA 19/03/2026 2,5%",
          "type": "BOND",
          "country": "DE",
          "currency": "EUR",
          "maturity": "2026-03-19",
          "coupon": 2.5,
          "yield": 2.04,
          "price": 100.08,
          "change": "+0.00",
          "lastUpdate": "2026-01-08"
        },
        {
          "isin": "DE0001141869",
          "name": "GERMANIA 15/10/2027 1,3%",
          "type": "BOND",
          "country": "DE",
          "currency": "EUR",
          "maturity": "2027-10-15",
          "coupon": 1.3,
          "yield": 2.04,
          "price": 98.73,
          "change": "+0.00",
          "lastUpdate": "2026-01-08"
        },
        {
          "isin": "DE0001102523",
          "name": "GERMANIA 15/11/2027 0%",
          "type": "BOND",
          "country": "DE",
          "currency": "EUR",
          "maturity": "2027-11-15",
          "coupon": 0,
          "yield": 2.03,
          "price": 96.36,
          "change": "+0.00",
          "lastUpdate": "2026-01-08"
        },
        {
          "isin": "DE0001030740",
          "name": "GERMANIA GREEN BOND 15/10/2027 1,3%",
          "type": "BOND",
          "country": "DE",
          "currency": "EUR",
          "maturity": "2027-10-15",
          "coupon": 1.3,
          "yield": 2.02,
          "price": 98.76,
          "change": "+0.00",
          "lastUpdate": "2026-01-08"
        },
        {
          "isin": "DE000BU22064",
          "name": "GERMANIA 17/09/2026 2,7%",
          "type": "BOND",
          "country": "DE",
          "currency": "EUR",
          "maturity": "2026-09-17",
          "coupon": 2.7,
          "yield": 2.02,
          "price": 100.45,
          "change": "+0.00",
          "lastUpdate": "2026-01-08"
        },
        {
          "isin": "DE0001102390",
          "name": "GERMANIA 15/02/2026 0,5%",
          "type": "BOND",
          "country": "DE",
          "currency": "EUR",
          "maturity": "2026-02-15",
          "coupon": 0.5,
          "yield": 2.02,
          "price": 99.86,
          "change": "+0.00",
          "lastUpdate": "2026-01-08"
        },
        {
          "isin": "DE000BU22056",
          "name": "GERMANIA 18/06/2026 2,9%",
          "type": "BOND",
          "country": "DE",
          "currency": "EUR",
          "maturity": "2026-06-18",
          "coupon": 2.9,
          "yield": 2,
          "price": 100.37,
          "change": "+0.00",
          "lastUpdate": "2026-01-08"
        },
        {
          "isin": "DE0001141851",
          "name": "GERMANIA 16/04/2027 0%",
          "type": "BOND",
          "country": "DE",
          "currency": "EUR",
          "maturity": "2027-04-16",
          "coupon": 0,
          "yield": 1.99,
          "price": 97.55,
          "change": "+0.00",
          "lastUpdate": "2026-01-08"
        },
        {
          "isin": "DE000BU22072",
          "name": "GERMANIA 10/12/2026 2%",
          "type": "BOND",
          "country": "DE",
          "currency": "EUR",
          "maturity": "2026-12-10",
          "coupon": 0,
          "yield": 1.99,
          "price": 100.01,
          "change": "+0.00",
          "lastUpdate": "2026-01-08"
        },
        {
          "isin": "DE0001102416",
          "name": "GERMANIA 15/02/2027 0,25%",
          "type": "BOND",
          "country": "DE",
          "currency": "EUR",
          "maturity": "2027-02-15",
          "coupon": 0.25,
          "yield": 1.97,
          "price": 98.16,
          "change": "+0.00",
          "lastUpdate": "2026-01-08"
        },
        {
          "isin": "DE0001141844",
          "name": "GERMANIA 09/10/2026 0%",
          "type": "BOND",
          "country": "DE",
          "currency": "EUR",
          "maturity": "2026-10-09",
          "coupon": 0,
          "yield": 1.97,
          "price": 98.57,
          "change": "+0.00",
          "lastUpdate": "2026-01-08"
        },
        {
          "isin": "DE0001102408",
          "name": "GERMANIA 15/08/2026 0%",
          "type": "BOND",
          "country": "DE",
          "currency": "EUR",
          "maturity": "2026-08-15",
          "coupon": 0,
          "yield": 1.96,
          "price": 98.86,
          "change": "+0.00",
          "lastUpdate": "2026-01-08"
        },
        {
          "isin": "DE000BU22114",
          "name": "GERMANIA 16/12/2027 2%",
          "type": "BOND",
          "country": "DE",
          "currency": "EUR",
          "maturity": "2027-12-16",
          "coupon": 0,
          "yield": 1.85,
          "price": 100.27,
          "change": "+0.00",
          "lastUpdate": "2026-01-08"
        }
      ]
    },
    "gov-eu-france": {
      "name": "Francia - OAT",
      "description": "Titoli di Stato francesi",
      "count": 51,
      "bonds": [
        {
          "isin": "FR0010870956",
          "name": "FRANCIA 25/04/2060 4%",
          "type": "BOND",
          "country": "FR",
          "currency": "EUR",
          "maturity": "2060-04-25",
          "coupon": 0,
          "yield": 4.5,
          "price": 91.35,
          "change": "+0.00",
          "lastUpdate": "2026-01-08"
        },
        {
          "isin": "FR0013154028",
          "name": "FRANCIA 25/05/2066 1,75%",
          "type": "BOND",
          "country": "FR",
          "currency": "EUR",
          "maturity": "2066-05-25",
          "coupon": 1.75,
          "yield": 4.48,
          "price": 49.43,
          "change": "+0.00",
          "lastUpdate": "2026-01-08"
        },
        {
          "isin": "FR001400OHF4",
          "name": "FRANCIA 25/05/2055 3,25%",
          "type": "BOND",
          "country": "FR",
          "currency": "EUR",
          "maturity": "2055-05-25",
          "coupon": 3.25,
          "yield": 4.47,
          "price": 80.31,
          "change": "+0.00",
          "lastUpdate": "2026-01-08"
        },
        {
          "isin": "FR001400FTH3",
          "name": "FRANCIA 25/05/2054 3%",
          "type": "BOND",
          "country": "FR",
          "currency": "EUR",
          "maturity": "2054-05-25",
          "coupon": 0,
          "yield": 4.44,
          "price": 77.01,
          "change": "+0.00",
          "lastUpdate": "2026-01-08"
        },
        {
          "isin": "FR0010171975",
          "name": "FRANCIA 25/04/2055 4%",
          "type": "BOND",
          "country": "FR",
          "currency": "EUR",
          "maturity": "2055-04-25",
          "coupon": 0,
          "yield": 4.43,
          "price": 92.93,
          "change": "+0.00",
          "lastUpdate": "2026-01-08"
        },
        {
          "isin": "FR0014004J31",
          "name": "FRANCIA 25/05/2053 0,75%",
          "type": "BOND",
          "country": "FR",
          "currency": "EUR",
          "maturity": "2053-05-25",
          "coupon": 0.75,
          "yield": 4.43,
          "price": 42.29,
          "change": "+0.00",
          "lastUpdate": "2026-01-08"
        },
        {
          "isin": "FR0013480613",
          "name": "FRANCIA 25/05/2052 0,75%",
          "type": "BOND",
          "country": "FR",
          "currency": "EUR",
          "maturity": "2052-05-25",
          "coupon": 0.75,
          "yield": 4.39,
          "price": 43.83,
          "change": "+0.00",
          "lastUpdate": "2026-01-08"
        },
        {
          "isin": "FR0013404969",
          "name": "FRANCIA 25/05/2050 1,5%",
          "type": "BOND",
          "country": "FR",
          "currency": "EUR",
          "maturity": "2050-05-25",
          "coupon": 1.5,
          "yield": 4.35,
          "price": 57.71,
          "change": "+0.00",
          "lastUpdate": "2026-01-08"
        },
        {
          "isin": "FR001400NEF3",
          "name": "FRANCIA GREEN BOND 25/06/2049 3%",
          "type": "BOND",
          "country": "FR",
          "currency": "EUR",
          "maturity": "2049-06-25",
          "coupon": 0,
          "yield": 4.31,
          "price": 80.95,
          "change": "+0.00",
          "lastUpdate": "2026-01-08"
        },
        {
          "isin": "FR0013257524",
          "name": "FRANCIA 25/05/2048 2%",
          "type": "BOND",
          "country": "FR",
          "currency": "EUR",
          "maturity": "2048-05-25",
          "coupon": 0,
          "yield": 4.3,
          "price": 67.39,
          "change": "+0.00",
          "lastUpdate": "2026-01-08"
        },
        {
          "isin": "FR0014001NN8",
          "name": "FRANCIA 25/05/2072 0,5%",
          "type": "BOND",
          "country": "FR",
          "currency": "EUR",
          "maturity": "2072-05-25",
          "coupon": 0.5,
          "yield": 4.21,
          "price": 24.9,
          "change": "+0.00",
          "lastUpdate": "2026-01-08"
        },
        {
          "isin": "FR0011461037",
          "name": "FRANCIA 25/05/2045 3,25%",
          "type": "BOND",
          "country": "FR",
          "currency": "EUR",
          "maturity": "2045-05-25",
          "coupon": 3.25,
          "yield": 4.17,
          "price": 87.92,
          "change": "+0.00",
          "lastUpdate": "2026-01-08"
        },
        {
          "isin": "FR0014002JM6",
          "name": "FRANCIA GREEN BOND 25/06/2044 0,5%",
          "type": "BOND",
          "country": "FR",
          "currency": "EUR",
          "maturity": "2044-06-25",
          "coupon": 0.5,
          "yield": 4.14,
          "price": 53.7,
          "change": "+0.00",
          "lastUpdate": "2026-01-08"
        },
        {
          "isin": "FR001400CMX2",
          "name": "FRANCIA 25/05/2043 2,5%",
          "type": "BOND",
          "country": "FR",
          "currency": "EUR",
          "maturity": "2043-05-25",
          "coupon": 2.5,
          "yield": 4.11,
          "price": 80.27,
          "change": "+0.00",
          "lastUpdate": "2026-01-08"
        },
        {
          "isin": "FR001400WYO4",
          "name": "FRANCIA 25/05/2042 3,6%",
          "type": "BOND",
          "country": "FR",
          "currency": "EUR",
          "maturity": "2042-05-25",
          "coupon": 3.6,
          "yield": 4.07,
          "price": 94.45,
          "change": "+0.00",
          "lastUpdate": "2026-01-08"
        },
        {
          "isin": "FR0013515806",
          "name": "FRANCIA 25/05/2040 0,5%",
          "type": "BOND",
          "country": "FR",
          "currency": "EUR",
          "maturity": "2040-05-25",
          "coupon": 0.5,
          "yield": 3.97,
          "price": 62.53,
          "change": "+0.00",
          "lastUpdate": "2026-01-08"
        },
        {
          "isin": "FR0010773192",
          "name": "FRANCIA 25/04/2041 4,5%",
          "type": "BOND",
          "country": "FR",
          "currency": "EUR",
          "maturity": "2041-04-25",
          "coupon": 4.5,
          "yield": 3.96,
          "price": 106.11,
          "change": "+0.00",
          "lastUpdate": "2026-01-08"
        },
        {
          "isin": "FR0013234333",
          "name": "FRANCIA GREEN BOND 25/06/2039 1,75%",
          "type": "BOND",
          "country": "FR",
          "currency": "EUR",
          "maturity": "2039-06-25",
          "coupon": 1.75,
          "yield": 3.86,
          "price": 78.15,
          "change": "+0.00",
          "lastUpdate": "2026-01-08"
        },
        {
          "isin": "FR0014009O62",
          "name": "FRANCIA 25/05/2038 1,25%",
          "type": "BOND",
          "country": "FR",
          "currency": "EUR",
          "maturity": "2038-05-25",
          "coupon": 1.25,
          "yield": 3.81,
          "price": 75.1,
          "change": "+0.00",
          "lastUpdate": "2026-01-08"
        },
        {
          "isin": "FR0010371401",
          "name": "FRANCIA 25/10/2038 4%",
          "type": "BOND",
          "country": "FR",
          "currency": "EUR",
          "maturity": "2038-10-25",
          "coupon": 0,
          "yield": 3.78,
          "price": 102.15,
          "change": "+0.00",
          "lastUpdate": "2026-01-08"
        },
        {
          "isin": "FR0013154044",
          "name": "FRANCIA 25/05/2036 1,25%",
          "type": "BOND",
          "country": "FR",
          "currency": "EUR",
          "maturity": "2036-05-25",
          "coupon": 1.25,
          "yield": 3.61,
          "price": 79.88,
          "change": "+0.00",
          "lastUpdate": "2026-01-08"
        },
        {
          "isin": "FR0014012II5",
          "name": "FRANCIA 25/11/2035 3,5%",
          "type": "BOND",
          "country": "FR",
          "currency": "EUR",
          "maturity": "2035-11-25",
          "coupon": 3.5,
          "yield": 3.51,
          "price": 99.88,
          "change": "+0.00",
          "lastUpdate": "2026-01-08"
        },
        {
          "isin": "FR0010070060",
          "name": "FRANCIA 25/04/2035 4,75%",
          "type": "BOND",
          "country": "FR",
          "currency": "EUR",
          "maturity": "2035-04-25",
          "coupon": 4.75,
          "yield": 3.45,
          "price": 110.2,
          "change": "+0.00",
          "lastUpdate": "2026-01-08"
        },
        {
          "isin": "FR001400QMF9",
          "name": "FRANCIA 25/11/2034 3%",
          "type": "BOND",
          "country": "FR",
          "currency": "EUR",
          "maturity": "2034-11-25",
          "coupon": 0,
          "yield": 3.41,
          "price": 96.89,
          "change": "+0.00",
          "lastUpdate": "2026-01-08"
        },
        {
          "isin": "FR0013313582",
          "name": "FRANCIA 25/05/2034 1,25%",
          "type": "BOND",
          "country": "FR",
          "currency": "EUR",
          "maturity": "2034-05-25",
          "coupon": 1.25,
          "yield": 3.35,
          "price": 84.89,
          "change": "+0.00",
          "lastUpdate": "2026-01-08"
        },
        {
          "isin": "FR001400L834",
          "name": "FRANCIA 25/11/2033 3,5%",
          "type": "BOND",
          "country": "FR",
          "currency": "EUR",
          "maturity": "2033-11-25",
          "coupon": 3.5,
          "yield": 3.26,
          "price": 101.63,
          "change": "+0.00",
          "lastUpdate": "2026-01-08"
        },
        {
          "isin": "FR001400H7V7",
          "name": "FRANCIA 25/05/2033 3%",
          "type": "BOND",
          "country": "FR",
          "currency": "EUR",
          "maturity": "2033-05-25",
          "coupon": 0,
          "yield": 3.19,
          "price": 98.78,
          "change": "+0.00",
          "lastUpdate": "2026-01-08"
        },
        {
          "isin": "FR001400BKZ3",
          "name": "FRANCIA 25/11/2032 2%",
          "type": "BOND",
          "country": "FR",
          "currency": "EUR",
          "maturity": "2032-11-25",
          "coupon": 0,
          "yield": 3.1,
          "price": 93.26,
          "change": "+0.00",
          "lastUpdate": "2026-01-08"
        },
        {
          "isin": "FR0000187635",
          "name": "FRANCIA 25/10/2032 5,75%",
          "type": "BOND",
          "country": "FR",
          "currency": "EUR",
          "maturity": "2032-10-25",
          "coupon": 5.75,
          "yield": 3.06,
          "price": 116.24,
          "change": "+0.00",
          "lastUpdate": "2026-01-08"
        },
        {
          "isin": "FR0014007L00",
          "name": "FRANCIA 25/05/2032 0%",
          "type": "BOND",
          "country": "FR",
          "currency": "EUR",
          "maturity": "2032-05-25",
          "coupon": 0,
          "yield": 3.03,
          "price": 82.69,
          "change": "+0.00",
          "lastUpdate": "2026-01-08"
        },
        {
          "isin": "FR0014002WK3",
          "name": "FRANCIA 25/11/2031 0%",
          "type": "BOND",
          "country": "FR",
          "currency": "EUR",
          "maturity": "2031-11-25",
          "coupon": 0,
          "yield": 2.94,
          "price": 84.38,
          "change": "+0.00",
          "lastUpdate": "2026-01-08"
        },
        {
          "isin": "FR0012993103",
          "name": "FRANCIA 25/05/2031 1,5%",
          "type": "BOND",
          "country": "FR",
          "currency": "EUR",
          "maturity": "2031-05-25",
          "coupon": 1.5,
          "yield": 2.86,
          "price": 93.32,
          "change": "+0.00",
          "lastUpdate": "2026-01-08"
        },
        {
          "isin": "FR0013516549",
          "name": "FRANCIA 25/11/2030 0%",
          "type": "BOND",
          "country": "FR",
          "currency": "EUR",
          "maturity": "2030-11-25",
          "coupon": 0,
          "yield": 2.77,
          "price": 87.56,
          "change": "+0.00",
          "lastUpdate": "2026-01-08"
        },
        {
          "isin": "FR0011883966",
          "name": "FRANCIA 25/05/2030 2,5%",
          "type": "BOND",
          "country": "FR",
          "currency": "EUR",
          "maturity": "2030-05-25",
          "coupon": 2.5,
          "yield": 2.68,
          "price": 99.26,
          "change": "+0.00",
          "lastUpdate": "2026-01-08"
        },
        {
          "isin": "FR001400PM68",
          "name": "FRANCIA 25/02/2030 2,75%",
          "type": "BOND",
          "country": "FR",
          "currency": "EUR",
          "maturity": "2030-02-25",
          "coupon": 2.75,
          "yield": 2.63,
          "price": 100.44,
          "change": "+0.00",
          "lastUpdate": "2026-01-08"
        },
        {
          "isin": "FR0013451507",
          "name": "FRANCIA 25/11/2029 0%",
          "type": "BOND",
          "country": "FR",
          "currency": "EUR",
          "maturity": "2029-11-25",
          "coupon": 0,
          "yield": 2.58,
          "price": 90.61,
          "change": "+0.00",
          "lastUpdate": "2026-01-08"
        },
        {
          "isin": "FR0013407236",
          "name": "FRANCIA 25/05/2029 0,5%",
          "type": "BOND",
          "country": "FR",
          "currency": "EUR",
          "maturity": "2029-05-25",
          "coupon": 0.5,
          "yield": 2.52,
          "price": 93.56,
          "change": "+0.00",
          "lastUpdate": "2026-01-08"
        },
        {
          "isin": "FR0000571218",
          "name": "FRANCIA 25/04/2029 5,5%",
          "type": "BOND",
          "country": "FR",
          "currency": "EUR",
          "maturity": "2029-04-25",
          "coupon": 5.5,
          "yield": 2.47,
          "price": 109.44,
          "change": "+0.00",
          "lastUpdate": "2026-01-08"
        },
        {
          "isin": "FR001400HI98",
          "name": "FRANCIA 25/02/2029 2,75%",
          "type": "BOND",
          "country": "FR",
          "currency": "EUR",
          "maturity": "2029-02-25",
          "coupon": 2.75,
          "yield": 2.45,
          "price": 100.88,
          "change": "+0.00",
          "lastUpdate": "2026-01-08"
        },
        {
          "isin": "FR0013341682",
          "name": "FRANCIA 25/11/2028 0,75%",
          "type": "BOND",
          "country": "FR",
          "currency": "EUR",
          "maturity": "2028-11-25",
          "coupon": 0.75,
          "yield": 2.41,
          "price": 95.46,
          "change": "+0.00",
          "lastUpdate": "2026-01-08"
        },
        {
          "isin": "FR0013286192",
          "name": "FRANCIA 25/05/2028 0,75%",
          "type": "BOND",
          "country": "FR",
          "currency": "EUR",
          "maturity": "2028-05-25",
          "coupon": 0.75,
          "yield": 2.3,
          "price": 96.47,
          "change": "+0.00",
          "lastUpdate": "2026-01-08"
        },
        {
          "isin": "FR001400AIN5",
          "name": "FRANCIA 25/02/2028 0,75%",
          "type": "BOND",
          "country": "FR",
          "currency": "EUR",
          "maturity": "2028-02-25",
          "coupon": 0.75,
          "yield": 2.27,
          "price": 96.88,
          "change": "+0.00",
          "lastUpdate": "2026-01-08"
        },
        {
          "isin": "FR0013508470",
          "name": "FRANCIA 25/02/2026 0%",
          "type": "BOND",
          "country": "FR",
          "currency": "EUR",
          "maturity": "2026-02-25",
          "coupon": 0,
          "yield": 2.24,
          "price": 99.73,
          "change": "+0.00",
          "lastUpdate": "2026-01-08"
        },
        {
          "isin": "FR0011317783",
          "name": "FRANCIA 25/10/2027 2,75%",
          "type": "BOND",
          "country": "FR",
          "currency": "EUR",
          "maturity": "2027-10-25",
          "coupon": 2.75,
          "yield": 2.23,
          "price": 100.9,
          "change": "+0.00",
          "lastUpdate": "2026-01-08"
        },
        {
          "isin": "FR001400NBC6",
          "name": "FRANCIA 24/09/2027 2,5%",
          "type": "BOND",
          "country": "FR",
          "currency": "EUR",
          "maturity": "2027-09-24",
          "coupon": 2.5,
          "yield": 2.19,
          "price": 100.5,
          "change": "+0.00",
          "lastUpdate": "2026-01-08"
        },
        {
          "isin": "FR0013250560",
          "name": "FRANCIA 25/05/2027 1%",
          "type": "BOND",
          "country": "FR",
          "currency": "EUR",
          "maturity": "2027-05-25",
          "coupon": 0,
          "yield": 2.13,
          "price": 98.49,
          "change": "+0.00",
          "lastUpdate": "2026-01-08"
        },
        {
          "isin": "FR001400FYQ4",
          "name": "FRANCIA 24/09/2026 2,5%",
          "type": "BOND",
          "country": "FR",
          "currency": "EUR",
          "maturity": "2026-09-24",
          "coupon": 2.5,
          "yield": 2.1,
          "price": 100.27,
          "change": "+0.00",
          "lastUpdate": "2026-01-08"
        },
        {
          "isin": "FR0014003513",
          "name": "FRANCIA 25/02/2027 0%",
          "type": "BOND",
          "country": "FR",
          "currency": "EUR",
          "maturity": "2027-02-25",
          "coupon": 0,
          "yield": 2.1,
          "price": 97.7,
          "change": "+0.00",
          "lastUpdate": "2026-01-08"
        },
        {
          "isin": "FR0013200813",
          "name": "FRANCIA 25/11/2026 0,25%",
          "type": "BOND",
          "country": "FR",
          "currency": "EUR",
          "maturity": "2026-11-25",
          "coupon": 0.25,
          "yield": 2.08,
          "price": 98.44,
          "change": "+0.00",
          "lastUpdate": "2026-01-08"
        },
        {
          "isin": "FR0013131877",
          "name": "FRANCIA 25/05/2026 0,5%",
          "type": "BOND",
          "country": "FR",
          "currency": "EUR",
          "maturity": "2026-05-25",
          "coupon": 0.5,
          "yield": 2.03,
          "price": 99.45,
          "change": "+0.00",
          "lastUpdate": "2026-01-08"
        },
        {
          "isin": "FR0010916924",
          "name": "FRANCIA 25/04/2026 3,5%",
          "type": "BOND",
          "country": "FR",
          "currency": "EUR",
          "maturity": "2026-04-25",
          "coupon": 3.5,
          "yield": 1.96,
          "price": 100.42,
          "change": "+0.00",
          "lastUpdate": "2026-01-08"
        }
      ]
    },
    "gov-eu-spain": {
      "name": "Spagna - Bonos",
      "description": "Titoli di Stato spagnoli",
      "count": 57,
      "bonds": [
        {
          "isin": "ES00000128E2",
          "name": "SPAGNA 30/07/2066 3,45%",
          "type": "BOND",
          "country": "ES",
          "currency": "EUR",
          "maturity": "2066-07-30",
          "coupon": 3.45,
          "yield": 4.18,
          "price": 85.8,
          "change": "+0.00",
          "lastUpdate": "2026-01-08"
        },
        {
          "isin": "ES0000012M93",
          "name": "SPAGNA 31/10/2054 4%",
          "type": "BOND",
          "country": "ES",
          "currency": "EUR",
          "maturity": "2054-10-31",
          "coupon": 0,
          "yield": 4.1,
          "price": 98.29,
          "change": "+0.00",
          "lastUpdate": "2026-01-08"
        },
        {
          "isin": "ES0000012H58",
          "name": "SPAGNA 31/10/2071 1,45%",
          "type": "BOND",
          "country": "ES",
          "currency": "EUR",
          "maturity": "2071-10-31",
          "coupon": 1.45,
          "yield": 4.09,
          "price": 45.72,
          "change": "+0.00",
          "lastUpdate": "2026-01-08"
        },
        {
          "isin": "ES0000012K46",
          "name": "SPAGNA 31/10/2052 1,9%",
          "type": "BOND",
          "country": "ES",
          "currency": "EUR",
          "maturity": "2052-10-31",
          "coupon": 1.9,
          "yield": 4.04,
          "price": 65.4,
          "change": "+0.00",
          "lastUpdate": "2026-01-08"
        },
        {
          "isin": "ES0000012G00",
          "name": "SPAGNA 31/10/2050 1%",
          "type": "BOND",
          "country": "ES",
          "currency": "EUR",
          "maturity": "2050-10-31",
          "coupon": 0,
          "yield": 3.99,
          "price": 53.45,
          "change": "+0.00",
          "lastUpdate": "2026-01-08"
        },
        {
          "isin": "ES0000012B47",
          "name": "SPAGNA 31/10/2048 2,7%",
          "type": "BOND",
          "country": "ES",
          "currency": "EUR",
          "maturity": "2048-10-31",
          "coupon": 2.7,
          "yield": 3.93,
          "price": 81.66,
          "change": "+0.00",
          "lastUpdate": "2026-01-08"
        },
        {
          "isin": "ES00000128C6",
          "name": "SPAGNA 31/10/2046 2,9%",
          "type": "BOND",
          "country": "ES",
          "currency": "EUR",
          "maturity": "2046-10-31",
          "coupon": 2.9,
          "yield": 3.91,
          "price": 85.81,
          "change": "+0.00",
          "lastUpdate": "2026-01-08"
        },
        {
          "isin": "ES00000126D8",
          "name": "SPAGNA 31/10/2064 4%",
          "type": "BOND",
          "country": "ES",
          "currency": "EUR",
          "maturity": "2064-10-31",
          "coupon": 0,
          "yield": 3.88,
          "price": 102.3,
          "change": "+0.00",
          "lastUpdate": "2026-01-08"
        },
        {
          "isin": "ES0000012K95",
          "name": "SPAGNA 30/07/2043 3,45%",
          "type": "BOND",
          "country": "ES",
          "currency": "EUR",
          "maturity": "2043-07-30",
          "coupon": 3.45,
          "yield": 3.82,
          "price": 95.31,
          "change": "+0.00",
          "lastUpdate": "2026-01-08"
        },
        {
          "isin": "ES00000124H4",
          "name": "SPAGNA 31/10/2044 5,15%",
          "type": "BOND",
          "country": "ES",
          "currency": "EUR",
          "maturity": "2044-10-31",
          "coupon": 5.15,
          "yield": 3.81,
          "price": 117.74,
          "change": "+0.00",
          "lastUpdate": "2026-01-08"
        },
        {
          "isin": "ES0000012J07",
          "name": "SPAGNA GREEN BOND 30/07/2042 1%",
          "type": "BOND",
          "country": "ES",
          "currency": "EUR",
          "maturity": "2042-07-30",
          "coupon": 0,
          "yield": 3.79,
          "price": 66.13,
          "change": "+0.00",
          "lastUpdate": "2026-01-08"
        },
        {
          "isin": "ES0000012O75",
          "name": "SPAGNA 31/01/2041 3,5%",
          "type": "BOND",
          "country": "ES",
          "currency": "EUR",
          "maturity": "2041-01-31",
          "coupon": 3.5,
          "yield": 3.73,
          "price": 97.44,
          "change": "+0.00",
          "lastUpdate": "2026-01-08"
        },
        {
          "isin": "ES0000012G42",
          "name": "SPAGNA 31/10/2040 1,2%",
          "type": "BOND",
          "country": "ES",
          "currency": "EUR",
          "maturity": "2040-10-31",
          "coupon": 1.2,
          "yield": 3.7,
          "price": 71.87,
          "change": "+0.00",
          "lastUpdate": "2026-01-08"
        },
        {
          "isin": "ES00000121S7",
          "name": "SPAGNA 30/07/2041 4,7%",
          "type": "BOND",
          "country": "ES",
          "currency": "EUR",
          "maturity": "2041-07-30",
          "coupon": 4.7,
          "yield": 3.7,
          "price": 111.64,
          "change": "+0.00",
          "lastUpdate": "2026-01-08"
        },
        {
          "isin": "ES00000120N0",
          "name": "SPAGNA 30/07/2040 4,9%",
          "type": "BOND",
          "country": "ES",
          "currency": "EUR",
          "maturity": "2040-07-30",
          "coupon": 4.9,
          "yield": 3.65,
          "price": 113.92,
          "change": "+0.00",
          "lastUpdate": "2026-01-08"
        },
        {
          "isin": "ES0000012L60",
          "name": "SPAGNA 30/07/2039 3,9%",
          "type": "BOND",
          "country": "ES",
          "currency": "EUR",
          "maturity": "2039-07-30",
          "coupon": 3.9,
          "yield": 3.6,
          "price": 103.16,
          "change": "+0.00",
          "lastUpdate": "2026-01-08"
        },
        {
          "isin": "ES0000012I24",
          "name": "SPAGNA 30/07/2037 0,85%",
          "type": "BOND",
          "country": "ES",
          "currency": "EUR",
          "maturity": "2037-07-30",
          "coupon": 0.85,
          "yield": 3.47,
          "price": 75.44,
          "change": "+0.00",
          "lastUpdate": "2026-01-08"
        },
        {
          "isin": "ES0000012932",
          "name": "SPAGNA 31/01/2037 4,2%",
          "type": "BOND",
          "country": "ES",
          "currency": "EUR",
          "maturity": "2037-01-31",
          "coupon": 4.2,
          "yield": 3.38,
          "price": 107.44,
          "change": "+0.00",
          "lastUpdate": "2026-01-08"
        },
        {
          "isin": "ES0000012P33",
          "name": "SPAGNA 31/10/2035 3,2%",
          "type": "BOND",
          "country": "ES",
          "currency": "EUR",
          "maturity": "2035-10-31",
          "coupon": 3.2,
          "yield": 3.25,
          "price": 99.57,
          "change": "+0.00",
          "lastUpdate": "2026-01-08"
        },
        {
          "isin": "ES0000012E69",
          "name": "SPAGNA 30/07/2035 1,85%",
          "type": "BOND",
          "country": "ES",
          "currency": "EUR",
          "maturity": "2035-07-30",
          "coupon": 1.85,
          "yield": 3.23,
          "price": 88.78,
          "change": "+0.00",
          "lastUpdate": "2026-01-08"
        },
        {
          "isin": "ES0000012O67",
          "name": "SPAGNA 30/04/2035 3,15%",
          "type": "BOND",
          "country": "ES",
          "currency": "EUR",
          "maturity": "2035-04-30",
          "coupon": 3.15,
          "yield": 3.21,
          "price": 99.52,
          "change": "+0.00",
          "lastUpdate": "2026-01-08"
        },
        {
          "isin": "ES0000012N35",
          "name": "SPAGNA 31/10/2034 3,45%",
          "type": "BOND",
          "country": "ES",
          "currency": "EUR",
          "maturity": "2034-10-31",
          "coupon": 3.45,
          "yield": 3.15,
          "price": 102.24,
          "change": "+0.00",
          "lastUpdate": "2026-01-08"
        },
        {
          "isin": "ES0000012M85",
          "name": "SPAGNA 30/04/2034 3,25%",
          "type": "BOND",
          "country": "ES",
          "currency": "EUR",
          "maturity": "2034-04-30",
          "coupon": 3.25,
          "yield": 3.11,
          "price": 100.99,
          "change": "+0.00",
          "lastUpdate": "2026-01-08"
        },
        {
          "isin": "ES0000012L78",
          "name": "SPAGNA 31/10/2033 3,55%",
          "type": "BOND",
          "country": "ES",
          "currency": "EUR",
          "maturity": "2033-10-31",
          "coupon": 3.55,
          "yield": 3.05,
          "price": 103.44,
          "change": "+0.00",
          "lastUpdate": "2026-01-08"
        },
        {
          "isin": "ES00000128Q6",
          "name": "SPAGNA 30/07/2033 2,35%",
          "type": "BOND",
          "country": "ES",
          "currency": "EUR",
          "maturity": "2033-07-30",
          "coupon": 2.35,
          "yield": 2.99,
          "price": 95.74,
          "change": "+0.00",
          "lastUpdate": "2026-01-08"
        },
        {
          "isin": "ES0000012L52",
          "name": "SPAGNA 30/04/2033 3,15%",
          "type": "BOND",
          "country": "ES",
          "currency": "EUR",
          "maturity": "2033-04-30",
          "coupon": 3.15,
          "yield": 2.96,
          "price": 101.23,
          "change": "+0.00",
          "lastUpdate": "2026-01-08"
        },
        {
          "isin": "ES0000012P74",
          "name": "SPAGNA 31/01/2033 3%",
          "type": "BOND",
          "country": "ES",
          "currency": "EUR",
          "maturity": "2033-01-31",
          "coupon": 0,
          "yield": 2.88,
          "price": 100.76,
          "change": "+0.00",
          "lastUpdate": "2026-01-08"
        },
        {
          "isin": "ES0000012K61",
          "name": "SPAGNA 31/10/2032 2,55%",
          "type": "BOND",
          "country": "ES",
          "currency": "EUR",
          "maturity": "2032-10-31",
          "coupon": 2.55,
          "yield": 2.88,
          "price": 98,
          "change": "+0.00",
          "lastUpdate": "2026-01-08"
        },
        {
          "isin": "ES0000012K20",
          "name": "SPAGNA 30/04/2032 0,7%",
          "type": "BOND",
          "country": "ES",
          "currency": "EUR",
          "maturity": "2032-04-30",
          "coupon": 0.7,
          "yield": 2.86,
          "price": 87.7,
          "change": "+0.00",
          "lastUpdate": "2026-01-08"
        },
        {
          "isin": "ES0000012G91",
          "name": "SPAGNA 31/01/2026 0%",
          "type": "BOND",
          "country": "ES",
          "currency": "EUR",
          "maturity": "2026-01-31",
          "coupon": 0,
          "yield": 2.83,
          "price": 99.86,
          "change": "+0.00",
          "lastUpdate": "2026-01-08"
        },
        {
          "isin": "ES0000012411",
          "name": "SPAGNA 30/07/2032 5,75%",
          "type": "BOND",
          "country": "ES",
          "currency": "EUR",
          "maturity": "2032-07-30",
          "coupon": 5.75,
          "yield": 2.81,
          "price": 117.32,
          "change": "+0.00",
          "lastUpdate": "2026-01-08"
        },
        {
          "isin": "ES0000012I32",
          "name": "SPAGNA 31/10/2031 0,5%",
          "type": "BOND",
          "country": "ES",
          "currency": "EUR",
          "maturity": "2031-10-31",
          "coupon": 0.5,
          "yield": 2.73,
          "price": 88.19,
          "change": "+0.00",
          "lastUpdate": "2026-01-08"
        },
        {
          "isin": "ES0000012N43",
          "name": "SPAGNA 30/07/2031 3,1%",
          "type": "BOND",
          "country": "ES",
          "currency": "EUR",
          "maturity": "2031-07-30",
          "coupon": 3.1,
          "yield": 2.71,
          "price": 101.95,
          "change": "+0.00",
          "lastUpdate": "2026-01-08"
        },
        {
          "isin": "ES0000012H41",
          "name": "SPAGNA 30/04/2031 0,1%",
          "type": "BOND",
          "country": "ES",
          "currency": "EUR",
          "maturity": "2031-04-30",
          "coupon": 0.1,
          "yield": 2.67,
          "price": 87.48,
          "change": "+0.00",
          "lastUpdate": "2026-01-08"
        },
        {
          "isin": "ES0000012G34",
          "name": "SPAGNA 31/10/2030 1,25%",
          "type": "BOND",
          "country": "ES",
          "currency": "EUR",
          "maturity": "2030-10-31",
          "coupon": 1.25,
          "yield": 2.59,
          "price": 94.02,
          "change": "+0.00",
          "lastUpdate": "2026-01-08"
        },
        {
          "isin": "ES00000127A2",
          "name": "SPAGNA 30/07/2030 1,95%",
          "type": "BOND",
          "country": "ES",
          "currency": "EUR",
          "maturity": "2030-07-30",
          "coupon": 1.95,
          "yield": 2.55,
          "price": 97.44,
          "change": "+0.00",
          "lastUpdate": "2026-01-08"
        },
        {
          "isin": "ES0000012O00",
          "name": "SPAGNA 31/01/2030 2,7%",
          "type": "BOND",
          "country": "ES",
          "currency": "EUR",
          "maturity": "2030-01-31",
          "coupon": 2.7,
          "yield": 2.51,
          "price": 100.71,
          "change": "+0.00",
          "lastUpdate": "2026-01-08"
        },
        {
          "isin": "ES0000012F76",
          "name": "SPAGNA 30/04/2030 0,5%",
          "type": "BOND",
          "country": "ES",
          "currency": "EUR",
          "maturity": "2030-04-30",
          "coupon": 0.5,
          "yield": 2.51,
          "price": 91.91,
          "change": "+0.00",
          "lastUpdate": "2026-01-08"
        },
        {
          "isin": "ES0000012F43",
          "name": "SPAGNA 31/10/2029 0,6%",
          "type": "BOND",
          "country": "ES",
          "currency": "EUR",
          "maturity": "2029-10-31",
          "coupon": 0.6,
          "yield": 2.45,
          "price": 93.35,
          "change": "+0.00",
          "lastUpdate": "2026-01-08"
        },
        {
          "isin": "ES0000012K53",
          "name": "SPAGNA 30/07/2029 0,8%",
          "type": "BOND",
          "country": "ES",
          "currency": "EUR",
          "maturity": "2029-07-30",
          "coupon": 0.8,
          "yield": 2.43,
          "price": 94.51,
          "change": "+0.00",
          "lastUpdate": "2026-01-08"
        },
        {
          "isin": "ES0000012M51",
          "name": "SPAGNA 31/05/2029 3,5%",
          "type": "BOND",
          "country": "ES",
          "currency": "EUR",
          "maturity": "2029-05-31",
          "coupon": 3.5,
          "yield": 2.4,
          "price": 103.53,
          "change": "+0.00",
          "lastUpdate": "2026-01-08"
        },
        {
          "isin": "ES0000012E51",
          "name": "SPAGNA 30/04/2029 1,45%",
          "type": "BOND",
          "country": "ES",
          "currency": "EUR",
          "maturity": "2029-04-30",
          "coupon": 1.45,
          "yield": 2.35,
          "price": 97.16,
          "change": "+0.00",
          "lastUpdate": "2026-01-08"
        },
        {
          "isin": "ES0000012O59",
          "name": "SPAGNA 31/05/2028 2,4%",
          "type": "BOND",
          "country": "ES",
          "currency": "EUR",
          "maturity": "2028-05-31",
          "coupon": 2.4,
          "yield": 2.3,
          "price": 100.23,
          "change": "+0.00",
          "lastUpdate": "2026-01-08"
        },
        {
          "isin": "ES0000011868",
          "name": "SPAGNA 31/01/2029 6%",
          "type": "BOND",
          "country": "ES",
          "currency": "EUR",
          "maturity": "2029-01-31",
          "coupon": 0,
          "yield": 2.29,
          "price": 110.81,
          "change": "+0.00",
          "lastUpdate": "2026-01-08"
        },
        {
          "isin": "ES00000124C5",
          "name": "SPAGNA 31/10/2028 5,15%",
          "type": "BOND",
          "country": "ES",
          "currency": "EUR",
          "maturity": "2028-10-31",
          "coupon": 5.15,
          "yield": 2.27,
          "price": 107.71,
          "change": "+0.00",
          "lastUpdate": "2026-01-08"
        },
        {
          "isin": "ES0000012B88",
          "name": "SPAGNA 30/07/2028 1,4%",
          "type": "BOND",
          "country": "ES",
          "currency": "EUR",
          "maturity": "2028-07-30",
          "coupon": 1.4,
          "yield": 2.23,
          "price": 97.97,
          "change": "+0.00",
          "lastUpdate": "2026-01-08"
        },
        {
          "isin": "ES0000012B39",
          "name": "SPAGNA 30/04/2028 1,4%",
          "type": "BOND",
          "country": "ES",
          "currency": "EUR",
          "maturity": "2028-04-30",
          "coupon": 1.4,
          "yield": 2.15,
          "price": 98.33,
          "change": "+0.00",
          "lastUpdate": "2026-01-08"
        },
        {
          "isin": "ES0000012I08",
          "name": "SPAGNA 31/01/2028 0%",
          "type": "BOND",
          "country": "ES",
          "currency": "EUR",
          "maturity": "2028-01-31",
          "coupon": 0,
          "yield": 2.15,
          "price": 95.73,
          "change": "+0.00",
          "lastUpdate": "2026-01-08"
        },
        {
          "isin": "ES0000012L29",
          "name": "SPAGNA 31/05/2026 2,8%",
          "type": "BOND",
          "country": "ES",
          "currency": "EUR",
          "maturity": "2026-05-31",
          "coupon": 2.8,
          "yield": 2.13,
          "price": 100.25,
          "change": "+0.00",
          "lastUpdate": "2026-01-08"
        },
        {
          "isin": "ES00000127Z9",
          "name": "SPAGNA 30/04/2026 1,95%",
          "type": "BOND",
          "country": "ES",
          "currency": "EUR",
          "maturity": "2026-04-30",
          "coupon": 1.95,
          "yield": 2.11,
          "price": 99.95,
          "change": "+0.00",
          "lastUpdate": "2026-01-08"
        },
        {
          "isin": "ES0000012A89",
          "name": "SPAGNA 31/10/2027 1,45%",
          "type": "BOND",
          "country": "ES",
          "currency": "EUR",
          "maturity": "2027-10-31",
          "coupon": 1.45,
          "yield": 2.11,
          "price": 98.85,
          "change": "+0.00",
          "lastUpdate": "2026-01-08"
        },
        {
          "isin": "ES0000012M77",
          "name": "SPAGNA 31/05/2027 2,5%",
          "type": "BOND",
          "country": "ES",
          "currency": "EUR",
          "maturity": "2027-05-31",
          "coupon": 2.5,
          "yield": 2.09,
          "price": 100.54,
          "change": "+0.00",
          "lastUpdate": "2026-01-08"
        },
        {
          "isin": "ES0000012G26",
          "name": "SPAGNA 30/07/2027 0,8%",
          "type": "BOND",
          "country": "ES",
          "currency": "EUR",
          "maturity": "2027-07-30",
          "coupon": 0.8,
          "yield": 2.07,
          "price": 98.08,
          "change": "+0.00",
          "lastUpdate": "2026-01-08"
        },
        {
          "isin": "ES00000128H5",
          "name": "SPAGNA 31/10/2026 1,3%",
          "type": "BOND",
          "country": "ES",
          "currency": "EUR",
          "maturity": "2026-10-31",
          "coupon": 1.3,
          "yield": 2.07,
          "price": 99.4,
          "change": "+0.00",
          "lastUpdate": "2026-01-08"
        },
        {
          "isin": "ES00000123C7",
          "name": "SPAGNA 30/07/2026 5,9%",
          "type": "BOND",
          "country": "ES",
          "currency": "EUR",
          "maturity": "2026-07-30",
          "coupon": 5.9,
          "yield": 2.06,
          "price": 102.05,
          "change": "+0.00",
          "lastUpdate": "2026-01-08"
        },
        {
          "isin": "ES00000128P8",
          "name": "SPAGNA 30/04/2027 1,5%",
          "type": "BOND",
          "country": "ES",
          "currency": "EUR",
          "maturity": "2027-04-30",
          "coupon": 1.5,
          "yield": 2.06,
          "price": 99.29,
          "change": "+0.00",
          "lastUpdate": "2026-01-08"
        },
        {
          "isin": "ES0000012J15",
          "name": "SPAGNA 31/01/2027 0%",
          "type": "BOND",
          "country": "ES",
          "currency": "EUR",
          "maturity": "2027-01-31",
          "coupon": 0,
          "yield": 2.05,
          "price": 97.89,
          "change": "+0.00",
          "lastUpdate": "2026-01-08"
        }
      ]
    },
    "gov-eu-netherlands": {
      "name": "Paesi Bassi - DSL",
      "description": "Titoli di Stato olandesi",
      "count": 23,
      "bonds": [
        {
          "isin": "NL00150012X2",
          "name": "OLANDA 15/01/2054 2%",
          "type": "BOND",
          "country": "NL",
          "currency": "EUR",
          "maturity": "2054-01-15",
          "coupon": 0,
          "yield": 3.57,
          "price": 72.52,
          "change": "+0.00",
          "lastUpdate": "2026-01-08"
        },
        {
          "isin": "NL0015614579",
          "name": "OLANDA 15/01/2052 0%",
          "type": "BOND",
          "country": "NL",
          "currency": "EUR",
          "maturity": "2052-01-15",
          "coupon": 0,
          "yield": 3.55,
          "price": 40.37,
          "change": "+0.00",
          "lastUpdate": "2026-01-08"
        },
        {
          "isin": "NL0010721999",
          "name": "OLANDA 15/01/2047 2,75%",
          "type": "BOND",
          "country": "NL",
          "currency": "EUR",
          "maturity": "2047-01-15",
          "coupon": 2.75,
          "yield": 3.46,
          "price": 89.58,
          "change": "+0.00",
          "lastUpdate": "2026-01-08"
        },
        {
          "isin": "NL0015001RG8",
          "name": "OLANDA GREEN BOND 15/01/2044 3,25%",
          "type": "BOND",
          "country": "NL",
          "currency": "EUR",
          "maturity": "2044-01-15",
          "coupon": 3.25,
          "yield": 3.37,
          "price": 98.37,
          "change": "+0.00",
          "lastUpdate": "2026-01-08"
        },
        {
          "isin": "NL0009446418",
          "name": "OLANDA 15/01/2042 3,75%",
          "type": "BOND",
          "country": "NL",
          "currency": "EUR",
          "maturity": "2042-01-15",
          "coupon": 3.75,
          "yield": 3.34,
          "price": 105.05,
          "change": "+0.00",
          "lastUpdate": "2026-01-08"
        },
        {
          "isin": "NL0013552060",
          "name": "OLANDA GREEN BOND 15/01/2040 0,5%",
          "type": "BOND",
          "country": "NL",
          "currency": "EUR",
          "maturity": "2040-01-15",
          "coupon": 0.5,
          "yield": 3.29,
          "price": 69.11,
          "change": "+0.00",
          "lastUpdate": "2026-01-08"
        },
        {
          "isin": "NL0015000B11",
          "name": "OLANDA 15/01/2038 0%",
          "type": "BOND",
          "country": "NL",
          "currency": "EUR",
          "maturity": "2038-01-15",
          "coupon": 0,
          "yield": 3.18,
          "price": 68.64,
          "change": "+0.00",
          "lastUpdate": "2026-01-08"
        },
        {
          "isin": "NL0000102234",
          "name": "OLANDA 15/01/2037 4%",
          "type": "BOND",
          "country": "NL",
          "currency": "EUR",
          "maturity": "2037-01-15",
          "coupon": 0,
          "yield": 3.05,
          "price": 108.8,
          "change": "+0.00",
          "lastUpdate": "2026-01-08"
        },
        {
          "isin": "NL0015002F72",
          "name": "OLANDA 15/07/2035 2,5%",
          "type": "BOND",
          "country": "NL",
          "currency": "EUR",
          "maturity": "2035-07-15",
          "coupon": 2.5,
          "yield": 2.93,
          "price": 96.46,
          "change": "+0.00",
          "lastUpdate": "2026-01-08"
        },
        {
          "isin": "NL0015001XZ6",
          "name": "OLANDA 15/07/2034 2,5%",
          "type": "BOND",
          "country": "NL",
          "currency": "EUR",
          "maturity": "2034-07-15",
          "coupon": 2.5,
          "yield": 2.86,
          "price": 97.3,
          "change": "+0.00",
          "lastUpdate": "2026-01-08"
        },
        {
          "isin": "NL0015001AM2",
          "name": "OLANDA 15/07/2033 2,5%",
          "type": "BOND",
          "country": "NL",
          "currency": "EUR",
          "maturity": "2033-07-15",
          "coupon": 2.5,
          "yield": 2.76,
          "price": 98.22,
          "change": "+0.00",
          "lastUpdate": "2026-01-08"
        },
        {
          "isin": "NL0010071189",
          "name": "OLANDA 15/01/2033 2,5%",
          "type": "BOND",
          "country": "NL",
          "currency": "EUR",
          "maturity": "2033-01-15",
          "coupon": 2.5,
          "yield": 2.7,
          "price": 98.71,
          "change": "+0.00",
          "lastUpdate": "2026-01-08"
        },
        {
          "isin": "NL0015000RP1",
          "name": "OLANDA 15/07/2032 0,5%",
          "type": "BOND",
          "country": "NL",
          "currency": "EUR",
          "maturity": "2032-07-15",
          "coupon": 0.5,
          "yield": 2.67,
          "price": 87.17,
          "change": "+0.00",
          "lastUpdate": "2026-01-08"
        },
        {
          "isin": "NL00150006U0",
          "name": "OLANDA 15/07/2031 0%",
          "type": "BOND",
          "country": "NL",
          "currency": "EUR",
          "maturity": "2031-07-15",
          "coupon": 0,
          "yield": 2.58,
          "price": 86.9,
          "change": "+0.00",
          "lastUpdate": "2026-01-08"
        },
        {
          "isin": "NL0014555419",
          "name": "OLANDA 15/07/2030 0%",
          "type": "BOND",
          "country": "NL",
          "currency": "EUR",
          "maturity": "2030-07-15",
          "coupon": 0,
          "yield": 2.46,
          "price": 89.63,
          "change": "+0.00",
          "lastUpdate": "2026-01-08"
        },
        {
          "isin": "NL0015001DQ7",
          "name": "OLANDA 15/01/2030 2,5%",
          "type": "BOND",
          "country": "NL",
          "currency": "EUR",
          "maturity": "2030-01-15",
          "coupon": 2.5,
          "yield": 2.4,
          "price": 100.36,
          "change": "+0.00",
          "lastUpdate": "2026-01-08"
        },
        {
          "isin": "NL0013332430",
          "name": "OLANDA 15/07/2029 0,25%",
          "type": "BOND",
          "country": "NL",
          "currency": "EUR",
          "maturity": "2029-07-15",
          "coupon": 0.25,
          "yield": 2.32,
          "price": 93.1,
          "change": "+0.00",
          "lastUpdate": "2026-01-08"
        },
        {
          "isin": "NL0015000LS8",
          "name": "OLANDA 15/01/2029 0%",
          "type": "BOND",
          "country": "NL",
          "currency": "EUR",
          "maturity": "2029-01-15",
          "coupon": 0,
          "yield": 2.26,
          "price": 93.51,
          "change": "+0.00",
          "lastUpdate": "2026-01-08"
        },
        {
          "isin": "NL0012818504",
          "name": "OLANDA 15/07/2028 0,75%",
          "type": "BOND",
          "country": "NL",
          "currency": "EUR",
          "maturity": "2028-07-15",
          "coupon": 0.75,
          "yield": 2.16,
          "price": 96.59,
          "change": "+0.00",
          "lastUpdate": "2026-01-08"
        },
        {
          "isin": "NL0000102317",
          "name": "OLANDA 15/01/2028 5,5%",
          "type": "BOND",
          "country": "NL",
          "currency": "EUR",
          "maturity": "2028-01-15",
          "coupon": 5.5,
          "yield": 2.09,
          "price": 106.63,
          "change": "+0.00",
          "lastUpdate": "2026-01-08"
        },
        {
          "isin": "NL0012171458",
          "name": "OLANDA 15/07/2027 0,75%",
          "type": "BOND",
          "country": "NL",
          "currency": "EUR",
          "maturity": "2027-07-15",
          "coupon": 0.75,
          "yield": 2.03,
          "price": 98.12,
          "change": "+0.00",
          "lastUpdate": "2026-01-08"
        },
        {
          "isin": "NL0011819040",
          "name": "OLANDA 15/07/2026 0,5%",
          "type": "BOND",
          "country": "NL",
          "currency": "EUR",
          "maturity": "2026-07-15",
          "coupon": 0.5,
          "yield": 1.99,
          "price": 99.26,
          "change": "+0.00",
          "lastUpdate": "2026-01-08"
        },
        {
          "isin": "NL0015031501",
          "name": "OLANDA 15/01/2027 0%",
          "type": "BOND",
          "country": "NL",
          "currency": "EUR",
          "maturity": "2027-01-15",
          "coupon": 0,
          "yield": 1.93,
          "price": 98.09,
          "change": "+0.00",
          "lastUpdate": "2026-01-08"
        }
      ]
    },
    "gov-eu-ireland": {
      "name": "Irlanda - IRISH",
      "description": "Titoli di Stato irlandesi",
      "count": 18,
      "bonds": [
        {
          "isin": "IE00080U68D3",
          "name": "IRLANDA 18/10/2055 3,15%",
          "type": "BOND",
          "country": "IE",
          "currency": "EUR",
          "maturity": "2055-10-18",
          "coupon": 3.15,
          "yield": 3.74,
          "price": 89.55,
          "change": "+0.00",
          "lastUpdate": "2026-01-08"
        },
        {
          "isin": "IE00BH3SQB22",
          "name": "IRLANDA 15/05/2050 1,5%",
          "type": "BOND",
          "country": "IE",
          "currency": "EUR",
          "maturity": "2050-05-15",
          "coupon": 1.5,
          "yield": 3.68,
          "price": 65.39,
          "change": "+0.00",
          "lastUpdate": "2026-01-08"
        },
        {
          "isin": "IE00BV8C9186",
          "name": "IRLANDA 18/02/2045 2%",
          "type": "BOND",
          "country": "IE",
          "currency": "EUR",
          "maturity": "2045-02-18",
          "coupon": 0,
          "yield": 3.55,
          "price": 78.81,
          "change": "+0.00",
          "lastUpdate": "2026-01-08"
        },
        {
          "isin": "IE000GVLBXU6",
          "name": "IRLANDA GREEN BOND 18/10/2043 3%",
          "type": "BOND",
          "country": "IE",
          "currency": "EUR",
          "maturity": "2043-10-18",
          "coupon": 0,
          "yield": 3.46,
          "price": 94,
          "change": "+0.00",
          "lastUpdate": "2026-01-08"
        },
        {
          "isin": "IE00BMQ5JM72",
          "name": "IRLANDA 22/04/2041 0,55%",
          "type": "BOND",
          "country": "IE",
          "currency": "EUR",
          "maturity": "2041-04-22",
          "coupon": 0.55,
          "yield": 3.45,
          "price": 65.97,
          "change": "+0.00",
          "lastUpdate": "2026-01-08"
        },
        {
          "isin": "IE00BV8C9B83",
          "name": "IRLANDA 15/05/2037 1,7%",
          "type": "BOND",
          "country": "IE",
          "currency": "EUR",
          "maturity": "2037-05-15",
          "coupon": 1.7,
          "yield": 3.21,
          "price": 85.79,
          "change": "+0.00",
          "lastUpdate": "2026-01-08"
        },
        {
          "isin": "IE00BKFVC345",
          "name": "IRLANDA 15/05/2035 0,4%",
          "type": "BOND",
          "country": "IE",
          "currency": "EUR",
          "maturity": "2035-05-15",
          "coupon": 0.4,
          "yield": 3.07,
          "price": 78.6,
          "change": "+0.00",
          "lastUpdate": "2026-01-08"
        },
        {
          "isin": "IE000LQ7YWY4",
          "name": "IRLANDA 18/10/2034 2,6%",
          "type": "BOND",
          "country": "IE",
          "currency": "EUR",
          "maturity": "2034-10-18",
          "coupon": 2.6,
          "yield": 2.99,
          "price": 97.05,
          "change": "+0.00",
          "lastUpdate": "2026-01-08"
        },
        {
          "isin": "IE00BFZRPZ02",
          "name": "IRLANDA 15/05/2033 1,3%",
          "type": "BOND",
          "country": "IE",
          "currency": "EUR",
          "maturity": "2033-05-15",
          "coupon": 1.3,
          "yield": 2.82,
          "price": 90.07,
          "change": "+0.00",
          "lastUpdate": "2026-01-08"
        },
        {
          "isin": "IE00BMD03L28",
          "name": "IRLANDA 18/10/2032 0,35%",
          "type": "BOND",
          "country": "IE",
          "currency": "EUR",
          "maturity": "2032-10-18",
          "coupon": 0.35,
          "yield": 2.75,
          "price": 85.38,
          "change": "+0.00",
          "lastUpdate": "2026-01-08"
        },
        {
          "isin": "IE00BMQ5JL65",
          "name": "IRLANDA 18/10/2031 0%",
          "type": "BOND",
          "country": "IE",
          "currency": "EUR",
          "maturity": "2031-10-18",
          "coupon": 0,
          "yield": 2.63,
          "price": 86.12,
          "change": "+0.00",
          "lastUpdate": "2026-01-08"
        },
        {
          "isin": "IE00BFZRQ242",
          "name": "IRLANDA GREEN BOND 18/03/2031 1,35%",
          "type": "BOND",
          "country": "IE",
          "currency": "EUR",
          "maturity": "2031-03-18",
          "coupon": 1.35,
          "yield": 2.51,
          "price": 94.42,
          "change": "+0.00",
          "lastUpdate": "2026-01-08"
        },
        {
          "isin": "IE00BKFVC899",
          "name": "IRLANDA 18/10/2030 0,2%",
          "type": "BOND",
          "country": "IE",
          "currency": "EUR",
          "maturity": "2030-10-18",
          "coupon": 0.2,
          "yield": 2.48,
          "price": 89.86,
          "change": "+0.00",
          "lastUpdate": "2026-01-08"
        },
        {
          "isin": "IE00BJ38CR43",
          "name": "IRLANDA 15/05/2030 2,4%",
          "type": "BOND",
          "country": "IE",
          "currency": "EUR",
          "maturity": "2030-05-15",
          "coupon": 2.4,
          "yield": 2.45,
          "price": 99.79,
          "change": "+0.00",
          "lastUpdate": "2026-01-08"
        },
        {
          "isin": "IE00BH3SQ895",
          "name": "IRLANDA 15/05/2029 1,1%",
          "type": "BOND",
          "country": "IE",
          "currency": "EUR",
          "maturity": "2029-05-15",
          "coupon": 1.1,
          "yield": 2.32,
          "price": 96.12,
          "change": "+0.00",
          "lastUpdate": "2026-01-08"
        },
        {
          "isin": "IE00BDHDPR44",
          "name": "IRLANDA 15/05/2028 0,9%",
          "type": "BOND",
          "country": "IE",
          "currency": "EUR",
          "maturity": "2028-05-15",
          "coupon": 0.9,
          "yield": 2.16,
          "price": 97.16,
          "change": "+0.00",
          "lastUpdate": "2026-01-08"
        },
        {
          "isin": "IE00BV8C9418",
          "name": "IRLANDA 15/05/2026 1%",
          "type": "BOND",
          "country": "IE",
          "currency": "EUR",
          "maturity": "2026-05-15",
          "coupon": 0,
          "yield": 2.05,
          "price": 99.65,
          "change": "+0.00",
          "lastUpdate": "2026-01-08"
        },
        {
          "isin": "IE00BKFVC568",
          "name": "IRLANDA 15/05/2027 0,2%",
          "type": "BOND",
          "country": "IE",
          "currency": "EUR",
          "maturity": "2027-05-15",
          "coupon": 0.2,
          "yield": 1.92,
          "price": 97.75,
          "change": "+0.00",
          "lastUpdate": "2026-01-08"
        }
      ]
    },
    "gov-eu-portugal": {
      "name": "Portogallo - OT",
      "description": "Titoli di Stato portoghesi",
      "count": 21,
      "bonds": [
        {
          "isin": "PTOTE3OE0025",
          "name": "PORTOGALLO 12/06/2054 3,625%",
          "type": "BOND",
          "country": "PT",
          "currency": "EUR",
          "maturity": "2054-06-12",
          "coupon": 3.625,
          "yield": 3.96,
          "price": 94.27,
          "change": "+0.00",
          "lastUpdate": "2026-01-08"
        },
        {
          "isin": "PTOTECOE0037",
          "name": "PORTOGALLO 12/04/2052 1%",
          "type": "BOND",
          "country": "PT",
          "currency": "EUR",
          "maturity": "2052-04-12",
          "coupon": 0,
          "yield": 3.87,
          "price": 53.26,
          "change": "+0.00",
          "lastUpdate": "2026-01-08"
        },
        {
          "isin": "PTOTEBOE0020",
          "name": "PORTOGALLO 15/02/2045 4,10%",
          "type": "BOND",
          "country": "PT",
          "currency": "EUR",
          "maturity": "2045-02-15",
          "coupon": 4.1,
          "yield": 3.74,
          "price": 104.91,
          "change": "+0.00",
          "lastUpdate": "2026-01-08"
        },
        {
          "isin": "PTOTEPOE0032",
          "name": "PORTOGALLO 11/04/2042 1,15%",
          "type": "BOND",
          "country": "PT",
          "currency": "EUR",
          "maturity": "2042-04-11",
          "coupon": 1.15,
          "yield": 3.66,
          "price": 69.62,
          "change": "+0.00",
          "lastUpdate": "2026-01-08"
        },
        {
          "isin": "PTOTE4OE0008",
          "name": "PORTOGALLO 15/06/2040 3,375%",
          "type": "BOND",
          "country": "PT",
          "currency": "EUR",
          "maturity": "2040-06-15",
          "coupon": 3.375,
          "yield": 3.55,
          "price": 97.98,
          "change": "+0.00",
          "lastUpdate": "2026-01-08"
        },
        {
          "isin": "PTOTEZOE0014",
          "name": "PORTOGALLO 18/06/2038 3,5%",
          "type": "BOND",
          "country": "PT",
          "currency": "EUR",
          "maturity": "2038-06-18",
          "coupon": 3.5,
          "yield": 3.43,
          "price": 100.68,
          "change": "+0.00",
          "lastUpdate": "2026-01-08"
        },
        {
          "isin": "PTOTE5OE0007",
          "name": "PORTOGALLO 15/04/2037 4,1%",
          "type": "BOND",
          "country": "PT",
          "currency": "EUR",
          "maturity": "2037-04-15",
          "coupon": 4.1,
          "yield": 3.27,
          "price": 107.71,
          "change": "+0.00",
          "lastUpdate": "2026-01-08"
        },
        {
          "isin": "PTOTENOE0034",
          "name": "PORTOGALLO 12/10/2035 0,9%",
          "type": "BOND",
          "country": "PT",
          "currency": "EUR",
          "maturity": "2035-10-12",
          "coupon": 0.9,
          "yield": 3.15,
          "price": 81.36,
          "change": "+0.00",
          "lastUpdate": "2026-01-08"
        },
        {
          "isin": "PTOTEAOE0005",
          "name": "PORTOGALLO 15/06/2035 3%",
          "type": "BOND",
          "country": "PT",
          "currency": "EUR",
          "maturity": "2035-06-15",
          "coupon": 0,
          "yield": 3.11,
          "price": 99.1,
          "change": "+0.00",
          "lastUpdate": "2026-01-08"
        },
        {
          "isin": "PTOTESOE0021",
          "name": "PORTOGALLO 20/10/2034 2,875%",
          "type": "BOND",
          "country": "PT",
          "currency": "EUR",
          "maturity": "2034-10-20",
          "coupon": 2.875,
          "yield": 3.04,
          "price": 98.74,
          "change": "+0.00",
          "lastUpdate": "2026-01-08"
        },
        {
          "isin": "PTOTEWOE0017",
          "name": "PORTOGALLO 18/04/2034 2,25%",
          "type": "BOND",
          "country": "PT",
          "currency": "EUR",
          "maturity": "2034-04-18",
          "coupon": 2.25,
          "yield": 2.97,
          "price": 94.78,
          "change": "+0.00",
          "lastUpdate": "2026-01-08"
        },
        {
          "isin": "PTOTEQOE0023",
          "name": "PORTOGALLO 14/10/2033 2,875%",
          "type": "BOND",
          "country": "PT",
          "currency": "EUR",
          "maturity": "2033-10-14",
          "coupon": 2.875,
          "yield": 2.82,
          "price": 100.34,
          "change": "+0.00",
          "lastUpdate": "2026-01-08"
        },
        {
          "isin": "PTOTEYOE0031",
          "name": "PORTOGALLO 16/07/2032 1,65%",
          "type": "BOND",
          "country": "PT",
          "currency": "EUR",
          "maturity": "2032-07-16",
          "coupon": 1.65,
          "yield": 2.75,
          "price": 93.53,
          "change": "+0.00",
          "lastUpdate": "2026-01-08"
        },
        {
          "isin": "PTOTEOOE0033",
          "name": "PORTOGALLO 17/10/2031 0,3%",
          "type": "BOND",
          "country": "PT",
          "currency": "EUR",
          "maturity": "2031-10-17",
          "coupon": 0.3,
          "yield": 2.62,
          "price": 87.74,
          "change": "+0.00",
          "lastUpdate": "2026-01-08"
        },
        {
          "isin": "PTOTELOE0028",
          "name": "PORTOGALLO 18/10/2030 0,475%",
          "type": "BOND",
          "country": "PT",
          "currency": "EUR",
          "maturity": "2030-10-18",
          "coupon": 0.475,
          "yield": 2.45,
          "price": 91.22,
          "change": "+0.00",
          "lastUpdate": "2026-01-08"
        },
        {
          "isin": "PTOTEROE0014",
          "name": "PORTOGALLO 15/02/2030 3,875%",
          "type": "BOND",
          "country": "PT",
          "currency": "EUR",
          "maturity": "2030-02-15",
          "coupon": 3.875,
          "yield": 2.35,
          "price": 105.87,
          "change": "+0.00",
          "lastUpdate": "2026-01-08"
        },
        {
          "isin": "PTOTEXOE0024",
          "name": "PORTOGALLO 15/06/2029 1,95%",
          "type": "BOND",
          "country": "PT",
          "currency": "EUR",
          "maturity": "2029-06-15",
          "coupon": 1.95,
          "yield": 2.22,
          "price": 99.12,
          "change": "+0.00",
          "lastUpdate": "2026-01-08"
        },
        {
          "isin": "PTOTEVOE0018",
          "name": "PORTOGALLO 17/10/2028 2,125%",
          "type": "BOND",
          "country": "PT",
          "currency": "EUR",
          "maturity": "2028-10-17",
          "coupon": 2.125,
          "yield": 2.11,
          "price": 100.04,
          "change": "+0.00",
          "lastUpdate": "2026-01-08"
        },
        {
          "isin": "PTOTETOE0012",
          "name": "PORTOGALLO 21/07/2026 2,875%",
          "type": "BOND",
          "country": "PT",
          "currency": "EUR",
          "maturity": "2026-07-21",
          "coupon": 2.875,
          "yield": 2.04,
          "price": 100.42,
          "change": "+0.00",
          "lastUpdate": "2026-01-08"
        },
        {
          "isin": "PTOTEUOE0019",
          "name": "PORTOGALLO 14/04/2027 4,125%",
          "type": "BOND",
          "country": "PT",
          "currency": "EUR",
          "maturity": "2027-04-14",
          "coupon": 4.125,
          "yield": 2.02,
          "price": 102.57,
          "change": "+0.00",
          "lastUpdate": "2026-01-08"
        },
        {
          "isin": "PTOTEMOE0035",
          "name": "PORTOGALLO 15/10/2027 0,7%",
          "type": "BOND",
          "country": "PT",
          "currency": "EUR",
          "maturity": "2027-10-15",
          "coupon": 0.7,
          "yield": 1.98,
          "price": 97.81,
          "change": "+0.00",
          "lastUpdate": "2026-01-08"
        }
      ]
    },
    "gov-eu-austria": {
      "name": "Austria - RAGB",
      "description": "Titoli di Stato austriaci",
      "count": 32,
      "bonds": [
        {
          "isin": "AT0000A0U299",
          "name": "AUSTRIA 26/01/2062 3,8%",
          "type": "BOND",
          "country": "AT",
          "currency": "EUR",
          "maturity": "2062-01-26",
          "coupon": 3.8,
          "yield": 3.82,
          "price": 99.55,
          "change": "+0.00",
          "lastUpdate": "2026-01-08"
        },
        {
          "isin": "AT0000A33SK7",
          "name": "AUSTRIA 20/10/2053 3,15%",
          "type": "BOND",
          "country": "AT",
          "currency": "EUR",
          "maturity": "2053-10-20",
          "coupon": 3.15,
          "yield": 3.81,
          "price": 88.75,
          "change": "+0.00",
          "lastUpdate": "2026-01-08"
        },
        {
          "isin": "AT0000A2EJ08",
          "name": "AUSTRIA 20/03/2051 0,75%",
          "type": "BOND",
          "country": "AT",
          "currency": "EUR",
          "maturity": "2051-03-20",
          "coupon": 0.75,
          "yield": 3.75,
          "price": 51.61,
          "change": "+0.00",
          "lastUpdate": "2026-01-08"
        },
        {
          "isin": "AT0000A2Y8G4",
          "name": "AUSTRIA GREEN BOND 23/05/2049 1,85%",
          "type": "BOND",
          "country": "AT",
          "currency": "EUR",
          "maturity": "2049-05-23",
          "coupon": 1.85,
          "yield": 3.73,
          "price": 71.02,
          "change": "+0.00",
          "lastUpdate": "2026-01-08"
        },
        {
          "isin": "AT0000A1XML2",
          "name": "AUSTRIA 20/09/2117 2,1%",
          "type": "BOND",
          "country": "AT",
          "currency": "EUR",
          "maturity": "2117-09-20",
          "coupon": 2.1,
          "yield": 3.72,
          "price": 57.9,
          "change": "+0.00",
          "lastUpdate": "2026-01-08"
        },
        {
          "isin": "AT0000A1PEF7",
          "name": "AUSTRIA 02/11/2086 1,5%",
          "type": "BOND",
          "country": "AT",
          "currency": "EUR",
          "maturity": "2086-11-02",
          "coupon": 1.5,
          "yield": 3.72,
          "price": 46.8,
          "change": "+0.00",
          "lastUpdate": "2026-01-08"
        },
        {
          "isin": "AT0000A1K9F1",
          "name": "AUSTRIA 20/02/2047 1,5%",
          "type": "BOND",
          "country": "AT",
          "currency": "EUR",
          "maturity": "2047-02-20",
          "coupon": 1.5,
          "yield": 3.72,
          "price": 67.94,
          "change": "+0.00",
          "lastUpdate": "2026-01-08"
        },
        {
          "isin": "AT0000A2QQB6",
          "name": "AUSTRIA 20/04/2071 0,70%",
          "type": "BOND",
          "country": "AT",
          "currency": "EUR",
          "maturity": "2071-04-20",
          "coupon": 0.7,
          "yield": 3.68,
          "price": 34.74,
          "change": "+0.00",
          "lastUpdate": "2026-01-08"
        },
        {
          "isin": "AT0000A0VRQ6",
          "name": "AUSTRIA 20/06/2044 3,15%",
          "type": "BOND",
          "country": "AT",
          "currency": "EUR",
          "maturity": "2044-06-20",
          "coupon": 3.15,
          "yield": 3.62,
          "price": 93.75,
          "change": "+0.00",
          "lastUpdate": "2026-01-08"
        },
        {
          "isin": "AT0000A2KQ43",
          "name": "AUSTRIA 22/10/2040 0%",
          "type": "BOND",
          "country": "AT",
          "currency": "EUR",
          "maturity": "2040-10-22",
          "coupon": 0,
          "yield": 3.52,
          "price": 60.02,
          "change": "+0.00",
          "lastUpdate": "2026-01-08"
        },
        {
          "isin": "AT0000A3D3Q8",
          "name": "AUSTRIA 15/07/2039 3,2%",
          "type": "BOND",
          "country": "AT",
          "currency": "EUR",
          "maturity": "2039-07-15",
          "coupon": 3.2,
          "yield": 3.42,
          "price": 97.65,
          "change": "+0.00",
          "lastUpdate": "2026-01-08"
        },
        {
          "isin": "AT0000A2HLC4",
          "name": "AUSTRIA 30/06/2120 0,85%",
          "type": "BOND",
          "country": "AT",
          "currency": "EUR",
          "maturity": "2120-06-30",
          "coupon": 0.85,
          "yield": 3.23,
          "price": 29.93,
          "change": "+0.00",
          "lastUpdate": "2026-01-08"
        },
        {
          "isin": "AT0000A2T198",
          "name": "AUSTRIA 20/10/2036 0,25%",
          "type": "BOND",
          "country": "AT",
          "currency": "EUR",
          "maturity": "2036-10-20",
          "coupon": 0.25,
          "yield": 3.23,
          "price": 73.24,
          "change": "+0.00",
          "lastUpdate": "2026-01-08"
        },
        {
          "isin": "AT0000A04967",
          "name": "AUSTRIA 15/03/2037 4,15%",
          "type": "BOND",
          "country": "AT",
          "currency": "EUR",
          "maturity": "2037-03-15",
          "coupon": 4.15,
          "yield": 3.22,
          "price": 108.58,
          "change": "+0.00",
          "lastUpdate": "2026-01-08"
        },
        {
          "isin": "AT0000A3HU25",
          "name": "AUSTRIA 20/02/2035 2,95%",
          "type": "BOND",
          "country": "AT",
          "currency": "EUR",
          "maturity": "2035-02-20",
          "coupon": 2.95,
          "yield": 3.08,
          "price": 99,
          "change": "+0.00",
          "lastUpdate": "2026-01-08"
        },
        {
          "isin": "AT0000A10683",
          "name": "AUSTRIA 23/05/2034 2,4%",
          "type": "BOND",
          "country": "AT",
          "currency": "EUR",
          "maturity": "2034-05-23",
          "coupon": 2.4,
          "yield": 2.97,
          "price": 95.86,
          "change": "+0.00",
          "lastUpdate": "2026-01-08"
        },
        {
          "isin": "AT0000A39UW5",
          "name": "AUSTRIA 20/02/2034 2,9%",
          "type": "BOND",
          "country": "AT",
          "currency": "EUR",
          "maturity": "2034-02-20",
          "coupon": 2.9,
          "yield": 2.96,
          "price": 99.56,
          "change": "+0.00",
          "lastUpdate": "2026-01-08"
        },
        {
          "isin": "AT0000A324S8",
          "name": "AUSTRIA 20/02/2033 2,9%",
          "type": "BOND",
          "country": "AT",
          "currency": "EUR",
          "maturity": "2033-02-20",
          "coupon": 2.9,
          "yield": 2.82,
          "price": 100.49,
          "change": "+0.00",
          "lastUpdate": "2026-01-08"
        },
        {
          "isin": "AT0000A3NY15",
          "name": "AUSTRIA 20/09/2032 2,8%",
          "type": "BOND",
          "country": "AT",
          "currency": "EUR",
          "maturity": "2032-09-20",
          "coupon": 2.8,
          "yield": 2.78,
          "price": 100.09,
          "change": "+0.00",
          "lastUpdate": "2026-01-08"
        },
        {
          "isin": "AT0000A2WSC8",
          "name": "AUSTRIA 20/02/2032 0,9%",
          "type": "BOND",
          "country": "AT",
          "currency": "EUR",
          "maturity": "2032-02-20",
          "coupon": 0.9,
          "yield": 2.74,
          "price": 89.77,
          "change": "+0.00",
          "lastUpdate": "2026-01-08"
        },
        {
          "isin": "AT0000A2NW83",
          "name": "AUSTRIA 20/02/2031 0%",
          "type": "BOND",
          "country": "AT",
          "currency": "EUR",
          "maturity": "2031-02-20",
          "coupon": 0,
          "yield": 2.62,
          "price": 87.61,
          "change": "+0.00",
          "lastUpdate": "2026-01-08"
        },
        {
          "isin": "AT0000A2CQD2",
          "name": "AUSTRIA 20/02/2030 0%",
          "type": "BOND",
          "country": "AT",
          "currency": "EUR",
          "maturity": "2030-02-20",
          "coupon": 0,
          "yield": 2.46,
          "price": 90.49,
          "change": "+0.00",
          "lastUpdate": "2026-01-08"
        },
        {
          "isin": "AT0000A3EPP2",
          "name": "AUSTRIA 20/10/2029 2,5%",
          "type": "BOND",
          "country": "AT",
          "currency": "EUR",
          "maturity": "2029-10-20",
          "coupon": 2.5,
          "yield": 2.41,
          "price": 100.33,
          "change": "+0.00",
          "lastUpdate": "2026-01-08"
        },
        {
          "isin": "AT0000A33SH3",
          "name": "AUSTRIA GREEN BOND 23/05/2029 2,9%",
          "type": "BOND",
          "country": "AT",
          "currency": "EUR",
          "maturity": "2029-05-23",
          "coupon": 2.9,
          "yield": 2.31,
          "price": 101.87,
          "change": "+0.00",
          "lastUpdate": "2026-01-08"
        },
        {
          "isin": "AT0000A269M8",
          "name": "AUSTRIA 20/02/2029 0,5%",
          "type": "BOND",
          "country": "AT",
          "currency": "EUR",
          "maturity": "2029-02-20",
          "coupon": 0.5,
          "yield": 2.29,
          "price": 94.69,
          "change": "+0.00",
          "lastUpdate": "2026-01-08"
        },
        {
          "isin": "AT0000A2VB47",
          "name": "AUSTRIA 20/10/2028 0%",
          "type": "BOND",
          "country": "AT",
          "currency": "EUR",
          "maturity": "2028-10-20",
          "coupon": 0,
          "yield": 2.23,
          "price": 94.07,
          "change": "+0.00",
          "lastUpdate": "2026-01-08"
        },
        {
          "isin": "AT0000A1ZGE4",
          "name": "AUSTRIA 20/02/2028 0,75%",
          "type": "BOND",
          "country": "AT",
          "currency": "EUR",
          "maturity": "2028-02-20",
          "coupon": 0.75,
          "yield": 2.13,
          "price": 97.19,
          "change": "+0.00",
          "lastUpdate": "2026-01-08"
        },
        {
          "isin": "AT0000A0DXC2",
          "name": "AUSTRIA 15/03/2026 4,85%",
          "type": "BOND",
          "country": "AT",
          "currency": "EUR",
          "maturity": "2026-03-15",
          "coupon": 4.85,
          "yield": 2.06,
          "price": 100.46,
          "change": "+0.00",
          "lastUpdate": "2026-01-08"
        },
        {
          "isin": "AT0000A308C5",
          "name": "AUSTRIA 15/07/2026 2%",
          "type": "BOND",
          "country": "AT",
          "currency": "EUR",
          "maturity": "2026-07-15",
          "coupon": 0,
          "yield": 2.05,
          "price": 99.97,
          "change": "+0.00",
          "lastUpdate": "2026-01-08"
        },
        {
          "isin": "AT0000383864",
          "name": "AUSTRIA 15/07/2027 6,25%",
          "type": "BOND",
          "country": "AT",
          "currency": "EUR",
          "maturity": "2027-07-15",
          "coupon": 6.25,
          "yield": 2.01,
          "price": 106.2,
          "change": "+0.00",
          "lastUpdate": "2026-01-08"
        },
        {
          "isin": "AT0000A1VGK0",
          "name": "AUSTRIA 20/04/2027 0,5%",
          "type": "BOND",
          "country": "AT",
          "currency": "EUR",
          "maturity": "2027-04-20",
          "coupon": 0.5,
          "yield": 2,
          "price": 98.14,
          "change": "+0.00",
          "lastUpdate": "2026-01-08"
        },
        {
          "isin": "AT0000A1K9C8",
          "name": "AUSTRIA 20/10/2026 0,75%",
          "type": "BOND",
          "country": "AT",
          "currency": "EUR",
          "maturity": "2026-10-20",
          "coupon": 0.75,
          "yield": 1.92,
          "price": 99.11,
          "change": "+0.00",
          "lastUpdate": "2026-01-08"
        }
      ]
    },
    "gov-eu-finland": {
      "name": "Finlandia - Finnish",
      "description": "Titoli di Stato finlandesi",
      "count": 27,
      "bonds": [
        {
          "isin": "FI4000566294",
          "name": "FINLANDIA 15/04/2055 2,95%",
          "type": "BOND",
          "country": "FI",
          "currency": "EUR",
          "maturity": "2055-04-15",
          "coupon": 2.95,
          "yield": 3.88,
          "price": 83.93,
          "change": "+0.00",
          "lastUpdate": "2026-01-08"
        },
        {
          "isin": "FI4000480488",
          "name": "FINLANDIA 15/04/2052 0,125%",
          "type": "BOND",
          "country": "FI",
          "currency": "EUR",
          "maturity": "2052-04-15",
          "coupon": 0.125,
          "yield": 3.8,
          "price": 39.58,
          "change": "+0.00",
          "lastUpdate": "2026-01-08"
        },
        {
          "isin": "FI4000242870",
          "name": "FINLANDIA 15/04/2047 1,375%",
          "type": "BOND",
          "country": "FI",
          "currency": "EUR",
          "maturity": "2047-04-15",
          "coupon": 1.375,
          "yield": 3.76,
          "price": 65.55,
          "change": "+0.00",
          "lastUpdate": "2026-01-08"
        },
        {
          "isin": "FI4000517677",
          "name": "FINLANDIA 15/04/2043 0,5%",
          "type": "BOND",
          "country": "FI",
          "currency": "EUR",
          "maturity": "2043-04-15",
          "coupon": 0.5,
          "yield": 3.67,
          "price": 60.02,
          "change": "+0.00",
          "lastUpdate": "2026-01-08"
        },
        {
          "isin": "FI4000586284",
          "name": "FINLANDIA 15/04/2045 3,2%",
          "type": "BOND",
          "country": "FI",
          "currency": "EUR",
          "maturity": "2045-04-15",
          "coupon": 3.2,
          "yield": 3.66,
          "price": 93.7,
          "change": "+0.00",
          "lastUpdate": "2026-01-08"
        },
        {
          "isin": "FI4000046545",
          "name": "FINLANDIA 04/07/2042 2,625%",
          "type": "BOND",
          "country": "FI",
          "currency": "EUR",
          "maturity": "2042-07-04",
          "coupon": 2.625,
          "yield": 3.59,
          "price": 88.15,
          "change": "+0.00",
          "lastUpdate": "2026-01-08"
        },
        {
          "isin": "FI4000440557",
          "name": "FINLANDIA 15/09/2040 0,25%",
          "type": "BOND",
          "country": "FI",
          "currency": "EUR",
          "maturity": "2040-09-15",
          "coupon": 0.25,
          "yield": 3.55,
          "price": 62.77,
          "change": "+0.00",
          "lastUpdate": "2026-01-08"
        },
        {
          "isin": "FI4000546528",
          "name": "FINLANDIA 15/04/2038 2,75%",
          "type": "BOND",
          "country": "FI",
          "currency": "EUR",
          "maturity": "2038-04-15",
          "coupon": 2.75,
          "yield": 3.38,
          "price": 93.8,
          "change": "+0.00",
          "lastUpdate": "2026-01-08"
        },
        {
          "isin": "FI4000415153",
          "name": "FINLANDIA 15/04/2036 0,125%",
          "type": "BOND",
          "country": "FI",
          "currency": "EUR",
          "maturity": "2036-04-15",
          "coupon": 0.125,
          "yield": 3.24,
          "price": 73.19,
          "change": "+0.00",
          "lastUpdate": "2026-01-08"
        },
        {
          "isin": "FI4000587415",
          "name": "FINLANDIA 15/09/2035 3%",
          "type": "BOND",
          "country": "FI",
          "currency": "EUR",
          "maturity": "2035-09-15",
          "coupon": 0,
          "yield": 3.14,
          "price": 98.83,
          "change": "+0.00",
          "lastUpdate": "2026-01-08"
        },
        {
          "isin": "FI4000571104",
          "name": "FINLANDIA 15/09/2034 3%",
          "type": "BOND",
          "country": "FI",
          "currency": "EUR",
          "maturity": "2034-09-15",
          "coupon": 0,
          "yield": 3.02,
          "price": 99.82,
          "change": "+0.00",
          "lastUpdate": "2026-01-08"
        },
        {
          "isin": "FI4000306758",
          "name": "FINLANDIA 15/04/2034 1,125%",
          "type": "BOND",
          "country": "FI",
          "currency": "EUR",
          "maturity": "2034-04-15",
          "coupon": 1.125,
          "yield": 3,
          "price": 86.47,
          "change": "+0.00",
          "lastUpdate": "2026-01-08"
        },
        {
          "isin": "FI4000550249",
          "name": "FINLANDIA 15/09/2033 3%",
          "type": "BOND",
          "country": "FI",
          "currency": "EUR",
          "maturity": "2033-09-15",
          "coupon": 0,
          "yield": 2.94,
          "price": 100.4,
          "change": "+0.00",
          "lastUpdate": "2026-01-08"
        },
        {
          "isin": "FI4000523238",
          "name": "FINLANDIA 15/09/2032 1,5%",
          "type": "BOND",
          "country": "FI",
          "currency": "EUR",
          "maturity": "2032-09-15",
          "coupon": 1.5,
          "yield": 2.82,
          "price": 92.06,
          "change": "+0.00",
          "lastUpdate": "2026-01-08"
        },
        {
          "isin": "FI4000591862",
          "name": "FINLANDIA 15/04/2032 2,625%",
          "type": "BOND",
          "country": "FI",
          "currency": "EUR",
          "maturity": "2032-04-15",
          "coupon": 2.625,
          "yield": 2.75,
          "price": 99.27,
          "change": "+0.00",
          "lastUpdate": "2026-01-08"
        },
        {
          "isin": "FI4000507231",
          "name": "FINLANDIA 15/09/2031 0,125%",
          "type": "BOND",
          "country": "FI",
          "currency": "EUR",
          "maturity": "2031-09-15",
          "coupon": 0.125,
          "yield": 2.69,
          "price": 86.65,
          "change": "+0.00",
          "lastUpdate": "2026-01-08"
        },
        {
          "isin": "FI4000148630",
          "name": "FINLANDIA 15/04/2031 0,75%",
          "type": "BOND",
          "country": "FI",
          "currency": "EUR",
          "maturity": "2031-04-15",
          "coupon": 0.75,
          "yield": 2.69,
          "price": 90.62,
          "change": "+0.00",
          "lastUpdate": "2026-01-08"
        },
        {
          "isin": "FI4000441878",
          "name": "FINLANDIA 15/09/2030 0%",
          "type": "BOND",
          "country": "FI",
          "currency": "EUR",
          "maturity": "2030-09-15",
          "coupon": 0,
          "yield": 2.57,
          "price": 88.82,
          "change": "+0.00",
          "lastUpdate": "2026-01-08"
        },
        {
          "isin": "FI4000577952",
          "name": "FINLANDIA 15/04/2030 2,5%",
          "type": "BOND",
          "country": "FI",
          "currency": "EUR",
          "maturity": "2030-04-15",
          "coupon": 2.5,
          "yield": 2.5,
          "price": 99.99,
          "change": "+0.00",
          "lastUpdate": "2026-01-08"
        },
        {
          "isin": "FI4000369467",
          "name": "FINLANDIA 15/09/2029 0,5%",
          "type": "BOND",
          "country": "FI",
          "currency": "EUR",
          "maturity": "2029-09-15",
          "coupon": 0.5,
          "yield": 2.41,
          "price": 93.37,
          "change": "+0.00",
          "lastUpdate": "2026-01-08"
        },
        {
          "isin": "FI4000557525",
          "name": "FINLANDIA 15/04/2029 2,875%",
          "type": "BOND",
          "country": "FI",
          "currency": "EUR",
          "maturity": "2029-04-15",
          "coupon": 2.875,
          "yield": 2.31,
          "price": 101.74,
          "change": "+0.00",
          "lastUpdate": "2026-01-08"
        },
        {
          "isin": "FI4000348727",
          "name": "FINLANDIA 15/09/2028 0,515%",
          "type": "BOND",
          "country": "FI",
          "currency": "EUR",
          "maturity": "2028-09-15",
          "coupon": 0.515,
          "yield": 2.25,
          "price": 95.5,
          "change": "+0.00",
          "lastUpdate": "2026-01-08"
        },
        {
          "isin": "FI4000197959",
          "name": "FINLANDIA 15/04/2026 0,5%",
          "type": "BOND",
          "country": "FI",
          "currency": "EUR",
          "maturity": "2026-04-15",
          "coupon": 0.5,
          "yield": 2.25,
          "price": 99.56,
          "change": "+0.00",
          "lastUpdate": "2026-01-08"
        },
        {
          "isin": "FI4000037635",
          "name": "FINLANDIA 04/07/2028 2,75%",
          "type": "BOND",
          "country": "FI",
          "currency": "EUR",
          "maturity": "2028-07-04",
          "coupon": 2.75,
          "yield": 2.15,
          "price": 101.41,
          "change": "+0.00",
          "lastUpdate": "2026-01-08"
        },
        {
          "isin": "FI4000278551",
          "name": "FINLANDIA 15/09/2027 0,5%",
          "type": "BOND",
          "country": "FI",
          "currency": "EUR",
          "maturity": "2027-09-15",
          "coupon": 0.5,
          "yield": 2.07,
          "price": 97.44,
          "change": "+0.00",
          "lastUpdate": "2026-01-08"
        },
        {
          "isin": "FI4000527551",
          "name": "FINLANDIA 15/04/2027 1,375%",
          "type": "BOND",
          "country": "FI",
          "currency": "EUR",
          "maturity": "2027-04-15",
          "coupon": 1.375,
          "yield": 1.98,
          "price": 99.25,
          "change": "+0.00",
          "lastUpdate": "2026-01-08"
        },
        {
          "isin": "FI4000511449",
          "name": "FINLANDIA 15/09/2026 0%",
          "type": "BOND",
          "country": "FI",
          "currency": "EUR",
          "maturity": "2026-09-15",
          "coupon": 0,
          "yield": 1.92,
          "price": 98.73,
          "change": "+0.00",
          "lastUpdate": "2026-01-08"
        }
      ]
    },
    "gov-eu-belgium": {
      "name": "Belgio - OLO",
      "description": "Titoli di Stato belgi",
      "count": 36,
      "bonds": [
        {
          "isin": "BE0000340498",
          "name": "BELGIO 22/06/2066 2,15%",
          "type": "BOND",
          "country": "BE",
          "currency": "EUR",
          "maturity": "2066-06-22",
          "coupon": 2.15,
          "yield": 4.35,
          "price": 58.45,
          "change": "+0.00",
          "lastUpdate": "2026-01-08"
        },
        {
          "isin": "BE0000343526",
          "name": "BELGIO 22/06/2057 2,25%",
          "type": "BOND",
          "country": "BE",
          "currency": "EUR",
          "maturity": "2057-06-22",
          "coupon": 2.25,
          "yield": 4.35,
          "price": 64.43,
          "change": "+0.00",
          "lastUpdate": "2026-01-08"
        },
        {
          "isin": "BE0000361700",
          "name": "BELGIO 22/06/2055 3,5%",
          "type": "BOND",
          "country": "BE",
          "currency": "EUR",
          "maturity": "2055-06-22",
          "coupon": 3.5,
          "yield": 4.31,
          "price": 86.6,
          "change": "+0.00",
          "lastUpdate": "2026-01-08"
        },
        {
          "isin": "BE0000358672",
          "name": "BELGIO 22/06/2054 3,3%",
          "type": "BOND",
          "country": "BE",
          "currency": "EUR",
          "maturity": "2054-06-22",
          "coupon": 3.3,
          "yield": 4.29,
          "price": 83.88,
          "change": "+0.00",
          "lastUpdate": "2026-01-08"
        },
        {
          "isin": "BE0000355645",
          "name": "BELGIO 22/06/2053 1,40%",
          "type": "BOND",
          "country": "BE",
          "currency": "EUR",
          "maturity": "2053-06-22",
          "coupon": 1.4,
          "yield": 4.28,
          "price": 53.97,
          "change": "+0.00",
          "lastUpdate": "2026-01-08"
        },
        {
          "isin": "BE0000348574",
          "name": "BELGIO 22/06/2050 1,70%",
          "type": "BOND",
          "country": "BE",
          "currency": "EUR",
          "maturity": "2050-06-22",
          "coupon": 1.7,
          "yield": 4.2,
          "price": 62.23,
          "change": "+0.00",
          "lastUpdate": "2026-01-08"
        },
        {
          "isin": "BE0000353624",
          "name": "BELGIO 22/06/2071 0,65%",
          "type": "BOND",
          "country": "BE",
          "currency": "EUR",
          "maturity": "2071-06-22",
          "coupon": 0.65,
          "yield": 4.13,
          "price": 29.1,
          "change": "+0.00",
          "lastUpdate": "2026-01-08"
        },
        {
          "isin": "BE0000338476",
          "name": "BELGIO 22/06/2047 1,6%",
          "type": "BOND",
          "country": "BE",
          "currency": "EUR",
          "maturity": "2047-06-22",
          "coupon": 1.6,
          "yield": 4.12,
          "price": 64.53,
          "change": "+0.00",
          "lastUpdate": "2026-01-08"
        },
        {
          "isin": "BE0000331406",
          "name": "BELGIO 22/06/2045 3,75%",
          "type": "BOND",
          "country": "BE",
          "currency": "EUR",
          "maturity": "2045-06-22",
          "coupon": 3.75,
          "yield": 4.02,
          "price": 96.42,
          "change": "+0.00",
          "lastUpdate": "2026-01-08"
        },
        {
          "isin": "BE0000359688",
          "name": "BELGIO 22/06/2043 3,45%",
          "type": "BOND",
          "country": "BE",
          "currency": "EUR",
          "maturity": "2043-06-22",
          "coupon": 3.45,
          "yield": 3.96,
          "price": 93.62,
          "change": "+0.00",
          "lastUpdate": "2026-01-08"
        },
        {
          "isin": "BE0000364738",
          "name": "BELGIO 22/06/2042 3,45%",
          "type": "BOND",
          "country": "BE",
          "currency": "EUR",
          "maturity": "2042-06-22",
          "coupon": 3.45,
          "yield": 3.91,
          "price": 94.49,
          "change": "+0.00",
          "lastUpdate": "2026-01-08"
        },
        {
          "isin": "BE0000350596",
          "name": "BELGIO 22/06/2040 0,4%",
          "type": "BOND",
          "country": "BE",
          "currency": "EUR",
          "maturity": "2040-06-22",
          "coupon": 0.4,
          "yield": 3.81,
          "price": 62.64,
          "change": "+0.00",
          "lastUpdate": "2026-01-08"
        },
        {
          "isin": "BE0000320292",
          "name": "BELGIO 28/03/2041 4,25%",
          "type": "BOND",
          "country": "BE",
          "currency": "EUR",
          "maturity": "2041-03-28",
          "coupon": 4.25,
          "yield": 3.81,
          "price": 105,
          "change": "+0.00",
          "lastUpdate": "2026-01-08"
        },
        {
          "isin": "BE0000356650",
          "name": "BELGIO GREEN BOND 22/04/2039 2,75%",
          "type": "BOND",
          "country": "BE",
          "currency": "EUR",
          "maturity": "2039-04-22",
          "coupon": 2.75,
          "yield": 3.67,
          "price": 90.48,
          "change": "+0.00",
          "lastUpdate": "2026-01-08"
        },
        {
          "isin": "BE0000336454",
          "name": "BELGIO 22/06/2038 1,9%",
          "type": "BOND",
          "country": "BE",
          "currency": "EUR",
          "maturity": "2038-06-22",
          "coupon": 1.9,
          "yield": 3.63,
          "price": 82.96,
          "change": "+0.00",
          "lastUpdate": "2026-01-08"
        },
        {
          "isin": "BE0000344532",
          "name": "BELGIO 22/06/2037 1,45%",
          "type": "BOND",
          "country": "BE",
          "currency": "EUR",
          "maturity": "2037-06-22",
          "coupon": 1.45,
          "yield": 3.52,
          "price": 80.75,
          "change": "+0.00",
          "lastUpdate": "2026-01-08"
        },
        {
          "isin": "BE0000363722",
          "name": "BELGIO 22/06/2035 3,1%",
          "type": "BOND",
          "country": "BE",
          "currency": "EUR",
          "maturity": "2035-06-22",
          "coupon": 3.1,
          "yield": 3.29,
          "price": 98.44,
          "change": "+0.00",
          "lastUpdate": "2026-01-08"
        },
        {
          "isin": "BE0000304130",
          "name": "BELGIO 28/03/2035 5%",
          "type": "BOND",
          "country": "BE",
          "currency": "EUR",
          "maturity": "2035-03-28",
          "coupon": 0,
          "yield": 3.25,
          "price": 113.7,
          "change": "+0.00",
          "lastUpdate": "2026-01-08"
        },
        {
          "isin": "BE0000360694",
          "name": "BELGIO 22/10/2034 2,85%",
          "type": "BOND",
          "country": "BE",
          "currency": "EUR",
          "maturity": "2034-10-22",
          "coupon": 2.85,
          "yield": 3.21,
          "price": 97.29,
          "change": "+0.00",
          "lastUpdate": "2026-01-08"
        },
        {
          "isin": "BE0000333428",
          "name": "BELGIO 22/06/2034 3%",
          "type": "BOND",
          "country": "BE",
          "currency": "EUR",
          "maturity": "2034-06-22",
          "coupon": 0,
          "yield": 3.15,
          "price": 98.92,
          "change": "+0.00",
          "lastUpdate": "2026-01-08"
        },
        {
          "isin": "BE0000357666",
          "name": "BELGIO 22/06/2033 3%",
          "type": "BOND",
          "country": "BE",
          "currency": "EUR",
          "maturity": "2033-06-22",
          "coupon": 0,
          "yield": 3.02,
          "price": 99.89,
          "change": "+0.00",
          "lastUpdate": "2026-01-08"
        },
        {
          "isin": "BE0000346552",
          "name": "BELGIO GREEN BOND 22/04/2033 1,25%",
          "type": "BOND",
          "country": "BE",
          "currency": "EUR",
          "maturity": "2033-04-22",
          "coupon": 1.25,
          "yield": 3,
          "price": 88.72,
          "change": "+0.00",
          "lastUpdate": "2026-01-08"
        },
        {
          "isin": "BE0000354630",
          "name": "BELGIO 22/06/2032 0,35%",
          "type": "BOND",
          "country": "BE",
          "currency": "EUR",
          "maturity": "2032-06-22",
          "coupon": 0.35,
          "yield": 2.91,
          "price": 85.15,
          "change": "+0.00",
          "lastUpdate": "2026-01-08"
        },
        {
          "isin": "BE0000326356",
          "name": "BELGIO 28/03/2032 4%",
          "type": "BOND",
          "country": "BE",
          "currency": "EUR",
          "maturity": "2032-03-28",
          "coupon": 0,
          "yield": 2.84,
          "price": 106.53,
          "change": "+0.00",
          "lastUpdate": "2026-01-08"
        },
        {
          "isin": "BE0000352618",
          "name": "BELGIO 22/10/2031 0%",
          "type": "BOND",
          "country": "BE",
          "currency": "EUR",
          "maturity": "2031-10-22",
          "coupon": 0,
          "yield": 2.79,
          "price": 85.29,
          "change": "+0.00",
          "lastUpdate": "2026-01-08"
        },
        {
          "isin": "BE0000335449",
          "name": "BELGIO 22/06/2031 1%",
          "type": "BOND",
          "country": "BE",
          "currency": "EUR",
          "maturity": "2031-06-22",
          "coupon": 0,
          "yield": 2.75,
          "price": 91.25,
          "change": "+0.00",
          "lastUpdate": "2026-01-08"
        },
        {
          "isin": "BE0000365743",
          "name": "BELGIO 22/10/2030 2,6%",
          "type": "BOND",
          "country": "BE",
          "currency": "EUR",
          "maturity": "2030-10-22",
          "coupon": 2.6,
          "yield": 2.66,
          "price": 99.71,
          "change": "+0.00",
          "lastUpdate": "2026-01-08"
        },
        {
          "isin": "BE0000349580",
          "name": "BELGIO 22/06/2030 0,1%",
          "type": "BOND",
          "country": "BE",
          "currency": "EUR",
          "maturity": "2030-06-22",
          "coupon": 0.1,
          "yield": 2.58,
          "price": 89.71,
          "change": "+0.00",
          "lastUpdate": "2026-01-08"
        },
        {
          "isin": "BE0000362716",
          "name": "BELGIO 22/10/2029 2,7%",
          "type": "BOND",
          "country": "BE",
          "currency": "EUR",
          "maturity": "2029-10-22",
          "coupon": 2.7,
          "yield": 2.45,
          "price": 100.89,
          "change": "+0.00",
          "lastUpdate": "2026-01-08"
        },
        {
          "isin": "BE0000347568",
          "name": "BELGIO 22/06/2029 0,9%",
          "type": "BOND",
          "country": "BE",
          "currency": "EUR",
          "maturity": "2029-06-22",
          "coupon": 0.9,
          "yield": 2.4,
          "price": 95.1,
          "change": "+0.00",
          "lastUpdate": "2026-01-08"
        },
        {
          "isin": "BE0000345547",
          "name": "BELGIO 22/06/2028 0,8%",
          "type": "BOND",
          "country": "BE",
          "currency": "EUR",
          "maturity": "2028-06-22",
          "coupon": 0.8,
          "yield": 2.21,
          "price": 96.68,
          "change": "+0.00",
          "lastUpdate": "2026-01-08"
        },
        {
          "isin": "BE0000291972",
          "name": "BELGIO 28/03/2028 5,5%",
          "type": "BOND",
          "country": "BE",
          "currency": "EUR",
          "maturity": "2028-03-28",
          "coupon": 5.5,
          "yield": 2.19,
          "price": 107.04,
          "change": "+0.00",
          "lastUpdate": "2026-01-08"
        },
        {
          "isin": "BE0000351602",
          "name": "BELGIO 22/10/2027 0%",
          "type": "BOND",
          "country": "BE",
          "currency": "EUR",
          "maturity": "2027-10-22",
          "coupon": 0,
          "yield": 2.11,
          "price": 96.36,
          "change": "+0.00",
          "lastUpdate": "2026-01-08"
        },
        {
          "isin": "BE0000341504",
          "name": "BELGIO 22/06/2027 0,8%",
          "type": "BOND",
          "country": "BE",
          "currency": "EUR",
          "maturity": "2027-06-22",
          "coupon": 0.8,
          "yield": 2.06,
          "price": 98.23,
          "change": "+0.00",
          "lastUpdate": "2026-01-08"
        },
        {
          "isin": "BE0000324336",
          "name": "BELGIO 28/03/2026 4,5%",
          "type": "BOND",
          "country": "BE",
          "currency": "EUR",
          "maturity": "2026-03-28",
          "coupon": 4.5,
          "yield": 2.02,
          "price": 100.5,
          "change": "+0.00",
          "lastUpdate": "2026-01-08"
        },
        {
          "isin": "BE0000337460",
          "name": "BELGIO 22/06/2026 1%",
          "type": "BOND",
          "country": "BE",
          "currency": "EUR",
          "maturity": "2026-06-22",
          "coupon": 0,
          "yield": 1.99,
          "price": 99.57,
          "change": "+0.00",
          "lastUpdate": "2026-01-08"
        }
      ]
    },
    "supranational": {
      "name": "Sovranazionali",
      "description": "Obbligazioni emesse da enti sovranazionali (BEI, ESM, etc)",
      "count": 306,
      "bonds": [
        {
          "isin": "XS2034314224",
          "name": "EBRD 26/01/2026 ZC TRY",
          "type": "BOND",
          "country": "XS",
          "currency": "TRY",
          "maturity": "2026-01-26",
          "coupon": 0,
          "yield": 40.17,
          "price": 98.71,
          "change": "+0.00",
          "lastUpdate": "2026-01-08"
        },
        {
          "isin": "XS2408944242",
          "name": "EBRD 23/11/2026 14,2% TRY",
          "type": "BOND",
          "country": "XS",
          "currency": "TRY",
          "maturity": "2026-11-23",
          "coupon": 14.2,
          "yield": 30.02,
          "price": 89.92,
          "change": "+0.00",
          "lastUpdate": "2026-01-08"
        },
        {
          "isin": "XS1566126345",
          "name": "BEI 16/02/2027 ZC TRY",
          "type": "BOND",
          "country": "XS",
          "currency": "TRY",
          "maturity": "2027-02-16",
          "coupon": 0,
          "yield": 18.76,
          "price": 82.83,
          "change": "+0.00",
          "lastUpdate": "2026-01-08"
        },
        {
          "isin": "XS1566126345",
          "name": "BEI 16/02/2027 ZC TRY",
          "type": "BOND",
          "country": "XS",
          "currency": "TRY",
          "maturity": "2027-02-16",
          "coupon": 0,
          "yield": 18.76,
          "price": 82.83,
          "change": "+0.00",
          "lastUpdate": "2026-01-08"
        },
        {
          "isin": "XS1807207581",
          "name": "BEI 20/04/2026 11% TRY",
          "type": "BOND",
          "country": "XS",
          "currency": "TRY",
          "maturity": "2026-04-20",
          "coupon": 0,
          "yield": 10.18,
          "price": 100.1,
          "change": "+0.00",
          "lastUpdate": "2026-01-08"
        },
        {
          "isin": "XS1807207581",
          "name": "BEI 20/04/2026 11% TRY",
          "type": "BOND",
          "country": "XS",
          "currency": "TRY",
          "maturity": "2026-04-20",
          "coupon": 0,
          "yield": 10.18,
          "price": 100.1,
          "change": "+0.00",
          "lastUpdate": "2026-01-08"
        },
        {
          "isin": "XS1238805102",
          "name": "WORLD BANK 29/05/2035 ZC ZAR",
          "type": "BOND",
          "country": "XS",
          "currency": "ZAR",
          "maturity": "2035-05-29",
          "coupon": 0,
          "yield": 8.03,
          "price": 48.48,
          "change": "+0.00",
          "lastUpdate": "2026-01-08"
        },
        {
          "isin": "XS2020595117",
          "name": "WORLD BANK 30/06/2027 ZC MXN",
          "type": "BOND",
          "country": "XS",
          "currency": "MXN",
          "maturity": "2027-06-30",
          "coupon": 0,
          "yield": 7.94,
          "price": 89.43,
          "change": "+0.00",
          "lastUpdate": "2026-01-08"
        },
        {
          "isin": "XS1578046937",
          "name": "WORLD BANK 13/03/2027 ZC MXN",
          "type": "BOND",
          "country": "XS",
          "currency": "MXN",
          "maturity": "2027-03-13",
          "coupon": 0,
          "yield": 7.9,
          "price": 91.53,
          "change": "+0.00",
          "lastUpdate": "2026-01-08"
        },
        {
          "isin": "XS1588672144",
          "name": "BEI 07/07/2027 6,5% MXN",
          "type": "BOND",
          "country": "XS",
          "currency": "MXN",
          "maturity": "2027-07-07",
          "coupon": 6.5,
          "yield": 7.46,
          "price": 98.64,
          "change": "+0.00",
          "lastUpdate": "2026-01-08"
        },
        {
          "isin": "XS1588672144",
          "name": "BEI 07/07/2027 6,5% MXN",
          "type": "BOND",
          "country": "XS",
          "currency": "MXN",
          "maturity": "2027-07-07",
          "coupon": 6.5,
          "yield": 7.46,
          "price": 98.64,
          "change": "+0.00",
          "lastUpdate": "2026-01-08"
        },
        {
          "isin": "XS1547492410",
          "name": "BEI 11/01/2027 8% MXN",
          "type": "BOND",
          "country": "XS",
          "currency": "MXN",
          "maturity": "2027-01-11",
          "coupon": 0,
          "yield": 7.34,
          "price": 100.61,
          "change": "+0.00",
          "lastUpdate": "2026-01-08"
        },
        {
          "isin": "XS1547492410",
          "name": "BEI 11/01/2027 8% MXN",
          "type": "BOND",
          "country": "XS",
          "currency": "MXN",
          "maturity": "2027-01-11",
          "coupon": 0,
          "yield": 7.34,
          "price": 100.61,
          "change": "+0.00",
          "lastUpdate": "2026-01-08"
        },
        {
          "isin": "XS0084291201",
          "name": "EBRD 31/12/2029 ZC ZAR",
          "type": "BOND",
          "country": "XS",
          "currency": "ZAR",
          "maturity": "2029-12-31",
          "coupon": 0,
          "yield": 7.04,
          "price": 76.35,
          "change": "+0.00",
          "lastUpdate": "2026-01-08"
        },
        {
          "isin": "XS0082826255",
          "name": "EBRD 29/12/2028 ZC ZAR",
          "type": "BOND",
          "country": "XS",
          "currency": "ZAR",
          "maturity": "2028-12-29",
          "coupon": 0,
          "yield": 6.82,
          "price": 82.26,
          "change": "+0.00",
          "lastUpdate": "2026-01-08"
        },
        {
          "isin": "US45905UAD63",
          "name": "WORLD BANK 14/07/2027 ZC ZAR",
          "type": "BOND",
          "country": "US",
          "currency": "ZAR",
          "maturity": "2027-07-14",
          "coupon": 0,
          "yield": 6.77,
          "price": 90.63,
          "change": "+0.00",
          "lastUpdate": "2026-01-08"
        },
        {
          "isin": "XS0082720698",
          "name": "WORLD BANK 29/12/2028 ZC ZAR",
          "type": "BOND",
          "country": "XS",
          "currency": "ZAR",
          "maturity": "2028-12-29",
          "coupon": 0,
          "yield": 6.74,
          "price": 82.43,
          "change": "+0.00",
          "lastUpdate": "2026-01-08"
        },
        {
          "isin": "XS0076593267",
          "name": "EUROPEAN BANK FOR RECONSTRUCTION AND DEVELOPMENT 17/06/2027 ZAR ZC",
          "type": "BOND",
          "country": "XS",
          "currency": "ZAR",
          "maturity": "2027-06-17",
          "coupon": 0,
          "yield": 6.74,
          "price": 91.11,
          "change": "+0.00",
          "lastUpdate": "2026-01-08"
        },
        {
          "isin": "XS0080713497",
          "name": "EUROPEAN BANK FOR RECONSTRUCTION AND DEVELOPMENT 30/12/2027 ZAR ZC",
          "type": "BOND",
          "country": "XS",
          "currency": "ZAR",
          "maturity": "2027-12-30",
          "coupon": 0,
          "yield": 6.73,
          "price": 87.99,
          "change": "+0.00",
          "lastUpdate": "2026-01-08"
        },
        {
          "isin": "XS0074789503",
          "name": "EBRD 07/04/2027 ZC ZAR",
          "type": "BOND",
          "country": "XS",
          "currency": "ZAR",
          "maturity": "2027-04-07",
          "coupon": 0,
          "yield": 6.64,
          "price": 92.38,
          "change": "+0.00",
          "lastUpdate": "2026-01-08"
        },
        {
          "isin": "XS1605368536",
          "name": "BEI 05/05/2027 8% ZAR",
          "type": "BOND",
          "country": "XS",
          "currency": "ZAR",
          "maturity": "2027-05-05",
          "coupon": 0,
          "yield": 6.62,
          "price": 101.62,
          "change": "+0.00",
          "lastUpdate": "2026-01-08"
        },
        {
          "isin": "XS1605368536",
          "name": "BEI 05/05/2027 8% ZAR",
          "type": "BOND",
          "country": "XS",
          "currency": "ZAR",
          "maturity": "2027-05-05",
          "coupon": 0,
          "yield": 6.62,
          "price": 101.62,
          "change": "+0.00",
          "lastUpdate": "2026-01-08"
        },
        {
          "isin": "XS1167524922",
          "name": "BEI 21/12/2026 8,125% ZAR",
          "type": "BOND",
          "country": "XS",
          "currency": "ZAR",
          "maturity": "2026-12-21",
          "coupon": 8.125,
          "yield": 6.6,
          "price": 101.33,
          "change": "+0.00",
          "lastUpdate": "2026-01-08"
        },
        {
          "isin": "XS1167524922",
          "name": "BEI 21/12/2026 8,125% ZAR",
          "type": "BOND",
          "country": "XS",
          "currency": "ZAR",
          "maturity": "2026-12-21",
          "coupon": 8.125,
          "yield": 6.6,
          "price": 101.33,
          "change": "+0.00",
          "lastUpdate": "2026-01-08"
        },
        {
          "isin": "XS2317058720",
          "name": "WORLD BANK 16/03/2026 1,25% NOK",
          "type": "BOND",
          "country": "XS",
          "currency": "NOK",
          "maturity": "2026-03-16",
          "coupon": 1.25,
          "yield": 5.56,
          "price": 99.28,
          "change": "+0.00",
          "lastUpdate": "2026-01-08"
        },
        {
          "isin": "XS0083662923",
          "name": "BERS 04/02/2048 ZC",
          "type": "BOND",
          "country": "XS",
          "currency": "ITL",
          "maturity": "2048-02-04",
          "coupon": 0,
          "yield": 5.45,
          "price": 31.04,
          "change": "+0.00",
          "lastUpdate": "2026-01-08"
        },
        {
          "isin": "XS0202407093",
          "name": "BEI 12/10/2054 4,625% GBP",
          "type": "BOND",
          "country": "XS",
          "currency": "GBP",
          "maturity": "2054-10-12",
          "coupon": 4.625,
          "yield": 5.14,
          "price": 92.3,
          "change": "+0.00",
          "lastUpdate": "2026-01-08"
        },
        {
          "isin": "XS0202407093",
          "name": "BEI 12/10/2054 4,625% GBP",
          "type": "BOND",
          "country": "XS",
          "currency": "GBP",
          "maturity": "2054-10-12",
          "coupon": 4.625,
          "yield": 5.14,
          "price": 92.3,
          "change": "+0.00",
          "lastUpdate": "2026-01-08"
        },
        {
          "isin": "XS0295479983",
          "name": "BEI 07/03/2044 4,5% GBP",
          "type": "BOND",
          "country": "XS",
          "currency": "GBP",
          "maturity": "2044-03-07",
          "coupon": 4.5,
          "yield": 5.06,
          "price": 93.46,
          "change": "+0.00",
          "lastUpdate": "2026-01-08"
        },
        {
          "isin": "XS0295479983",
          "name": "BEI 07/03/2044 4,5% GBP",
          "type": "BOND",
          "country": "XS",
          "currency": "GBP",
          "maturity": "2044-03-07",
          "coupon": 4.5,
          "yield": 5.06,
          "price": 93.46,
          "change": "+0.00",
          "lastUpdate": "2026-01-08"
        },
        {
          "isin": "XS0096499057",
          "name": "BEI 15/04/2039 5% GBP",
          "type": "BOND",
          "country": "XS",
          "currency": "GBP",
          "maturity": "2039-04-15",
          "coupon": 0,
          "yield": 4.73,
          "price": 102.63,
          "change": "+0.00",
          "lastUpdate": "2026-01-08"
        },
        {
          "isin": "XS0096499057",
          "name": "BEI 15/04/2039 5% GBP",
          "type": "BOND",
          "country": "XS",
          "currency": "GBP",
          "maturity": "2039-04-15",
          "coupon": 0,
          "yield": 4.73,
          "price": 102.63,
          "change": "+0.00",
          "lastUpdate": "2026-01-08"
        },
        {
          "isin": "XS0740808802",
          "name": "BEI 08/06/2037 3,875% GBP",
          "type": "BOND",
          "country": "XS",
          "currency": "GBP",
          "maturity": "2037-06-08",
          "coupon": 3.875,
          "yield": 4.6,
          "price": 93.69,
          "change": "+0.00",
          "lastUpdate": "2026-01-08"
        },
        {
          "isin": "XS0740808802",
          "name": "BEI 08/06/2037 3,875% GBP",
          "type": "BOND",
          "country": "XS",
          "currency": "GBP",
          "maturity": "2037-06-08",
          "coupon": 3.875,
          "yield": 4.6,
          "price": 93.69,
          "change": "+0.00",
          "lastUpdate": "2026-01-08"
        },
        {
          "isin": "US298785DV50",
          "name": "BEI 15/02/2036 4,875% USD",
          "type": "BOND",
          "country": "US",
          "currency": "USD",
          "maturity": "2036-02-15",
          "coupon": 4.875,
          "yield": 4.26,
          "price": 105.4,
          "change": "+0.00",
          "lastUpdate": "2026-01-08"
        },
        {
          "isin": "US298785DV50",
          "name": "BEI 15/02/2036 4,875% USD",
          "type": "BOND",
          "country": "US",
          "currency": "USD",
          "maturity": "2036-02-15",
          "coupon": 4.875,
          "yield": 4.26,
          "price": 105.4,
          "change": "+0.00",
          "lastUpdate": "2026-01-08"
        },
        {
          "isin": "EU000A4EG039",
          "name": "EUROPEAN UNION 12/10/2055 4%",
          "type": "BOND",
          "country": "EU",
          "currency": "EUR",
          "maturity": "2055-10-12",
          "coupon": 0,
          "yield": 4.06,
          "price": 98.94,
          "change": "+0.00",
          "lastUpdate": "2026-01-08"
        },
        {
          "isin": "XS0114126294",
          "name": "BEI 07/06/2032 5,625% GBP",
          "type": "BOND",
          "country": "XS",
          "currency": "GBP",
          "maturity": "2032-06-07",
          "coupon": 5.625,
          "yield": 4.04,
          "price": 108.73,
          "change": "+0.00",
          "lastUpdate": "2026-01-08"
        },
        {
          "isin": "XS0114126294",
          "name": "BEI 07/06/2032 5,625% GBP",
          "type": "BOND",
          "country": "XS",
          "currency": "GBP",
          "maturity": "2032-06-07",
          "coupon": 5.625,
          "yield": 4.04,
          "price": 108.73,
          "change": "+0.00",
          "lastUpdate": "2026-01-08"
        },
        {
          "isin": "EU000A3K4EY2",
          "name": "EUROPEAN UNION 05/10/2054 3,375%",
          "type": "BOND",
          "country": "EU",
          "currency": "EUR",
          "maturity": "2054-10-05",
          "coupon": 3.375,
          "yield": 4.03,
          "price": 88.97,
          "change": "+0.00",
          "lastUpdate": "2026-01-08"
        },
        {
          "isin": "EU000A3K4DY4",
          "name": "EUROPEAN UNION 04/03/2053 3%",
          "type": "BOND",
          "country": "EU",
          "currency": "EUR",
          "maturity": "2053-03-04",
          "coupon": 0,
          "yield": 4.01,
          "price": 83.47,
          "change": "+0.00",
          "lastUpdate": "2026-01-08"
        },
        {
          "isin": "EU000A3K4DT4",
          "name": "EUROPEAN UNION 04/10/2052 2,5%",
          "type": "BOND",
          "country": "EU",
          "currency": "EUR",
          "maturity": "2052-10-04",
          "coupon": 2.5,
          "yield": 4,
          "price": 75.58,
          "change": "+0.00",
          "lastUpdate": "2026-01-08"
        },
        {
          "isin": "EU000A3K4EU0",
          "name": "EUROPEAN UNION 04/02/2050 3,25% GREEN BOND",
          "type": "BOND",
          "country": "EU",
          "currency": "EUR",
          "maturity": "2050-02-04",
          "coupon": 3.25,
          "yield": 3.94,
          "price": 89.36,
          "change": "+0.00",
          "lastUpdate": "2026-01-08"
        },
        {
          "isin": "EU000A3LTF25",
          "name": "BEI GREEN BOND 23/07/2029 3,625% NOK",
          "type": "BOND",
          "country": "EU",
          "currency": "NOK",
          "maturity": "2029-07-23",
          "coupon": 3.625,
          "yield": 3.93,
          "price": 99,
          "change": "+0.00",
          "lastUpdate": "2026-01-08"
        },
        {
          "isin": "EU000A3LTF25",
          "name": "BEI GREEN BOND 23/07/2029 3,625% NOK",
          "type": "BOND",
          "country": "EU",
          "currency": "NOK",
          "maturity": "2029-07-23",
          "coupon": 3.625,
          "yield": 3.93,
          "price": 99,
          "change": "+0.00",
          "lastUpdate": "2026-01-08"
        },
        {
          "isin": "EU000A3K4DM9",
          "name": "EUROPEAN UNION GREEN BOND 04/02/2048 2,625%",
          "type": "BOND",
          "country": "EU",
          "currency": "EUR",
          "maturity": "2048-02-04",
          "coupon": 2.625,
          "yield": 3.88,
          "price": 81.56,
          "change": "+0.00",
          "lastUpdate": "2026-01-08"
        },
        {
          "isin": "EU000A3KTGW6",
          "name": "EUROPEAN UNION 06/07/2051 0,7%",
          "type": "BOND",
          "country": "EU",
          "currency": "EUR",
          "maturity": "2051-07-06",
          "coupon": 0.7,
          "yield": 3.88,
          "price": 49.09,
          "change": "+0.00",
          "lastUpdate": "2026-01-08"
        },
        {
          "isin": "US298785KE52",
          "name": "BEI GREEN BOND 10/10/2031 4,375% USD",
          "type": "BOND",
          "country": "US",
          "currency": "USD",
          "maturity": "2031-10-10",
          "coupon": 4.375,
          "yield": 3.84,
          "price": 102.92,
          "change": "+0.00",
          "lastUpdate": "2026-01-08"
        },
        {
          "isin": "EU000A1G0DN3",
          "name": "EFSF 28/02/2056 2%",
          "type": "BOND",
          "country": "EU",
          "currency": "EUR",
          "maturity": "2056-02-28",
          "coupon": 0,
          "yield": 3.84,
          "price": 67.54,
          "change": "+0.00",
          "lastUpdate": "2026-01-08"
        },
        {
          "isin": "US298785KE52",
          "name": "BEI GREEN BOND 10/10/2031 4,375% USD",
          "type": "BOND",
          "country": "US",
          "currency": "USD",
          "maturity": "2031-10-10",
          "coupon": 4.375,
          "yield": 3.84,
          "price": 102.92,
          "change": "+0.00",
          "lastUpdate": "2026-01-08"
        },
        {
          "isin": "XS2338004497",
          "name": "BEI GREEN BOND 17/02/2027 1,25% NOK",
          "type": "BOND",
          "country": "XS",
          "currency": "NOK",
          "maturity": "2027-02-17",
          "coupon": 1.25,
          "yield": 3.83,
          "price": 97.27,
          "change": "+0.00",
          "lastUpdate": "2026-01-08"
        },
        {
          "isin": "XS2338004497",
          "name": "BEI GREEN BOND 17/02/2027 1,25% NOK",
          "type": "BOND",
          "country": "XS",
          "currency": "NOK",
          "maturity": "2027-02-17",
          "coupon": 1.25,
          "yield": 3.83,
          "price": 97.27,
          "change": "+0.00",
          "lastUpdate": "2026-01-08"
        },
        {
          "isin": "EU000A284469",
          "name": "EUROPEAN UNION 04/11/2050 0,3%",
          "type": "BOND",
          "country": "EU",
          "currency": "EUR",
          "maturity": "2050-11-04",
          "coupon": 0.3,
          "yield": 3.81,
          "price": 44.31,
          "change": "+0.00",
          "lastUpdate": "2026-01-08"
        },
        {
          "isin": "EU000A4EA8Y7",
          "name": "EUROPEAN UNION 12/10/2045 3,75%",
          "type": "BOND",
          "country": "EU",
          "currency": "EUR",
          "maturity": "2045-10-12",
          "coupon": 3.75,
          "yield": 3.81,
          "price": 99.18,
          "change": "+0.00",
          "lastUpdate": "2026-01-08"
        },
        {
          "isin": "XS0415532273",
          "name": "BEI 07/06/2029 4,5% GBP",
          "type": "BOND",
          "country": "XS",
          "currency": "GBP",
          "maturity": "2029-06-07",
          "coupon": 4.5,
          "yield": 3.8,
          "price": 102.17,
          "change": "+0.00",
          "lastUpdate": "2026-01-08"
        },
        {
          "isin": "EU000A2SCAA6",
          "name": "EFSF 17/01/2053 0,7%",
          "type": "BOND",
          "country": "EU",
          "currency": "EUR",
          "maturity": "2053-01-17",
          "coupon": 0.7,
          "yield": 3.8,
          "price": 48.2,
          "change": "+0.00",
          "lastUpdate": "2026-01-08"
        },
        {
          "isin": "XS0415532273",
          "name": "BEI 07/06/2029 4,5% GBP",
          "type": "BOND",
          "country": "XS",
          "currency": "GBP",
          "maturity": "2029-06-07",
          "coupon": 4.5,
          "yield": 3.8,
          "price": 102.17,
          "change": "+0.00",
          "lastUpdate": "2026-01-08"
        },
        {
          "isin": "EU000A1G0D96",
          "name": "EUROPEAN FINANCIAL STABILITY FACILITY 17/07/2053 1,75%",
          "type": "BOND",
          "country": "EU",
          "currency": "EUR",
          "maturity": "2053-07-17",
          "coupon": 1.75,
          "yield": 3.79,
          "price": 65.46,
          "change": "+0.00",
          "lastUpdate": "2026-01-08"
        },
        {
          "isin": "EU000A3K4EL9",
          "name": "EUROPEAN UNION 04/04/2044 4%",
          "type": "BOND",
          "country": "EU",
          "currency": "EUR",
          "maturity": "2044-04-04",
          "coupon": 0,
          "yield": 3.79,
          "price": 102.67,
          "change": "+0.00",
          "lastUpdate": "2026-01-08"
        },
        {
          "isin": "XS0085727559",
          "name": "BEI 07/12/2028 6% GBP",
          "type": "BOND",
          "country": "XS",
          "currency": "GBP",
          "maturity": "2028-12-07",
          "coupon": 0,
          "yield": 3.79,
          "price": 105.96,
          "change": "+0.00",
          "lastUpdate": "2026-01-08"
        },
        {
          "isin": "XS1490724975",
          "name": "BEI 21/09/2026 1% GBP",
          "type": "BOND",
          "country": "XS",
          "currency": "GBP",
          "maturity": "2026-09-21",
          "coupon": 0,
          "yield": 3.79,
          "price": 98.13,
          "change": "+0.00",
          "lastUpdate": "2026-01-08"
        },
        {
          "isin": "XS0085727559",
          "name": "BEI 07/12/2028 6% GBP",
          "type": "BOND",
          "country": "XS",
          "currency": "GBP",
          "maturity": "2028-12-07",
          "coupon": 0,
          "yield": 3.79,
          "price": 105.96,
          "change": "+0.00",
          "lastUpdate": "2026-01-08"
        },
        {
          "isin": "XS1490724975",
          "name": "BEI 21/09/2026 1% GBP",
          "type": "BOND",
          "country": "XS",
          "currency": "GBP",
          "maturity": "2026-09-21",
          "coupon": 0,
          "yield": 3.79,
          "price": 98.13,
          "change": "+0.00",
          "lastUpdate": "2026-01-08"
        },
        {
          "isin": "EU000A3KNYG5",
          "name": "EUROPEAN UNION 02/05/2046 0,45%",
          "type": "BOND",
          "country": "EU",
          "currency": "EUR",
          "maturity": "2046-05-02",
          "coupon": 0.45,
          "yield": 3.77,
          "price": 53.44,
          "change": "+0.00",
          "lastUpdate": "2026-01-08"
        },
        {
          "isin": "US459058KU68",
          "name": "WORLD BANK 25/07/2030 4% USD",
          "type": "BOND",
          "country": "US",
          "currency": "USD",
          "maturity": "2030-07-25",
          "coupon": 0,
          "yield": 3.77,
          "price": 101.1,
          "change": "+0.00",
          "lastUpdate": "2026-01-08"
        },
        {
          "isin": "EU000A1G0DW4",
          "name": "EFSF 10/07/2048 1,8%",
          "type": "BOND",
          "country": "EU",
          "currency": "EUR",
          "maturity": "2048-07-10",
          "coupon": 1.8,
          "yield": 3.77,
          "price": 70.51,
          "change": "+0.00",
          "lastUpdate": "2026-01-08"
        },
        {
          "isin": "XS1753042743",
          "name": "BEI 16/10/2048 1,5%",
          "type": "BOND",
          "country": "XS",
          "currency": "EUR",
          "maturity": "2048-10-16",
          "coupon": 1.5,
          "yield": 3.77,
          "price": 65.76,
          "change": "+0.00",
          "lastUpdate": "2026-01-08"
        },
        {
          "isin": "XS1753042743",
          "name": "BEI 16/10/2048 1,5%",
          "type": "BOND",
          "country": "XS",
          "currency": "EUR",
          "maturity": "2048-10-16",
          "coupon": 1.5,
          "yield": 3.77,
          "price": 65.76,
          "change": "+0.00",
          "lastUpdate": "2026-01-08"
        },
        {
          "isin": "EU000A1G0EG5",
          "name": "EUROPEAN FINANCIAL STABILITY FACILITY 20/01/2050 0,7%",
          "type": "BOND",
          "country": "EU",
          "currency": "EUR",
          "maturity": "2050-01-20",
          "coupon": 0.7,
          "yield": 3.73,
          "price": 52.48,
          "change": "+0.00",
          "lastUpdate": "2026-01-08"
        },
        {
          "isin": "EU000A1G0DJ1",
          "name": "EFSF 31/05/2047 1,375%",
          "type": "BOND",
          "country": "EU",
          "currency": "EUR",
          "maturity": "2047-05-31",
          "coupon": 1.375,
          "yield": 3.71,
          "price": 65.93,
          "change": "+0.00",
          "lastUpdate": "2026-01-08"
        },
        {
          "isin": "EU000A1G0DD4",
          "name": "EFSF 17/02/2045 1,2%",
          "type": "BOND",
          "country": "EU",
          "currency": "EUR",
          "maturity": "2045-02-17",
          "coupon": 1.2,
          "yield": 3.71,
          "price": 66.11,
          "change": "+0.00",
          "lastUpdate": "2026-01-08"
        },
        {
          "isin": "XS2290963466",
          "name": "BEI 27/01/2051 0,05%",
          "type": "BOND",
          "country": "XS",
          "currency": "EUR",
          "maturity": "2051-01-27",
          "coupon": 0.05,
          "yield": 3.71,
          "price": 41,
          "change": "+0.00",
          "lastUpdate": "2026-01-08"
        },
        {
          "isin": "XS2290963466",
          "name": "BEI 27/01/2051 0,05%",
          "type": "BOND",
          "country": "XS",
          "currency": "EUR",
          "maturity": "2051-01-27",
          "coupon": 0.05,
          "yield": 3.71,
          "price": 41,
          "change": "+0.00",
          "lastUpdate": "2026-01-08"
        },
        {
          "isin": "EU000A3KRJR4",
          "name": "EUROPEAN UNION 04/01/2047 0,75%",
          "type": "BOND",
          "country": "EU",
          "currency": "EUR",
          "maturity": "2047-01-04",
          "coupon": 0.75,
          "yield": 3.7,
          "price": 57.44,
          "change": "+0.00",
          "lastUpdate": "2026-01-08"
        },
        {
          "isin": "EU000A3K4DV0",
          "name": "EUROPEAN UNION 04/11/2042 3,375%",
          "type": "BOND",
          "country": "EU",
          "currency": "EUR",
          "maturity": "2042-11-04",
          "coupon": 3.375,
          "yield": 3.7,
          "price": 95.94,
          "change": "+0.00",
          "lastUpdate": "2026-01-08"
        },
        {
          "isin": "EU000A3K4DG1",
          "name": "EUROPEAN UNION GREEN BOND 04/02/2043 1,25%",
          "type": "BOND",
          "country": "EU",
          "currency": "EUR",
          "maturity": "2043-02-04",
          "coupon": 1.25,
          "yield": 3.7,
          "price": 69.38,
          "change": "+0.00",
          "lastUpdate": "2026-01-08"
        },
        {
          "isin": "XS1641457277",
          "name": "BEI GREEN BOND 15/11/2047 1,5%",
          "type": "BOND",
          "country": "XS",
          "currency": "EUR",
          "maturity": "2047-11-15",
          "coupon": 1.5,
          "yield": 3.7,
          "price": 67.48,
          "change": "+0.00",
          "lastUpdate": "2026-01-08"
        },
        {
          "isin": "XS1641457277",
          "name": "BEI GREEN BOND 15/11/2047 1,5%",
          "type": "BOND",
          "country": "XS",
          "currency": "EUR",
          "maturity": "2047-11-15",
          "coupon": 1.5,
          "yield": 3.7,
          "price": 67.48,
          "change": "+0.00",
          "lastUpdate": "2026-01-08"
        },
        {
          "isin": "EU000A1G0DB8",
          "name": "EFSF 29/07/2044 2,35%",
          "type": "BOND",
          "country": "EU",
          "currency": "EUR",
          "maturity": "2044-07-29",
          "coupon": 2.35,
          "yield": 3.67,
          "price": 82.48,
          "change": "+0.00",
          "lastUpdate": "2026-01-08"
        },
        {
          "isin": "XS1505567088",
          "name": "BEI 13/09/2047 0,875%",
          "type": "BOND",
          "country": "XS",
          "currency": "EUR",
          "maturity": "2047-09-13",
          "coupon": 0.875,
          "yield": 3.65,
          "price": 58.94,
          "change": "+0.00",
          "lastUpdate": "2026-01-08"
        },
        {
          "isin": "XS1505567088",
          "name": "BEI 13/09/2047 0,875%",
          "type": "BOND",
          "country": "XS",
          "currency": "EUR",
          "maturity": "2047-09-13",
          "coupon": 0.875,
          "yield": 3.65,
          "price": 58.94,
          "change": "+0.00",
          "lastUpdate": "2026-01-08"
        },
        {
          "isin": "EU000A3KT6B1",
          "name": "EUROPEAN UNION 04/07/2041 0,45%",
          "type": "BOND",
          "country": "EU",
          "currency": "EUR",
          "maturity": "2041-07-04",
          "coupon": 0.45,
          "yield": 3.64,
          "price": 62.8,
          "change": "+0.00",
          "lastUpdate": "2026-01-08"
        },
        {
          "isin": "EU000A1U9936",
          "name": "EUROPEAN STABILITY MECHANISM 01/12/2055 1,85%",
          "type": "BOND",
          "country": "EU",
          "currency": "EUR",
          "maturity": "2055-12-01",
          "coupon": 1.85,
          "yield": 3.63,
          "price": 67.85,
          "change": "+0.00",
          "lastUpdate": "2026-01-08"
        },
        {
          "isin": "EU000A4EJF17",
          "name": "EUROPEAN UNION 12/12/2040 3,625%",
          "type": "BOND",
          "country": "EU",
          "currency": "EUR",
          "maturity": "2040-12-12",
          "coupon": 3.625,
          "yield": 3.62,
          "price": 100.06,
          "change": "+0.00",
          "lastUpdate": "2026-01-08"
        },
        {
          "isin": "XS1107247725",
          "name": "BEI 15/09/2045 1,75%",
          "type": "BOND",
          "country": "XS",
          "currency": "EUR",
          "maturity": "2045-09-15",
          "coupon": 1.75,
          "yield": 3.62,
          "price": 74.03,
          "change": "+0.00",
          "lastUpdate": "2026-01-08"
        },
        {
          "isin": "EU000A1GY6W8",
          "name": "EUROPEAN UNION 04/04/2042 3,75%",
          "type": "BOND",
          "country": "EU",
          "currency": "EUR",
          "maturity": "2042-04-04",
          "coupon": 3.75,
          "yield": 3.62,
          "price": 101.6,
          "change": "+0.00",
          "lastUpdate": "2026-01-08"
        },
        {
          "isin": "XS1107247725",
          "name": "BEI 15/09/2045 1,75%",
          "type": "BOND",
          "country": "XS",
          "currency": "EUR",
          "maturity": "2045-09-15",
          "coupon": 1.75,
          "yield": 3.62,
          "price": 74.03,
          "change": "+0.00",
          "lastUpdate": "2026-01-08"
        },
        {
          "isin": "US298785JR84",
          "name": "BEI 15/03/2029 1,75% USD",
          "type": "BOND",
          "country": "US",
          "currency": "USD",
          "maturity": "2029-03-15",
          "coupon": 1.75,
          "yield": 3.59,
          "price": 94.64,
          "change": "+0.00",
          "lastUpdate": "2026-01-08"
        },
        {
          "isin": "US298785JR84",
          "name": "BEI 15/03/2029 1,75% USD",
          "type": "BOND",
          "country": "US",
          "currency": "USD",
          "maturity": "2029-03-15",
          "coupon": 1.75,
          "yield": 3.59,
          "price": 94.64,
          "change": "+0.00",
          "lastUpdate": "2026-01-08"
        },
        {
          "isin": "XS0752034206",
          "name": "BEI 14/03/2042 3,625%",
          "type": "BOND",
          "country": "XS",
          "currency": "EUR",
          "maturity": "2042-03-14",
          "coupon": 3.625,
          "yield": 3.57,
          "price": 100.68,
          "change": "+0.00",
          "lastUpdate": "2026-01-08"
        },
        {
          "isin": "XS0752034206",
          "name": "BEI 14/03/2042 3,625%",
          "type": "BOND",
          "country": "XS",
          "currency": "EUR",
          "maturity": "2042-03-14",
          "coupon": 3.625,
          "yield": 3.57,
          "price": 100.68,
          "change": "+0.00",
          "lastUpdate": "2026-01-08"
        },
        {
          "isin": "EU000A1Z99A1",
          "name": "EUROPEAN STABILITY MECHANISM 02/11/2046 1,8%",
          "type": "BOND",
          "country": "EU",
          "currency": "EUR",
          "maturity": "2046-11-02",
          "coupon": 1.8,
          "yield": 3.54,
          "price": 74.63,
          "change": "+0.00",
          "lastUpdate": "2026-01-08"
        },
        {
          "isin": "EU000A3LZ0X9",
          "name": "EUROPEAN UNION 04/10/2039 3,375%",
          "type": "BOND",
          "country": "EU",
          "currency": "EUR",
          "maturity": "2039-10-04",
          "coupon": 3.375,
          "yield": 3.53,
          "price": 98.34,
          "change": "+0.00",
          "lastUpdate": "2026-01-08"
        },
        {
          "isin": "EU000A283867",
          "name": "EUROPEAN UNION 04/10/2040 0,1%",
          "type": "BOND",
          "country": "EU",
          "currency": "EUR",
          "maturity": "2040-10-04",
          "coupon": 0.1,
          "yield": 3.48,
          "price": 61.53,
          "change": "+0.00",
          "lastUpdate": "2026-01-08"
        },
        {
          "isin": "XS0070553820",
          "name": "BEI 06/11/2026 USD ZC",
          "type": "BOND",
          "country": "XS",
          "currency": "USD",
          "maturity": "2026-11-06",
          "coupon": 0,
          "yield": 3.46,
          "price": 97.26,
          "change": "+0.00",
          "lastUpdate": "2026-01-08"
        },
        {
          "isin": "XS0070553820",
          "name": "BEI 06/11/2026 USD ZC",
          "type": "BOND",
          "country": "XS",
          "currency": "USD",
          "maturity": "2026-11-06",
          "coupon": 0,
          "yield": 3.46,
          "price": 97.26,
          "change": "+0.00",
          "lastUpdate": "2026-01-08"
        },
        {
          "isin": "EU000A3K4D74",
          "name": "EUROPEAN UNION 04/10/2038 3,375%",
          "type": "BOND",
          "country": "EU",
          "currency": "EUR",
          "maturity": "2038-10-04",
          "coupon": 3.375,
          "yield": 3.45,
          "price": 99.2,
          "change": "+0.00",
          "lastUpdate": "2026-01-08"
        },
        {
          "isin": "XS2189259018",
          "name": "BEI 15/06/2040 0,25%",
          "type": "BOND",
          "country": "XS",
          "currency": "EUR",
          "maturity": "2040-06-15",
          "coupon": 0.25,
          "yield": 3.43,
          "price": 64.29,
          "change": "+0.00",
          "lastUpdate": "2026-01-08"
        },
        {
          "isin": "XS2189259018",
          "name": "BEI 15/06/2040 0,25%",
          "type": "BOND",
          "country": "XS",
          "currency": "EUR",
          "maturity": "2040-06-15",
          "coupon": 0.25,
          "yield": 3.43,
          "price": 64.29,
          "change": "+0.00",
          "lastUpdate": "2026-01-08"
        },
        {
          "isin": "EU000A3K4DC0",
          "name": "EUROPEAN UNION 11/03/2037 0,875%",
          "type": "BOND",
          "country": "EU",
          "currency": "EUR",
          "maturity": "2037-03-11",
          "coupon": 0.875,
          "yield": 3.42,
          "price": 76.74,
          "change": "+0.00",
          "lastUpdate": "2026-01-08"
        },
        {
          "isin": "EU000A1G30R0",
          "name": "EUROPEAN UNION 04/04/2038 3,375%",
          "type": "BOND",
          "country": "EU",
          "currency": "EUR",
          "maturity": "2038-04-04",
          "coupon": 3.375,
          "yield": 3.4,
          "price": 99.72,
          "change": "+0.00",
          "lastUpdate": "2026-01-08"
        },
        {
          "isin": "US298785HD17",
          "name": "BEI GREEN BOND 13/04/2026 2,125% USD",
          "type": "BOND",
          "country": "US",
          "currency": "USD",
          "maturity": "2026-04-13",
          "coupon": 2.125,
          "yield": 3.35,
          "price": 99.71,
          "change": "+0.00",
          "lastUpdate": "2026-01-08"
        },
        {
          "isin": "EU000A3K4D09",
          "name": "EUROPEAN UNION 04/12/2037 2,75%",
          "type": "BOND",
          "country": "EU",
          "currency": "EUR",
          "maturity": "2037-12-04",
          "coupon": 2.75,
          "yield": 3.35,
          "price": 94.21,
          "change": "+0.00",
          "lastUpdate": "2026-01-08"
        },
        {
          "isin": "EU000A2SCAK5",
          "name": "EFSF 30/08/2038 3,375%",
          "type": "BOND",
          "country": "EU",
          "currency": "EUR",
          "maturity": "2038-08-30",
          "coupon": 3.375,
          "yield": 3.35,
          "price": 100.28,
          "change": "+0.00",
          "lastUpdate": "2026-01-08"
        },
        {
          "isin": "US298785HD17",
          "name": "BEI GREEN BOND 13/04/2026 2,125% USD",
          "type": "BOND",
          "country": "US",
          "currency": "USD",
          "maturity": "2026-04-13",
          "coupon": 2.125,
          "yield": 3.35,
          "price": 99.71,
          "change": "+0.00",
          "lastUpdate": "2026-01-08"
        },
        {
          "isin": "EU000A3K4DE6",
          "name": "EUROPEAN UNION 04/06/2037 1,125%",
          "type": "BOND",
          "country": "EU",
          "currency": "EUR",
          "maturity": "2037-06-04",
          "coupon": 1.125,
          "yield": 3.31,
          "price": 79.56,
          "change": "+0.00",
          "lastUpdate": "2026-01-08"
        },
        {
          "isin": "EU000A3K4C42",
          "name": "EUROPEAN UNION GREEN BOND 04/02/2037 0,4%",
          "type": "BOND",
          "country": "EU",
          "currency": "EUR",
          "maturity": "2037-02-04",
          "coupon": 0.4,
          "yield": 3.25,
          "price": 73.88,
          "change": "+0.00",
          "lastUpdate": "2026-01-08"
        },
        {
          "isin": "EU000A3LT492",
          "name": "BEI 15/02/2039 3%",
          "type": "BOND",
          "country": "EU",
          "currency": "EUR",
          "maturity": "2039-02-15",
          "coupon": 0,
          "yield": 3.25,
          "price": 97.4,
          "change": "+0.00",
          "lastUpdate": "2026-01-08"
        },
        {
          "isin": "EU000A3LT492",
          "name": "BEI 15/02/2039 3%",
          "type": "BOND",
          "country": "EU",
          "currency": "EUR",
          "maturity": "2039-02-15",
          "coupon": 0,
          "yield": 3.25,
          "price": 97.4,
          "change": "+0.00",
          "lastUpdate": "2026-01-08"
        },
        {
          "isin": "XS0219724878",
          "name": "BEI 15/10/2037 4%",
          "type": "BOND",
          "country": "XS",
          "currency": "EUR",
          "maturity": "2037-10-15",
          "coupon": 0,
          "yield": 3.23,
          "price": 107.44,
          "change": "+0.00",
          "lastUpdate": "2026-01-08"
        },
        {
          "isin": "XS0219724878",
          "name": "BEI 15/10/2037 4%",
          "type": "BOND",
          "country": "XS",
          "currency": "EUR",
          "maturity": "2037-10-15",
          "coupon": 0,
          "yield": 3.23,
          "price": 107.44,
          "change": "+0.00",
          "lastUpdate": "2026-01-08"
        },
        {
          "isin": "XS1500338618",
          "name": "BEI GREEN BOND 13/11/2037 0,5%",
          "type": "BOND",
          "country": "XS",
          "currency": "EUR",
          "maturity": "2037-11-13",
          "coupon": 0.5,
          "yield": 3.22,
          "price": 73.59,
          "change": "+0.00",
          "lastUpdate": "2026-01-08"
        },
        {
          "isin": "EU000A1G0AT6",
          "name": "EFSF 03/04/2037 3,375%",
          "type": "BOND",
          "country": "EU",
          "currency": "EUR",
          "maturity": "2037-04-03",
          "coupon": 3.375,
          "yield": 3.22,
          "price": 101.47,
          "change": "+0.00",
          "lastUpdate": "2026-01-08"
        },
        {
          "isin": "XS1500338618",
          "name": "BEI GREEN BOND 13/11/2037 0,5%",
          "type": "BOND",
          "country": "XS",
          "currency": "EUR",
          "maturity": "2037-11-13",
          "coupon": 0.5,
          "yield": 3.22,
          "price": 73.59,
          "change": "+0.00",
          "lastUpdate": "2026-01-08"
        },
        {
          "isin": "EU000A1Z6TV6",
          "name": "EUROPEAN UNION 04/10/2035 1,5%",
          "type": "BOND",
          "country": "EU",
          "currency": "EUR",
          "maturity": "2035-10-04",
          "coupon": 1.5,
          "yield": 3.19,
          "price": 86.05,
          "change": "+0.00",
          "lastUpdate": "2026-01-08"
        },
        {
          "isin": "EU000A3K4EG9",
          "name": "BEI GREEN BOND 15/05/2037 3,125%",
          "type": "BOND",
          "country": "EU",
          "currency": "EUR",
          "maturity": "2037-05-15",
          "coupon": 3.125,
          "yield": 3.18,
          "price": 99.49,
          "change": "+0.00",
          "lastUpdate": "2026-01-08"
        },
        {
          "isin": "EU000A3K4EG9",
          "name": "BEI GREEN BOND 15/05/2037 3,125%",
          "type": "BOND",
          "country": "EU",
          "currency": "EUR",
          "maturity": "2037-05-15",
          "coupon": 3.125,
          "yield": 3.18,
          "price": 99.49,
          "change": "+0.00",
          "lastUpdate": "2026-01-08"
        },
        {
          "isin": "EU000A3KM903",
          "name": "EUROPEAN UNION 04/06/2036 0,2%",
          "type": "BOND",
          "country": "EU",
          "currency": "EUR",
          "maturity": "2036-06-04",
          "coupon": 0.2,
          "yield": 3.17,
          "price": 74.04,
          "change": "+0.00",
          "lastUpdate": "2026-01-08"
        },
        {
          "isin": "EU000A18YZ05",
          "name": "EUROPEAN UNION 04/04/2036 1,125%",
          "type": "BOND",
          "country": "EU",
          "currency": "EUR",
          "maturity": "2036-04-04",
          "coupon": 1.125,
          "yield": 3.17,
          "price": 82.38,
          "change": "+0.00",
          "lastUpdate": "2026-01-08"
        },
        {
          "isin": "EU000A4D8KD2",
          "name": "EUROPEAN UNION 12/12/2035 3,375%",
          "type": "BOND",
          "country": "EU",
          "currency": "EUR",
          "maturity": "2035-12-12",
          "coupon": 3.375,
          "yield": 3.17,
          "price": 101.74,
          "change": "+0.00",
          "lastUpdate": "2026-01-08"
        },
        {
          "isin": "EU000A3KP2Z3",
          "name": "EUROPEAN UNION 22/04/2036 0,25%",
          "type": "BOND",
          "country": "EU",
          "currency": "EUR",
          "maturity": "2036-04-22",
          "coupon": 0.25,
          "yield": 3.15,
          "price": 74.9,
          "change": "+0.00",
          "lastUpdate": "2026-01-08"
        },
        {
          "isin": "XS1361554584",
          "name": "BEI 15/09/2036 1,125%",
          "type": "BOND",
          "country": "XS",
          "currency": "EUR",
          "maturity": "2036-09-15",
          "coupon": 1.125,
          "yield": 3.13,
          "price": 82.03,
          "change": "+0.00",
          "lastUpdate": "2026-01-08"
        },
        {
          "isin": "EU000A1G0ED2",
          "name": "EFSF 10/04/2035 0,875%",
          "type": "BOND",
          "country": "EU",
          "currency": "EUR",
          "maturity": "2035-04-10",
          "coupon": 0.875,
          "yield": 3.13,
          "price": 82.16,
          "change": "+0.00",
          "lastUpdate": "2026-01-08"
        },
        {
          "isin": "XS1361554584",
          "name": "BEI 15/09/2036 1,125%",
          "type": "BOND",
          "country": "XS",
          "currency": "EUR",
          "maturity": "2036-09-15",
          "coupon": 1.125,
          "yield": 3.13,
          "price": 82.03,
          "change": "+0.00",
          "lastUpdate": "2026-01-08"
        },
        {
          "isin": "EU000A2SCAS8",
          "name": "EFSF 29/01/2035 2,875%",
          "type": "BOND",
          "country": "EU",
          "currency": "EUR",
          "maturity": "2035-01-29",
          "coupon": 2.875,
          "yield": 3.11,
          "price": 98.15,
          "change": "+0.00",
          "lastUpdate": "2026-01-08"
        },
        {
          "isin": "XS0884635524",
          "name": "BEI 15/03/2040 2,75%",
          "type": "BOND",
          "country": "XS",
          "currency": "EUR",
          "maturity": "2040-03-15",
          "coupon": 2.75,
          "yield": 3.11,
          "price": 95.89,
          "change": "+0.00",
          "lastUpdate": "2026-01-08"
        },
        {
          "isin": "XS0884635524",
          "name": "BEI 15/03/2040 2,75%",
          "type": "BOND",
          "country": "XS",
          "currency": "EUR",
          "maturity": "2040-03-15",
          "coupon": 2.75,
          "yield": 3.11,
          "price": 95.89,
          "change": "+0.00",
          "lastUpdate": "2026-01-08"
        },
        {
          "isin": "EU000A285VM2",
          "name": "EUROPEAN UNION 04/07/2035 0%",
          "type": "BOND",
          "country": "EU",
          "currency": "EUR",
          "maturity": "2035-07-04",
          "coupon": 0,
          "yield": 3.1,
          "price": 74.87,
          "change": "+0.00",
          "lastUpdate": "2026-01-08"
        },
        {
          "isin": "XS3129375732",
          "name": "IBRD 23/07/2035 3%",
          "type": "BOND",
          "country": "XS",
          "currency": "EUR",
          "maturity": "2035-07-23",
          "coupon": 0,
          "yield": 3.09,
          "price": 99.29,
          "change": "+0.00",
          "lastUpdate": "2026-01-08"
        },
        {
          "isin": "XS2308323661",
          "name": "BEI 17/03/2036 0,2%",
          "type": "BOND",
          "country": "XS",
          "currency": "EUR",
          "maturity": "2036-03-17",
          "coupon": 0.2,
          "yield": 3.06,
          "price": 75.33,
          "change": "+0.00",
          "lastUpdate": "2026-01-08"
        },
        {
          "isin": "EU000A3K4ES4",
          "name": "EUROPEAN UNION 04/12/2034 3%",
          "type": "BOND",
          "country": "EU",
          "currency": "EUR",
          "maturity": "2034-12-04",
          "coupon": 0,
          "yield": 3.06,
          "price": 99.57,
          "change": "+0.00",
          "lastUpdate": "2026-01-08"
        },
        {
          "isin": "XS2308323661",
          "name": "BEI 17/03/2036 0,2%",
          "type": "BOND",
          "country": "XS",
          "currency": "EUR",
          "maturity": "2036-03-17",
          "coupon": 0.2,
          "yield": 3.06,
          "price": 75.33,
          "change": "+0.00",
          "lastUpdate": "2026-01-08"
        },
        {
          "isin": "XS2194790262",
          "name": "BEI GREEN BOND 15/11/2035 0,01%",
          "type": "BOND",
          "country": "XS",
          "currency": "EUR",
          "maturity": "2035-11-15",
          "coupon": 0.01,
          "yield": 3.03,
          "price": 74.64,
          "change": "+0.00",
          "lastUpdate": "2026-01-08"
        },
        {
          "isin": "XS2194790262",
          "name": "BEI GREEN BOND 15/11/2035 0,01%",
          "type": "BOND",
          "country": "XS",
          "currency": "EUR",
          "maturity": "2035-11-15",
          "coupon": 0.01,
          "yield": 3.03,
          "price": 74.64,
          "change": "+0.00",
          "lastUpdate": "2026-01-08"
        },
        {
          "isin": "EU000A3K4D41",
          "name": "EUROPEAN UNION 04/07/2034 3,25%",
          "type": "BOND",
          "country": "EU",
          "currency": "EUR",
          "maturity": "2034-07-04",
          "coupon": 3.25,
          "yield": 3.01,
          "price": 101.74,
          "change": "+0.00",
          "lastUpdate": "2026-01-08"
        },
        {
          "isin": "EU000A4ECKZ8",
          "name": "BEI GREEN BOND 18/06/2035 2,875%",
          "type": "BOND",
          "country": "EU",
          "currency": "EUR",
          "maturity": "2035-06-18",
          "coupon": 2.875,
          "yield": 2.97,
          "price": 99.23,
          "change": "+0.00",
          "lastUpdate": "2026-01-08"
        },
        {
          "isin": "EU000A4ECKZ8",
          "name": "BEI GREEN BOND 18/06/2035 2,875%",
          "type": "BOND",
          "country": "EU",
          "currency": "EUR",
          "maturity": "2035-06-18",
          "coupon": 2.875,
          "yield": 2.97,
          "price": 99.23,
          "change": "+0.00",
          "lastUpdate": "2026-01-08"
        },
        {
          "isin": "EU000A2SCAN9",
          "name": "EFSF 13/02/2034 2,875%",
          "type": "BOND",
          "country": "EU",
          "currency": "EUR",
          "maturity": "2034-02-13",
          "coupon": 2.875,
          "yield": 2.96,
          "price": 99.41,
          "change": "+0.00",
          "lastUpdate": "2026-01-08"
        },
        {
          "isin": "EU000A3L72Y4",
          "name": "BEI GREEN BOND 15/01/2035 2,875%",
          "type": "BOND",
          "country": "EU",
          "currency": "EUR",
          "maturity": "2035-01-15",
          "coupon": 2.875,
          "yield": 2.95,
          "price": 99.45,
          "change": "+0.00",
          "lastUpdate": "2026-01-08"
        },
        {
          "isin": "EU000A3L72Y4",
          "name": "BEI GREEN BOND 15/01/2035 2,875%",
          "type": "BOND",
          "country": "EU",
          "currency": "EUR",
          "maturity": "2035-01-15",
          "coupon": 2.875,
          "yield": 2.95,
          "price": 99.45,
          "change": "+0.00",
          "lastUpdate": "2026-01-08"
        },
        {
          "isin": "EU000A1G0BJ5",
          "name": "EFSF 04/09/2034 3%",
          "type": "BOND",
          "country": "EU",
          "currency": "EUR",
          "maturity": "2034-09-04",
          "coupon": 0,
          "yield": 2.94,
          "price": 100.41,
          "change": "+0.00",
          "lastUpdate": "2026-01-08"
        },
        {
          "isin": "EU000A1G0DT0",
          "name": "EFSF 24/05/2033 1,25%",
          "type": "BOND",
          "country": "EU",
          "currency": "EUR",
          "maturity": "2033-05-24",
          "coupon": 1.25,
          "yield": 2.92,
          "price": 89.06,
          "change": "+0.00",
          "lastUpdate": "2026-01-08"
        },
        {
          "isin": "XS2765024414",
          "name": "WORLD BANK 14/02/2034 2,9%",
          "type": "BOND",
          "country": "XS",
          "currency": "EUR",
          "maturity": "2034-02-14",
          "coupon": 2.9,
          "yield": 2.92,
          "price": 99.88,
          "change": "+0.00",
          "lastUpdate": "2026-01-08"
        },
        {
          "isin": "XS0878008225",
          "name": "BEI 15/03/2035 2,625%",
          "type": "BOND",
          "country": "XS",
          "currency": "EUR",
          "maturity": "2035-03-15",
          "coupon": 2.625,
          "yield": 2.92,
          "price": 97.68,
          "change": "+0.00",
          "lastUpdate": "2026-01-08"
        },
        {
          "isin": "XS0878008225",
          "name": "BEI 15/03/2035 2,625%",
          "type": "BOND",
          "country": "XS",
          "currency": "EUR",
          "maturity": "2035-03-15",
          "coupon": 2.625,
          "yield": 2.92,
          "price": 97.68,
          "change": "+0.00",
          "lastUpdate": "2026-01-08"
        },
        {
          "isin": "EU000A3L2773",
          "name": "BEI GREEN BOND 04/09/2034 2,625%",
          "type": "BOND",
          "country": "EU",
          "currency": "EUR",
          "maturity": "2034-09-04",
          "coupon": 2.625,
          "yield": 2.91,
          "price": 97.83,
          "change": "+0.00",
          "lastUpdate": "2026-01-08"
        },
        {
          "isin": "EU000A1Z99W5",
          "name": "EUROPEAN STABILITY MECHANISM 26/02/2035 2,75%",
          "type": "BOND",
          "country": "EU",
          "currency": "EUR",
          "maturity": "2035-02-26",
          "coupon": 2.75,
          "yield": 2.91,
          "price": 98.75,
          "change": "+0.00",
          "lastUpdate": "2026-01-08"
        },
        {
          "isin": "EU000A3L2773",
          "name": "BEI GREEN BOND 04/09/2034 2,625%",
          "type": "BOND",
          "country": "EU",
          "currency": "EUR",
          "maturity": "2034-09-04",
          "coupon": 2.625,
          "yield": 2.91,
          "price": 97.83,
          "change": "+0.00",
          "lastUpdate": "2026-01-08"
        },
        {
          "isin": "EU000A2SCAG3",
          "name": "EFSF 16/02/2033 2,875%",
          "type": "BOND",
          "country": "EU",
          "currency": "EUR",
          "maturity": "2033-02-16",
          "coupon": 2.875,
          "yield": 2.89,
          "price": 99.93,
          "change": "+0.00",
          "lastUpdate": "2026-01-08"
        },
        {
          "isin": "IT0006527300",
          "name": "BEI 26/02/2029 ZC",
          "type": "BOND",
          "country": "IT",
          "currency": "EUR",
          "maturity": "2029-02-26",
          "coupon": 0,
          "yield": 2.88,
          "price": 183.05,
          "change": "+0.00",
          "lastUpdate": "2026-01-08"
        },
        {
          "isin": "IT0006527300",
          "name": "BEI 26/02/2029 ZC",
          "type": "BOND",
          "country": "IT",
          "currency": "EUR",
          "maturity": "2029-02-26",
          "coupon": 0,
          "yield": 2.88,
          "price": 183.05,
          "change": "+0.00",
          "lastUpdate": "2026-01-08"
        },
        {
          "isin": "EU000A3LS460",
          "name": "BEI GREEN BOND 16/01/2034 2,75%",
          "type": "BOND",
          "country": "EU",
          "currency": "EUR",
          "maturity": "2034-01-16",
          "coupon": 2.75,
          "yield": 2.86,
          "price": 99.2,
          "change": "+0.00",
          "lastUpdate": "2026-01-08"
        },
        {
          "isin": "EU000A1Z99U9",
          "name": "EUROPEAN STABILITY MECHANISM 15/09/2034 2,75%",
          "type": "BOND",
          "country": "EU",
          "currency": "EUR",
          "maturity": "2034-09-15",
          "coupon": 2.75,
          "yield": 2.86,
          "price": 99.16,
          "change": "+0.00",
          "lastUpdate": "2026-01-08"
        },
        {
          "isin": "EU000A3LS460",
          "name": "BEI GREEN BOND 16/01/2034 2,75%",
          "type": "BOND",
          "country": "EU",
          "currency": "EUR",
          "maturity": "2034-01-16",
          "coupon": 2.75,
          "yield": 2.86,
          "price": 99.2,
          "change": "+0.00",
          "lastUpdate": "2026-01-08"
        },
        {
          "isin": "EU000A3K4DW8",
          "name": "EUROPEAN UNION GREEN BOND 04/02/2033 2,75%",
          "type": "BOND",
          "country": "EU",
          "currency": "EUR",
          "maturity": "2033-02-04",
          "coupon": 2.75,
          "yield": 2.84,
          "price": 99.42,
          "change": "+0.00",
          "lastUpdate": "2026-01-08"
        },
        {
          "isin": "US298785HM16",
          "name": "BEI GREEN BOND 24/05/2027 2,375% USD",
          "type": "BOND",
          "country": "US",
          "currency": "USD",
          "maturity": "2027-05-24",
          "coupon": 2.375,
          "yield": 2.84,
          "price": 99.42,
          "change": "+0.00",
          "lastUpdate": "2026-01-08"
        },
        {
          "isin": "US298785HM16",
          "name": "BEI GREEN BOND 24/05/2027 2,375% USD",
          "type": "BOND",
          "country": "US",
          "currency": "USD",
          "maturity": "2027-05-24",
          "coupon": 2.375,
          "yield": 2.84,
          "price": 99.42,
          "change": "+0.00",
          "lastUpdate": "2026-01-08"
        },
        {
          "isin": "EU000A4ED0K0",
          "name": "EUROPEAN UNION 13/12/2032 2,75%",
          "type": "BOND",
          "country": "EU",
          "currency": "EUR",
          "maturity": "2032-12-13",
          "coupon": 2.75,
          "yield": 2.83,
          "price": 99.49,
          "change": "+0.00",
          "lastUpdate": "2026-01-08"
        },
        {
          "isin": "XS0975634204",
          "name": "BEI 14/10/2033 3%",
          "type": "BOND",
          "country": "XS",
          "currency": "EUR",
          "maturity": "2033-10-14",
          "coupon": 0,
          "yield": 2.83,
          "price": 101.17,
          "change": "+0.00",
          "lastUpdate": "2026-01-08"
        },
        {
          "isin": "XS0975634204",
          "name": "BEI 14/10/2033 3%",
          "type": "BOND",
          "country": "XS",
          "currency": "EUR",
          "maturity": "2033-10-14",
          "coupon": 0,
          "yield": 2.83,
          "price": 101.17,
          "change": "+0.00",
          "lastUpdate": "2026-01-08"
        },
        {
          "isin": "XS2647979181",
          "name": "BEI 15/07/2033 3%",
          "type": "BOND",
          "country": "XS",
          "currency": "EUR",
          "maturity": "2033-07-15",
          "coupon": 0,
          "yield": 2.81,
          "price": 101.29,
          "change": "+0.00",
          "lastUpdate": "2026-01-08"
        },
        {
          "isin": "XS2647979181",
          "name": "BEI 15/07/2033 3%",
          "type": "BOND",
          "country": "XS",
          "currency": "EUR",
          "maturity": "2033-07-15",
          "coupon": 0,
          "yield": 2.81,
          "price": 101.29,
          "change": "+0.00",
          "lastUpdate": "2026-01-08"
        },
        {
          "isin": "EU000A3K4DD8",
          "name": "EUROPEAN UNION 06/07/2032 1%",
          "type": "BOND",
          "country": "EU",
          "currency": "EUR",
          "maturity": "2032-07-06",
          "coupon": 0,
          "yield": 2.79,
          "price": 89.5,
          "change": "+0.00",
          "lastUpdate": "2026-01-08"
        },
        {
          "isin": "EU000A1Z99S3",
          "name": "EUROPEAN STABILITY MECHANISM 23/08/2033 3%",
          "type": "BOND",
          "country": "EU",
          "currency": "EUR",
          "maturity": "2033-08-23",
          "coupon": 0,
          "yield": 2.79,
          "price": 101.44,
          "change": "+0.00",
          "lastUpdate": "2026-01-08"
        },
        {
          "isin": "EU000A1G0AJ7",
          "name": "EFSF 30/03/2032 3,875%",
          "type": "BOND",
          "country": "EU",
          "currency": "EUR",
          "maturity": "2032-03-30",
          "coupon": 3.875,
          "yield": 2.78,
          "price": 106.18,
          "change": "+0.00",
          "lastUpdate": "2026-01-08"
        },
        {
          "isin": "XS2574388646",
          "name": "BEI 12/01/2033 2,88%",
          "type": "BOND",
          "country": "XS",
          "currency": "EUR",
          "maturity": "2033-01-12",
          "coupon": 2.88,
          "yield": 2.77,
          "price": 100.7,
          "change": "+0.00",
          "lastUpdate": "2026-01-08"
        },
        {
          "isin": "XS1612977717",
          "name": "BEI 13/04/2033 1,125%",
          "type": "BOND",
          "country": "XS",
          "currency": "EUR",
          "maturity": "2033-04-13",
          "coupon": 1.125,
          "yield": 2.77,
          "price": 89.35,
          "change": "+0.00",
          "lastUpdate": "2026-01-08"
        },
        {
          "isin": "XS2574388646",
          "name": "BEI 12/01/2033 2,88%",
          "type": "BOND",
          "country": "XS",
          "currency": "EUR",
          "maturity": "2033-01-12",
          "coupon": 2.88,
          "yield": 2.77,
          "price": 100.7,
          "change": "+0.00",
          "lastUpdate": "2026-01-08"
        },
        {
          "isin": "XS1612977717",
          "name": "BEI 13/04/2033 1,125%",
          "type": "BOND",
          "country": "XS",
          "currency": "EUR",
          "maturity": "2033-04-13",
          "coupon": 1.125,
          "yield": 2.77,
          "price": 89.35,
          "change": "+0.00",
          "lastUpdate": "2026-01-08"
        },
        {
          "isin": "EU000A2SCAC2",
          "name": "EFSF 21/06/2032 2,375%",
          "type": "BOND",
          "country": "EU",
          "currency": "EUR",
          "maturity": "2032-06-21",
          "coupon": 2.375,
          "yield": 2.76,
          "price": 97.77,
          "change": "+0.00",
          "lastUpdate": "2026-01-08"
        },
        {
          "isin": "EU000A2SCAU4",
          "name": "EFSF 27/09/2032 2,75%",
          "type": "BOND",
          "country": "EU",
          "currency": "EUR",
          "maturity": "2032-09-27",
          "coupon": 2.75,
          "yield": 2.75,
          "price": 100.01,
          "change": "+0.00",
          "lastUpdate": "2026-01-08"
        },
        {
          "isin": "EU000A3L1DJ0",
          "name": "EUROPEAN UNION 04/12/2031 2,5%",
          "type": "BOND",
          "country": "EU",
          "currency": "EUR",
          "maturity": "2031-12-04",
          "coupon": 2.5,
          "yield": 2.71,
          "price": 98.86,
          "change": "+0.00",
          "lastUpdate": "2026-01-08"
        },
        {
          "isin": "EU000A4D7ZW2",
          "name": "BEI GREEN BOND 14/05/2032 2,5%",
          "type": "BOND",
          "country": "EU",
          "currency": "EUR",
          "maturity": "2032-05-14",
          "coupon": 2.5,
          "yield": 2.69,
          "price": 98.89,
          "change": "+0.00",
          "lastUpdate": "2026-01-08"
        },
        {
          "isin": "EU000A4D7ZW2",
          "name": "BEI GREEN BOND 14/05/2032 2,5%",
          "type": "BOND",
          "country": "EU",
          "currency": "EUR",
          "maturity": "2032-05-14",
          "coupon": 2.5,
          "yield": 2.69,
          "price": 98.89,
          "change": "+0.00",
          "lastUpdate": "2026-01-08"
        },
        {
          "isin": "XS2484093393",
          "name": "BEI GREEN BOND 15/06/2032 1,5%",
          "type": "BOND",
          "country": "XS",
          "currency": "EUR",
          "maturity": "2032-06-15",
          "coupon": 1.5,
          "yield": 2.68,
          "price": 93.1,
          "change": "+0.00",
          "lastUpdate": "2026-01-08"
        },
        {
          "isin": "XS2484093393",
          "name": "BEI GREEN BOND 15/06/2032 1,5%",
          "type": "BOND",
          "country": "XS",
          "currency": "EUR",
          "maturity": "2032-06-15",
          "coupon": 1.5,
          "yield": 2.68,
          "price": 93.1,
          "change": "+0.00",
          "lastUpdate": "2026-01-08"
        },
        {
          "isin": "EU000A3KSXE1",
          "name": "EUROPEAN UNION 04/07/2031 0%",
          "type": "BOND",
          "country": "EU",
          "currency": "EUR",
          "maturity": "2031-07-04",
          "coupon": 0,
          "yield": 2.66,
          "price": 86.62,
          "change": "+0.00",
          "lastUpdate": "2026-01-08"
        },
        {
          "isin": "XS2433363509",
          "name": "BEI 20/01/2032 0,25%",
          "type": "BOND",
          "country": "XS",
          "currency": "EUR",
          "maturity": "2032-01-20",
          "coupon": 0.25,
          "yield": 2.64,
          "price": 86.85,
          "change": "+0.00",
          "lastUpdate": "2026-01-08"
        },
        {
          "isin": "XS2433363509",
          "name": "BEI 20/01/2032 0,25%",
          "type": "BOND",
          "country": "XS",
          "currency": "EUR",
          "maturity": "2032-01-20",
          "coupon": 0.25,
          "yield": 2.64,
          "price": 86.85,
          "change": "+0.00",
          "lastUpdate": "2026-01-08"
        },
        {
          "isin": "EU000A18Z2D4",
          "name": "EUROPEAN UNION 04/04/2031 0,75%",
          "type": "BOND",
          "country": "EU",
          "currency": "EUR",
          "maturity": "2031-04-04",
          "coupon": 0.75,
          "yield": 2.63,
          "price": 90.92,
          "change": "+0.00",
          "lastUpdate": "2026-01-08"
        },
        {
          "isin": "EU000A3KT6A3",
          "name": "EUROPEAN UNION 22/04/2031 0%",
          "type": "BOND",
          "country": "EU",
          "currency": "EUR",
          "maturity": "2031-04-22",
          "coupon": 0,
          "yield": 2.63,
          "price": 87.2,
          "change": "+0.00",
          "lastUpdate": "2026-01-08"
        },
        {
          "isin": "EU000A3LX098",
          "name": "BEI 15/10/2031 2,875%",
          "type": "BOND",
          "country": "EU",
          "currency": "EUR",
          "maturity": "2031-10-15",
          "coupon": 2.875,
          "yield": 2.63,
          "price": 101.3,
          "change": "+0.00",
          "lastUpdate": "2026-01-08"
        },
        {
          "isin": "EU000A3LX098",
          "name": "BEI 15/10/2031 2,875%",
          "type": "BOND",
          "country": "EU",
          "currency": "EUR",
          "maturity": "2031-10-15",
          "coupon": 2.875,
          "yield": 2.63,
          "price": 101.3,
          "change": "+0.00",
          "lastUpdate": "2026-01-08"
        },
        {
          "isin": "EU000A2SCAV2",
          "name": "EFSF 11/11/2030 2,5%",
          "type": "BOND",
          "country": "EU",
          "currency": "EUR",
          "maturity": "2030-11-11",
          "coupon": 2.5,
          "yield": 2.61,
          "price": 99.5,
          "change": "+0.00",
          "lastUpdate": "2026-01-08"
        },
        {
          "isin": "XS1422953932",
          "name": "BEI 14/04/2032 1%",
          "type": "BOND",
          "country": "XS",
          "currency": "EUR",
          "maturity": "2032-04-14",
          "coupon": 0,
          "yield": 2.6,
          "price": 90.87,
          "change": "+0.00",
          "lastUpdate": "2026-01-08"
        },
        {
          "isin": "IT0006526609",
          "name": "BEI 22/01/2029 ZC",
          "type": "BOND",
          "country": "IT",
          "currency": "EUR",
          "maturity": "2029-01-22",
          "coupon": 0,
          "yield": 2.6,
          "price": 203.57,
          "change": "+0.00",
          "lastUpdate": "2026-01-08"
        },
        {
          "isin": "XS1422953932",
          "name": "BEI 14/04/2032 1%",
          "type": "BOND",
          "country": "XS",
          "currency": "EUR",
          "maturity": "2032-04-14",
          "coupon": 0,
          "yield": 2.6,
          "price": 90.87,
          "change": "+0.00",
          "lastUpdate": "2026-01-08"
        },
        {
          "isin": "IT0006526609",
          "name": "BEI 22/01/2029 ZC",
          "type": "BOND",
          "country": "IT",
          "currency": "EUR",
          "maturity": "2029-01-22",
          "coupon": 0,
          "yield": 2.6,
          "price": 203.57,
          "change": "+0.00",
          "lastUpdate": "2026-01-08"
        },
        {
          "isin": "EU000A4EG781",
          "name": "BEI GREEN BOND 17/02/2031 2,5%",
          "type": "BOND",
          "country": "EU",
          "currency": "EUR",
          "maturity": "2031-02-17",
          "coupon": 2.5,
          "yield": 2.58,
          "price": 99.62,
          "change": "+0.00",
          "lastUpdate": "2026-01-08"
        },
        {
          "isin": "EU000A4EG781",
          "name": "BEI GREEN BOND 17/02/2031 2,5%",
          "type": "BOND",
          "country": "EU",
          "currency": "EUR",
          "maturity": "2031-02-17",
          "coupon": 2.5,
          "yield": 2.58,
          "price": 99.62,
          "change": "+0.00",
          "lastUpdate": "2026-01-08"
        },
        {
          "isin": "EU000A3LNF05",
          "name": "EUROPEAN UNION 04/12/2030 3,125%",
          "type": "BOND",
          "country": "EU",
          "currency": "EUR",
          "maturity": "2030-12-04",
          "coupon": 3.125,
          "yield": 2.57,
          "price": 102.5,
          "change": "+0.00",
          "lastUpdate": "2026-01-08"
        },
        {
          "isin": "XS1183208328",
          "name": "BEI 14/03/2031 1%",
          "type": "BOND",
          "country": "XS",
          "currency": "EUR",
          "maturity": "2031-03-14",
          "coupon": 0,
          "yield": 2.57,
          "price": 92.49,
          "change": "+0.00",
          "lastUpdate": "2026-01-08"
        },
        {
          "isin": "EU000A4EG021",
          "name": "EUROPEAN UNION 14/10/2030 2,5%",
          "type": "BOND",
          "country": "EU",
          "currency": "EUR",
          "maturity": "2030-10-14",
          "coupon": 2.5,
          "yield": 2.57,
          "price": 99.7,
          "change": "+0.00",
          "lastUpdate": "2026-01-08"
        },
        {
          "isin": "XS1183208328",
          "name": "BEI 14/03/2031 1%",
          "type": "BOND",
          "country": "XS",
          "currency": "EUR",
          "maturity": "2031-03-14",
          "coupon": 0,
          "yield": 2.57,
          "price": 92.49,
          "change": "+0.00",
          "lastUpdate": "2026-01-08"
        },
        {
          "isin": "XS2283340060",
          "name": "BEI 14/01/2031 0%",
          "type": "BOND",
          "country": "XS",
          "currency": "EUR",
          "maturity": "2031-01-14",
          "coupon": 0,
          "yield": 2.55,
          "price": 88.15,
          "change": "+0.00",
          "lastUpdate": "2026-01-08"
        },
        {
          "isin": "XS2283340060",
          "name": "BEI 14/01/2031 0%",
          "type": "BOND",
          "country": "XS",
          "currency": "EUR",
          "maturity": "2031-01-14",
          "coupon": 0,
          "yield": 2.55,
          "price": 88.15,
          "change": "+0.00",
          "lastUpdate": "2026-01-08"
        },
        {
          "isin": "EU000A1G0EP6",
          "name": "EFSF 18/03/2030 0,125%",
          "type": "BOND",
          "country": "EU",
          "currency": "EUR",
          "maturity": "2030-03-18",
          "coupon": 0.125,
          "yield": 2.54,
          "price": 90.54,
          "change": "+0.00",
          "lastUpdate": "2026-01-08"
        },
        {
          "isin": "EU000A1G1Q17",
          "name": "EUROPEAN UNION 04/04/2032 3,375%",
          "type": "BOND",
          "country": "EU",
          "currency": "EUR",
          "maturity": "2032-04-04",
          "coupon": 3.375,
          "yield": 2.52,
          "price": 104.87,
          "change": "+0.00",
          "lastUpdate": "2026-01-08"
        },
        {
          "isin": "XS1218809389",
          "name": "WORLD BANK 16/04/2030 0,5%",
          "type": "BOND",
          "country": "XS",
          "currency": "EUR",
          "maturity": "2030-04-16",
          "coupon": 0.5,
          "yield": 2.5,
          "price": 92,
          "change": "+0.00",
          "lastUpdate": "2026-01-08"
        },
        {
          "isin": "XS2225428809",
          "name": "BEI 09/09/2030 0%",
          "type": "BOND",
          "country": "XS",
          "currency": "EUR",
          "maturity": "2030-09-09",
          "coupon": 0,
          "yield": 2.48,
          "price": 89.22,
          "change": "+0.00",
          "lastUpdate": "2026-01-08"
        },
        {
          "isin": "EU000A1G0EE0",
          "name": "EFSF 17/10/2029 0,05%",
          "type": "BOND",
          "country": "EU",
          "currency": "EUR",
          "maturity": "2029-10-17",
          "coupon": 0.05,
          "yield": 2.48,
          "price": 91.38,
          "change": "+0.00",
          "lastUpdate": "2026-01-08"
        },
        {
          "isin": "XS2225428809",
          "name": "BEI 09/09/2030 0%",
          "type": "BOND",
          "country": "XS",
          "currency": "EUR",
          "maturity": "2030-09-09",
          "coupon": 0,
          "yield": 2.48,
          "price": 89.22,
          "change": "+0.00",
          "lastUpdate": "2026-01-08"
        },
        {
          "isin": "XS0505157965",
          "name": "BEI 15/04/2030 4%",
          "type": "BOND",
          "country": "XS",
          "currency": "EUR",
          "maturity": "2030-04-15",
          "coupon": 0,
          "yield": 2.47,
          "price": 106.1,
          "change": "+0.00",
          "lastUpdate": "2026-01-08"
        },
        {
          "isin": "XS2626024868",
          "name": "BEI 30/07/2030 2,75%",
          "type": "BOND",
          "country": "XS",
          "currency": "EUR",
          "maturity": "2030-07-30",
          "coupon": 2.75,
          "yield": 2.47,
          "price": 101.19,
          "change": "+0.00",
          "lastUpdate": "2026-01-08"
        },
        {
          "isin": "EU000A283859",
          "name": "EUROPEAN UNION 04/10/2030 0%",
          "type": "BOND",
          "country": "EU",
          "currency": "EUR",
          "maturity": "2030-10-04",
          "coupon": 0,
          "yield": 2.47,
          "price": 89.12,
          "change": "+0.00",
          "lastUpdate": "2026-01-08"
        },
        {
          "isin": "EU000A1ZR7H3",
          "name": "EUROPEAN UNION 04/10/2029 1,375%",
          "type": "BOND",
          "country": "EU",
          "currency": "EUR",
          "maturity": "2029-10-04",
          "coupon": 1.375,
          "yield": 2.47,
          "price": 96.16,
          "change": "+0.00",
          "lastUpdate": "2026-01-08"
        },
        {
          "isin": "XS0505157965",
          "name": "BEI 15/04/2030 4%",
          "type": "BOND",
          "country": "XS",
          "currency": "EUR",
          "maturity": "2030-04-15",
          "coupon": 0,
          "yield": 2.47,
          "price": 106.1,
          "change": "+0.00",
          "lastUpdate": "2026-01-08"
        },
        {
          "isin": "XS2626024868",
          "name": "BEI 30/07/2030 2,75%",
          "type": "BOND",
          "country": "XS",
          "currency": "EUR",
          "maturity": "2030-07-30",
          "coupon": 2.75,
          "yield": 2.47,
          "price": 101.19,
          "change": "+0.00",
          "lastUpdate": "2026-01-08"
        },
        {
          "isin": "EU000A3K7MW2",
          "name": "EUROPEAN UNION 04/12/2029 1,625%",
          "type": "BOND",
          "country": "EU",
          "currency": "EUR",
          "maturity": "2029-12-04",
          "coupon": 1.625,
          "yield": 2.46,
          "price": 96.94,
          "change": "+0.00",
          "lastUpdate": "2026-01-08"
        },
        {
          "isin": "XS1978552237",
          "name": "BEI 15/10/2026 0,1%",
          "type": "BOND",
          "country": "XS",
          "currency": "EUR",
          "maturity": "2026-10-15",
          "coupon": 0.1,
          "yield": 2.45,
          "price": 98.26,
          "change": "+0.00",
          "lastUpdate": "2026-01-08"
        },
        {
          "isin": "XS1978552237",
          "name": "BEI 15/10/2026 0,1%",
          "type": "BOND",
          "country": "XS",
          "currency": "EUR",
          "maturity": "2026-10-15",
          "coupon": 0.1,
          "yield": 2.45,
          "price": 98.26,
          "change": "+0.00",
          "lastUpdate": "2026-01-08"
        },
        {
          "isin": "EU000A4D6KN5",
          "name": "BEI 15/05/2030 2,375%",
          "type": "BOND",
          "country": "EU",
          "currency": "EUR",
          "maturity": "2030-05-15",
          "coupon": 2.375,
          "yield": 2.44,
          "price": 99.71,
          "change": "+0.00",
          "lastUpdate": "2026-01-08"
        },
        {
          "isin": "XS0960306578",
          "name": "BEI 13/09/2030 2,75%",
          "type": "BOND",
          "country": "XS",
          "currency": "EUR",
          "maturity": "2030-09-13",
          "coupon": 2.75,
          "yield": 2.44,
          "price": 101.34,
          "change": "+0.00",
          "lastUpdate": "2026-01-08"
        },
        {
          "isin": "EU000A4D6KN5",
          "name": "BEI 15/05/2030 2,375%",
          "type": "BOND",
          "country": "EU",
          "currency": "EUR",
          "maturity": "2030-05-15",
          "coupon": 2.375,
          "yield": 2.44,
          "price": 99.71,
          "change": "+0.00",
          "lastUpdate": "2026-01-08"
        },
        {
          "isin": "XS0960306578",
          "name": "BEI 13/09/2030 2,75%",
          "type": "BOND",
          "country": "XS",
          "currency": "EUR",
          "maturity": "2030-09-13",
          "coupon": 2.75,
          "yield": 2.44,
          "price": 101.34,
          "change": "+0.00",
          "lastUpdate": "2026-01-08"
        },
        {
          "isin": "EU000A1G0BL1",
          "name": "EFSF 03/12/2029 2,75%",
          "type": "BOND",
          "country": "EU",
          "currency": "EUR",
          "maturity": "2029-12-03",
          "coupon": 2.75,
          "yield": 2.42,
          "price": 101.19,
          "change": "+0.00",
          "lastUpdate": "2026-01-08"
        },
        {
          "isin": "EU000A3L1CN4",
          "name": "EUROPEAN UNION 05/10/2029 2,875%",
          "type": "BOND",
          "country": "EU",
          "currency": "EUR",
          "maturity": "2029-10-05",
          "coupon": 2.875,
          "yield": 2.42,
          "price": 101.6,
          "change": "+0.00",
          "lastUpdate": "2026-01-08"
        },
        {
          "isin": "EU000A2SCAM1",
          "name": "EFSF 16/07/2029 2,625%",
          "type": "BOND",
          "country": "EU",
          "currency": "EUR",
          "maturity": "2029-07-16",
          "coupon": 2.625,
          "yield": 2.42,
          "price": 100.69,
          "change": "+0.00",
          "lastUpdate": "2026-01-08"
        },
        {
          "isin": "EU000A2SCAJ7",
          "name": "EFSF 10/07/2030 3%",
          "type": "BOND",
          "country": "EU",
          "currency": "EUR",
          "maturity": "2030-07-10",
          "coupon": 0,
          "yield": 2.41,
          "price": 102.49,
          "change": "+0.00",
          "lastUpdate": "2026-01-08"
        },
        {
          "isin": "EU000A3L4C16",
          "name": "BEI 14/12/2029 2,25%",
          "type": "BOND",
          "country": "EU",
          "currency": "EUR",
          "maturity": "2029-12-14",
          "coupon": 2.25,
          "yield": 2.4,
          "price": 99.45,
          "change": "+0.00",
          "lastUpdate": "2026-01-08"
        },
        {
          "isin": "XS2535352962",
          "name": "BEI 15/03/2030 2,25%",
          "type": "BOND",
          "country": "XS",
          "currency": "EUR",
          "maturity": "2030-03-15",
          "coupon": 2.25,
          "yield": 2.4,
          "price": 99.42,
          "change": "+0.00",
          "lastUpdate": "2026-01-08"
        },
        {
          "isin": "EU000A3L4C16",
          "name": "BEI 14/12/2029 2,25%",
          "type": "BOND",
          "country": "EU",
          "currency": "EUR",
          "maturity": "2029-12-14",
          "coupon": 2.25,
          "yield": 2.4,
          "price": 99.45,
          "change": "+0.00",
          "lastUpdate": "2026-01-08"
        },
        {
          "isin": "XS2535352962",
          "name": "BEI 15/03/2030 2,25%",
          "type": "BOND",
          "country": "XS",
          "currency": "EUR",
          "maturity": "2030-03-15",
          "coupon": 2.25,
          "yield": 2.4,
          "price": 99.42,
          "change": "+0.00",
          "lastUpdate": "2026-01-08"
        },
        {
          "isin": "EU000A2SCAL3",
          "name": "EFSF 11/04/2029 3,5%",
          "type": "BOND",
          "country": "EU",
          "currency": "EUR",
          "maturity": "2029-04-11",
          "coupon": 3.5,
          "yield": 2.39,
          "price": 103.41,
          "change": "+0.00",
          "lastUpdate": "2026-01-08"
        },
        {
          "isin": "XS2439543047",
          "name": "BEI GREEN BOND 15/11/2029 0,05%",
          "type": "BOND",
          "country": "XS",
          "currency": "EUR",
          "maturity": "2029-11-15",
          "coupon": 0.05,
          "yield": 2.37,
          "price": 91.57,
          "change": "+0.00",
          "lastUpdate": "2026-01-08"
        },
        {
          "isin": "XS2439543047",
          "name": "BEI GREEN BOND 15/11/2029 0,05%",
          "type": "BOND",
          "country": "XS",
          "currency": "EUR",
          "maturity": "2029-11-15",
          "coupon": 0.05,
          "yield": 2.37,
          "price": 91.57,
          "change": "+0.00",
          "lastUpdate": "2026-01-08"
        },
        {
          "isin": "EU000A2SCAT6",
          "name": "EFSF 07/05/2030 2,625%",
          "type": "BOND",
          "country": "EU",
          "currency": "EUR",
          "maturity": "2030-05-07",
          "coupon": 2.625,
          "yield": 2.35,
          "price": 101.12,
          "change": "+0.00",
          "lastUpdate": "2026-01-08"
        },
        {
          "isin": "XS1509006208",
          "name": "BEI 13/03/2026 0%",
          "type": "BOND",
          "country": "XS",
          "currency": "EUR",
          "maturity": "2026-03-13",
          "coupon": 0,
          "yield": 2.34,
          "price": 99.62,
          "change": "+0.00",
          "lastUpdate": "2026-01-08"
        },
        {
          "isin": "EU000A3LVAL6",
          "name": "BEI 17/07/2029 2,75%",
          "type": "BOND",
          "country": "EU",
          "currency": "EUR",
          "maturity": "2029-07-17",
          "coupon": 2.75,
          "yield": 2.34,
          "price": 101.36,
          "change": "+0.00",
          "lastUpdate": "2026-01-08"
        },
        {
          "isin": "XS1509006208",
          "name": "BEI 13/03/2026 0%",
          "type": "BOND",
          "country": "XS",
          "currency": "EUR",
          "maturity": "2026-03-13",
          "coupon": 0,
          "yield": 2.34,
          "price": 99.62,
          "change": "+0.00",
          "lastUpdate": "2026-01-08"
        },
        {
          "isin": "EU000A3LVAL6",
          "name": "BEI 17/07/2029 2,75%",
          "type": "BOND",
          "country": "EU",
          "currency": "EUR",
          "maturity": "2029-07-17",
          "coupon": 2.75,
          "yield": 2.34,
          "price": 101.36,
          "change": "+0.00",
          "lastUpdate": "2026-01-08"
        },
        {
          "isin": "XS1503043694",
          "name": "BEI 14/09/2029 0,25%",
          "type": "BOND",
          "country": "XS",
          "currency": "EUR",
          "maturity": "2029-09-14",
          "coupon": 0.25,
          "yield": 2.33,
          "price": 92.75,
          "change": "+0.00",
          "lastUpdate": "2026-01-08"
        },
        {
          "isin": "EU000A2SCAB4",
          "name": "EFSF 05/09/2028 0,875%",
          "type": "BOND",
          "country": "EU",
          "currency": "EUR",
          "maturity": "2028-09-05",
          "coupon": 0.875,
          "yield": 2.33,
          "price": 96.3,
          "change": "+0.00",
          "lastUpdate": "2026-01-08"
        },
        {
          "isin": "EU000A2SCAH1",
          "name": "EFSF 15/12/2028 3%",
          "type": "BOND",
          "country": "EU",
          "currency": "EUR",
          "maturity": "2028-12-15",
          "coupon": 0,
          "yield": 2.33,
          "price": 101.87,
          "change": "+0.00",
          "lastUpdate": "2026-01-08"
        },
        {
          "isin": "XS1503043694",
          "name": "BEI 14/09/2029 0,25%",
          "type": "BOND",
          "country": "XS",
          "currency": "EUR",
          "maturity": "2029-09-14",
          "coupon": 0.25,
          "yield": 2.33,
          "price": 92.75,
          "change": "+0.00",
          "lastUpdate": "2026-01-08"
        },
        {
          "isin": "XS2015227494",
          "name": "BEI 20/06/2029 0,125%",
          "type": "BOND",
          "country": "XS",
          "currency": "EUR",
          "maturity": "2029-06-20",
          "coupon": 0.125,
          "yield": 2.32,
          "price": 92.83,
          "change": "+0.00",
          "lastUpdate": "2026-01-08"
        },
        {
          "isin": "XS2102495673",
          "name": "BEI 16/01/2030 0,05%",
          "type": "BOND",
          "country": "XS",
          "currency": "EUR",
          "maturity": "2030-01-16",
          "coupon": 0.05,
          "yield": 2.32,
          "price": 91.4,
          "change": "+0.00",
          "lastUpdate": "2026-01-08"
        },
        {
          "isin": "XS2015227494",
          "name": "BEI 20/06/2029 0,125%",
          "type": "BOND",
          "country": "XS",
          "currency": "EUR",
          "maturity": "2029-06-20",
          "coupon": 0.125,
          "yield": 2.32,
          "price": 92.83,
          "change": "+0.00",
          "lastUpdate": "2026-01-08"
        },
        {
          "isin": "XS2102495673",
          "name": "BEI 16/01/2030 0,05%",
          "type": "BOND",
          "country": "XS",
          "currency": "EUR",
          "maturity": "2030-01-16",
          "coupon": 0.05,
          "yield": 2.32,
          "price": 91.4,
          "change": "+0.00",
          "lastUpdate": "2026-01-08"
        },
        {
          "isin": "EU000A3KRJQ6",
          "name": "EUROPEAN UNION 04/07/2029 0%",
          "type": "BOND",
          "country": "EU",
          "currency": "EUR",
          "maturity": "2029-07-04",
          "coupon": 0,
          "yield": 2.31,
          "price": 92.36,
          "change": "+0.00",
          "lastUpdate": "2026-01-08"
        },
        {
          "isin": "EU000A3K4EN5",
          "name": "EUROPEAN UNION 05/12/2028 3,125%",
          "type": "BOND",
          "country": "EU",
          "currency": "EUR",
          "maturity": "2028-12-05",
          "coupon": 3.125,
          "yield": 2.31,
          "price": 102.26,
          "change": "+0.00",
          "lastUpdate": "2026-01-08"
        },
        {
          "isin": "EU000A1G0D88",
          "name": "EFSF 16/10/2026 0,625%",
          "type": "BOND",
          "country": "EU",
          "currency": "EUR",
          "maturity": "2026-10-16",
          "coupon": 0.625,
          "yield": 2.31,
          "price": 98.75,
          "change": "+0.00",
          "lastUpdate": "2026-01-08"
        },
        {
          "isin": "EU000A3KWCF4",
          "name": "EUROPEAN UNION 04/10/2028 0%",
          "type": "BOND",
          "country": "EU",
          "currency": "EUR",
          "maturity": "2028-10-04",
          "coupon": 0,
          "yield": 2.29,
          "price": 94.02,
          "change": "+0.00",
          "lastUpdate": "2026-01-08"
        },
        {
          "isin": "EU000A4D5QM6",
          "name": "EUROPEAN UNION 04/07/2028 2,625%",
          "type": "BOND",
          "country": "EU",
          "currency": "EUR",
          "maturity": "2028-07-04",
          "coupon": 2.625,
          "yield": 2.27,
          "price": 100.84,
          "change": "+0.00",
          "lastUpdate": "2026-01-08"
        },
        {
          "isin": "EU000A3K4ED6",
          "name": "BEI 15/11/2028 3%",
          "type": "BOND",
          "country": "EU",
          "currency": "EUR",
          "maturity": "2028-11-15",
          "coupon": 0,
          "yield": 2.23,
          "price": 102.1,
          "change": "+0.00",
          "lastUpdate": "2026-01-08"
        },
        {
          "isin": "EU000A3K4ED6",
          "name": "BEI 15/11/2028 3%",
          "type": "BOND",
          "country": "EU",
          "currency": "EUR",
          "maturity": "2028-11-15",
          "coupon": 0,
          "yield": 2.23,
          "price": 102.1,
          "change": "+0.00",
          "lastUpdate": "2026-01-08"
        },
        {
          "isin": "XS2587298204",
          "name": "BEI 28/07/2028 2,75%",
          "type": "BOND",
          "country": "XS",
          "currency": "EUR",
          "maturity": "2028-07-28",
          "coupon": 2.75,
          "yield": 2.22,
          "price": 101.29,
          "change": "+0.00",
          "lastUpdate": "2026-01-08"
        },
        {
          "isin": "EU000A1G0D70",
          "name": "EFSF 14/02/2028 0,95%",
          "type": "BOND",
          "country": "EU",
          "currency": "EUR",
          "maturity": "2028-02-14",
          "coupon": 0.95,
          "yield": 2.22,
          "price": 97.44,
          "change": "+0.00",
          "lastUpdate": "2026-01-08"
        },
        {
          "isin": "XS2587298204",
          "name": "BEI 28/07/2028 2,75%",
          "type": "BOND",
          "country": "XS",
          "currency": "EUR",
          "maturity": "2028-07-28",
          "coupon": 2.75,
          "yield": 2.22,
          "price": 101.29,
          "change": "+0.00",
          "lastUpdate": "2026-01-08"
        },
        {
          "isin": "EU000A1G6TV9",
          "name": "EUROPEAN UNION 04/04/2028 2,875%",
          "type": "BOND",
          "country": "EU",
          "currency": "EUR",
          "maturity": "2028-04-04",
          "coupon": 2.875,
          "yield": 2.21,
          "price": 101.42,
          "change": "+0.00",
          "lastUpdate": "2026-01-08"
        },
        {
          "isin": "XS2343538372",
          "name": "BEI 28/09/2028 0%",
          "type": "BOND",
          "country": "XS",
          "currency": "EUR",
          "maturity": "2028-09-28",
          "coupon": 0,
          "yield": 2.2,
          "price": 94.27,
          "change": "+0.00",
          "lastUpdate": "2026-01-08"
        },
        {
          "isin": "EU000A1HBXS7",
          "name": "EUROPEAN UNION 04/11/2027 2,5%",
          "type": "BOND",
          "country": "EU",
          "currency": "EUR",
          "maturity": "2027-11-04",
          "coupon": 2.5,
          "yield": 2.2,
          "price": 100.53,
          "change": "+0.00",
          "lastUpdate": "2026-01-08"
        },
        {
          "isin": "XS2343538372",
          "name": "BEI 28/09/2028 0%",
          "type": "BOND",
          "country": "XS",
          "currency": "EUR",
          "maturity": "2028-09-28",
          "coupon": 0,
          "yield": 2.2,
          "price": 94.27,
          "change": "+0.00",
          "lastUpdate": "2026-01-08"
        },
        {
          "isin": "EU000A4EBBP0",
          "name": "BEI 14/08/2028 2,25%",
          "type": "BOND",
          "country": "EU",
          "currency": "EUR",
          "maturity": "2028-08-14",
          "coupon": 2.25,
          "yield": 2.19,
          "price": 100.13,
          "change": "+0.00",
          "lastUpdate": "2026-01-08"
        },
        {
          "isin": "EU000A4EBBP0",
          "name": "BEI 14/08/2028 2,25%",
          "type": "BOND",
          "country": "EU",
          "currency": "EUR",
          "maturity": "2028-08-14",
          "coupon": 2.25,
          "yield": 2.19,
          "price": 100.13,
          "change": "+0.00",
          "lastUpdate": "2026-01-08"
        },
        {
          "isin": "EU000A3K4EW6",
          "name": "EUROPEAN UNION 06/12/2027 2,875%",
          "type": "BOND",
          "country": "EU",
          "currency": "EUR",
          "maturity": "2027-12-06",
          "coupon": 2.875,
          "yield": 2.17,
          "price": 101.29,
          "change": "+0.00",
          "lastUpdate": "2026-01-08"
        },
        {
          "isin": "EU000A287074",
          "name": "EUROPEAN UNION 02/06/2028 0%",
          "type": "BOND",
          "country": "EU",
          "currency": "EUR",
          "maturity": "2028-06-02",
          "coupon": 0,
          "yield": 2.16,
          "price": 95.02,
          "change": "+0.00",
          "lastUpdate": "2026-01-08"
        },
        {
          "isin": "EU000A3K4DS6",
          "name": "EUROPEAN UNION 04/10/2027 2%",
          "type": "BOND",
          "country": "EU",
          "currency": "EUR",
          "maturity": "2027-10-04",
          "coupon": 0,
          "yield": 2.16,
          "price": 99.73,
          "change": "+0.00",
          "lastUpdate": "2026-01-08"
        },
        {
          "isin": "EU000A1Z99T1",
          "name": "EUROPEAN STABILITY MECHANISM 18/09/2029 2,625%",
          "type": "BOND",
          "country": "EU",
          "currency": "EUR",
          "maturity": "2029-09-18",
          "coupon": 2.625,
          "yield": 2.16,
          "price": 101.64,
          "change": "+0.00",
          "lastUpdate": "2026-01-08"
        },
        {
          "isin": "EU000A2SCAE8",
          "name": "EFSF 11/04/2028 2,375%",
          "type": "BOND",
          "country": "EU",
          "currency": "EUR",
          "maturity": "2028-04-11",
          "coupon": 2.375,
          "yield": 2.15,
          "price": 100.47,
          "change": "+0.00",
          "lastUpdate": "2026-01-08"
        },
        {
          "isin": "EU000A1Z99X3",
          "name": "EUROPEAN STABILITY MECHANISM 17/11/2028 2,125%",
          "type": "BOND",
          "country": "EU",
          "currency": "EUR",
          "maturity": "2028-11-17",
          "coupon": 2.125,
          "yield": 2.15,
          "price": 99.92,
          "change": "+0.00",
          "lastUpdate": "2026-01-08"
        },
        {
          "isin": "XS2154339860",
          "name": "BEI 15/05/2028 0%",
          "type": "BOND",
          "country": "XS",
          "currency": "EUR",
          "maturity": "2028-05-15",
          "coupon": 0,
          "yield": 2.15,
          "price": 95.15,
          "change": "+0.00",
          "lastUpdate": "2026-01-08"
        },
        {
          "isin": "XS2154339860",
          "name": "BEI 15/05/2028 0%",
          "type": "BOND",
          "country": "XS",
          "currency": "EUR",
          "maturity": "2028-05-15",
          "coupon": 0,
          "yield": 2.15,
          "price": 95.15,
          "change": "+0.00",
          "lastUpdate": "2026-01-08"
        },
        {
          "isin": "XS1938387237",
          "name": "BEI 22/01/2029 0,625%",
          "type": "BOND",
          "country": "XS",
          "currency": "EUR",
          "maturity": "2029-01-22",
          "coupon": 0.625,
          "yield": 2.13,
          "price": 95.64,
          "change": "+0.00",
          "lastUpdate": "2026-01-08"
        },
        {
          "isin": "XS1938387237",
          "name": "BEI 22/01/2029 0,625%",
          "type": "BOND",
          "country": "XS",
          "currency": "EUR",
          "maturity": "2029-01-22",
          "coupon": 0.625,
          "yield": 2.13,
          "price": 95.64,
          "change": "+0.00",
          "lastUpdate": "2026-01-08"
        },
        {
          "isin": "EU000A1G0DY0",
          "name": "EFSF 26/07/2027 0,875%",
          "type": "BOND",
          "country": "EU",
          "currency": "EUR",
          "maturity": "2027-07-26",
          "coupon": 0.875,
          "yield": 2.12,
          "price": 98.14,
          "change": "+0.00",
          "lastUpdate": "2026-01-08"
        },
        {
          "isin": "EU000A1G0DR4",
          "name": "EFSF 03/05/2027 0,75%",
          "type": "BOND",
          "country": "EU",
          "currency": "EUR",
          "maturity": "2027-05-03",
          "coupon": 0.75,
          "yield": 2.11,
          "price": 98.27,
          "change": "+0.00",
          "lastUpdate": "2026-01-08"
        },
        {
          "isin": "XS2251371022",
          "name": "BEI 28/03/2028 0%",
          "type": "BOND",
          "country": "XS",
          "currency": "EUR",
          "maturity": "2028-03-28",
          "coupon": 0,
          "yield": 2.09,
          "price": 95.53,
          "change": "+0.00",
          "lastUpdate": "2026-01-08"
        },
        {
          "isin": "XS2251371022",
          "name": "BEI 28/03/2028 0%",
          "type": "BOND",
          "country": "XS",
          "currency": "EUR",
          "maturity": "2028-03-28",
          "coupon": 0,
          "yield": 2.09,
          "price": 95.53,
          "change": "+0.00",
          "lastUpdate": "2026-01-08"
        },
        {
          "isin": "EU000A3K4D82",
          "name": "EUROPEAN UNION 05/10/2026 2,75%",
          "type": "BOND",
          "country": "EU",
          "currency": "EUR",
          "maturity": "2026-10-05",
          "coupon": 2.75,
          "yield": 2.08,
          "price": 100.47,
          "change": "+0.00",
          "lastUpdate": "2026-01-08"
        },
        {
          "isin": "DE0001345908",
          "name": "BEI 05/11/2026 ZC",
          "type": "BOND",
          "country": "DE",
          "currency": "EUR",
          "maturity": "2026-11-05",
          "coupon": 0,
          "yield": 2.07,
          "price": 98.35,
          "change": "+0.00",
          "lastUpdate": "2026-01-08"
        },
        {
          "isin": "DE0001345908",
          "name": "BEI 05/11/2026 ZC",
          "type": "BOND",
          "country": "DE",
          "currency": "EUR",
          "maturity": "2026-11-05",
          "coupon": 0,
          "yield": 2.07,
          "price": 98.35,
          "change": "+0.00",
          "lastUpdate": "2026-01-08"
        },
        {
          "isin": "XS1791485011",
          "name": "BEI 14/01/2028 0,875%",
          "type": "BOND",
          "country": "XS",
          "currency": "EUR",
          "maturity": "2028-01-14",
          "coupon": 0.875,
          "yield": 2.05,
          "price": 97.71,
          "change": "+0.00",
          "lastUpdate": "2026-01-08"
        },
        {
          "isin": "XS1791485011",
          "name": "BEI 14/01/2028 0,875%",
          "type": "BOND",
          "country": "XS",
          "currency": "EUR",
          "maturity": "2028-01-14",
          "coupon": 0.875,
          "yield": 2.05,
          "price": 97.71,
          "change": "+0.00",
          "lastUpdate": "2026-01-08"
        },
        {
          "isin": "XS2168048564",
          "name": "BEI 17/06/2027 0%",
          "type": "BOND",
          "country": "XS",
          "currency": "EUR",
          "maturity": "2027-06-17",
          "coupon": 0,
          "yield": 2.02,
          "price": 97.18,
          "change": "+0.00",
          "lastUpdate": "2026-01-08"
        },
        {
          "isin": "XS2168048564",
          "name": "BEI 17/06/2027 0%",
          "type": "BOND",
          "country": "XS",
          "currency": "EUR",
          "maturity": "2027-06-17",
          "coupon": 0,
          "yield": 2.02,
          "price": 97.18,
          "change": "+0.00",
          "lastUpdate": "2026-01-08"
        },
        {
          "isin": "XS2419364653",
          "name": "BEI 15/11/2027 0%",
          "type": "BOND",
          "country": "XS",
          "currency": "EUR",
          "maturity": "2027-11-15",
          "coupon": 0,
          "yield": 2.01,
          "price": 96.4,
          "change": "+0.00",
          "lastUpdate": "2026-01-08"
        },
        {
          "isin": "EU000A1GVVF8",
          "name": "EUROPEAN UNION 04/09/2026 3%",
          "type": "BOND",
          "country": "EU",
          "currency": "EUR",
          "maturity": "2026-09-04",
          "coupon": 0,
          "yield": 2.01,
          "price": 100.62,
          "change": "+0.00",
          "lastUpdate": "2026-01-08"
        },
        {
          "isin": "XS2419364653",
          "name": "BEI 15/11/2027 0%",
          "type": "BOND",
          "country": "XS",
          "currency": "EUR",
          "maturity": "2027-11-15",
          "coupon": 0,
          "yield": 2.01,
          "price": 96.4,
          "change": "+0.00",
          "lastUpdate": "2026-01-08"
        },
        {
          "isin": "XS2446841657",
          "name": "BEI 15/09/2027 0,375%",
          "type": "BOND",
          "country": "XS",
          "currency": "EUR",
          "maturity": "2027-09-15",
          "coupon": 0.375,
          "yield": 2,
          "price": 97.35,
          "change": "+0.00",
          "lastUpdate": "2026-01-08"
        },
        {
          "isin": "XS2446841657",
          "name": "BEI 15/09/2027 0,375%",
          "type": "BOND",
          "country": "XS",
          "currency": "EUR",
          "maturity": "2027-09-15",
          "coupon": 0.375,
          "yield": 2,
          "price": 97.35,
          "change": "+0.00",
          "lastUpdate": "2026-01-08"
        },
        {
          "isin": "XS1998930926",
          "name": "WORLD BANK 21/05/2029 0,25%",
          "type": "BOND",
          "country": "XS",
          "currency": "EUR",
          "maturity": "2029-05-21",
          "coupon": 0.25,
          "yield": 1.99,
          "price": 94.41,
          "change": "+0.00",
          "lastUpdate": "2026-01-08"
        },
        {
          "isin": "XS1107718279",
          "name": "BEI GREEN BOND 13/11/2026 1,25%",
          "type": "BOND",
          "country": "XS",
          "currency": "EUR",
          "maturity": "2026-11-13",
          "coupon": 1.25,
          "yield": 1.98,
          "price": 99.4,
          "change": "+0.00",
          "lastUpdate": "2026-01-08"
        },
        {
          "isin": "XS1555331617",
          "name": "BEI 15/01/2027 0,5%",
          "type": "BOND",
          "country": "XS",
          "currency": "EUR",
          "maturity": "2027-01-15",
          "coupon": 0.5,
          "yield": 1.98,
          "price": 98.54,
          "change": "+0.00",
          "lastUpdate": "2026-01-08"
        },
        {
          "isin": "XS1107718279",
          "name": "BEI GREEN BOND 13/11/2026 1,25%",
          "type": "BOND",
          "country": "XS",
          "currency": "EUR",
          "maturity": "2026-11-13",
          "coupon": 1.25,
          "yield": 1.98,
          "price": 99.4,
          "change": "+0.00",
          "lastUpdate": "2026-01-08"
        },
        {
          "isin": "XS1555331617",
          "name": "BEI 15/01/2027 0,5%",
          "type": "BOND",
          "country": "XS",
          "currency": "EUR",
          "maturity": "2027-01-15",
          "coupon": 0.5,
          "yield": 1.98,
          "price": 98.54,
          "change": "+0.00",
          "lastUpdate": "2026-01-08"
        },
        {
          "isin": "XS1347679448",
          "name": "BEI 12/11/2026 1,75% SEK",
          "type": "BOND",
          "country": "XS",
          "currency": "SEK",
          "maturity": "2026-11-12",
          "coupon": 1.75,
          "yield": 1.96,
          "price": 99.83,
          "change": "+0.00",
          "lastUpdate": "2026-01-08"
        },
        {
          "isin": "XS1347679448",
          "name": "BEI 12/11/2026 1,75% SEK",
          "type": "BOND",
          "country": "XS",
          "currency": "SEK",
          "maturity": "2026-11-12",
          "coupon": 1.75,
          "yield": 1.96,
          "price": 99.83,
          "change": "+0.00",
          "lastUpdate": "2026-01-08"
        },
        {
          "isin": "EU000A3KTGV8",
          "name": "EUROPEAN UNION 06/07/2026 0%",
          "type": "BOND",
          "country": "EU",
          "currency": "EUR",
          "maturity": "2026-07-06",
          "coupon": 0,
          "yield": 1.93,
          "price": 99.09,
          "change": "+0.00",
          "lastUpdate": "2026-01-08"
        },
        {
          "isin": "XS0755873253",
          "name": "BEI 15/04/2027 3,5%",
          "type": "BOND",
          "country": "XS",
          "currency": "EUR",
          "maturity": "2027-04-15",
          "coupon": 3.5,
          "yield": 1.91,
          "price": 101.95,
          "change": "+0.00",
          "lastUpdate": "2026-01-08"
        },
        {
          "isin": "XS0755873253",
          "name": "BEI 15/04/2027 3,5%",
          "type": "BOND",
          "country": "XS",
          "currency": "EUR",
          "maturity": "2027-04-15",
          "coupon": 3.5,
          "yield": 1.91,
          "price": 101.95,
          "change": "+0.00",
          "lastUpdate": "2026-01-08"
        },
        {
          "isin": "XS2388495942",
          "name": "BEI 22/12/2026 0%",
          "type": "BOND",
          "country": "XS",
          "currency": "EUR",
          "maturity": "2026-12-22",
          "coupon": 0,
          "yield": 1.9,
          "price": 98.24,
          "change": "+0.00",
          "lastUpdate": "2026-01-08"
        },
        {
          "isin": "XS2388495942",
          "name": "BEI 22/12/2026 0%",
          "type": "BOND",
          "country": "XS",
          "currency": "EUR",
          "maturity": "2026-12-22",
          "coupon": 0,
          "yield": 1.9,
          "price": 98.24,
          "change": "+0.00",
          "lastUpdate": "2026-01-08"
        },
        {
          "isin": "EU000A1Z99R5",
          "name": "EUROPEAN STABILITY MECHANISM 15/03/2028 3%",
          "type": "BOND",
          "country": "EU",
          "currency": "EUR",
          "maturity": "2028-03-15",
          "coupon": 0,
          "yield": 1.89,
          "price": 102.33,
          "change": "+0.00",
          "lastUpdate": "2026-01-08"
        },
        {
          "isin": "EU000A2SCAQ2",
          "name": "EFSF 15/12/2027 2,5%",
          "type": "BOND",
          "country": "EU",
          "currency": "EUR",
          "maturity": "2027-12-15",
          "coupon": 2.5,
          "yield": 1.85,
          "price": 101.22,
          "change": "+0.00",
          "lastUpdate": "2026-01-08"
        },
        {
          "isin": "EU000A3K4DA4",
          "name": "EUROPEAN UNION 22/10/2026 0,25%",
          "type": "BOND",
          "country": "EU",
          "currency": "EUR",
          "maturity": "2026-10-22",
          "coupon": 0.25,
          "yield": 1.82,
          "price": 98.8,
          "change": "+0.00",
          "lastUpdate": "2026-01-08"
        },
        {
          "isin": "XS1394055872",
          "name": "BEI 14/04/2026 0,375%",
          "type": "BOND",
          "country": "XS",
          "currency": "EUR",
          "maturity": "2026-04-14",
          "coupon": 0.375,
          "yield": 1.78,
          "price": 99.65,
          "change": "+0.00",
          "lastUpdate": "2026-01-08"
        },
        {
          "isin": "XS1394055872",
          "name": "BEI 14/04/2026 0,375%",
          "type": "BOND",
          "country": "XS",
          "currency": "EUR",
          "maturity": "2026-04-14",
          "coupon": 0.375,
          "yield": 1.78,
          "price": 99.65,
          "change": "+0.00",
          "lastUpdate": "2026-01-08"
        },
        {
          "isin": "EU000A3KNYF7",
          "name": "EUROPEAN UNION 04/03/2026 0%",
          "type": "BOND",
          "country": "EU",
          "currency": "EUR",
          "maturity": "2026-03-04",
          "coupon": 0,
          "yield": 1.54,
          "price": 99.79,
          "change": "+0.00",
          "lastUpdate": "2026-01-08"
        },
        {
          "isin": "EU000A1G0EN1",
          "name": "EFSF 20/07/2026 0%",
          "type": "BOND",
          "country": "EU",
          "currency": "EUR",
          "maturity": "2026-07-20",
          "coupon": 0,
          "yield": 1.48,
          "price": 99.24,
          "change": "+0.00",
          "lastUpdate": "2026-01-08"
        },
        {
          "isin": "EU000A1Z99Q7",
          "name": "EUROPEAN STABILITY MECHANISM 23/06/2027 1%",
          "type": "BOND",
          "country": "EU",
          "currency": "EUR",
          "maturity": "2027-06-23",
          "coupon": 0,
          "yield": 1.34,
          "price": 99.51,
          "change": "+0.00",
          "lastUpdate": "2026-01-08"
        },
        {
          "isin": "XS1878833695",
          "name": "BEI 15/05/2026 0,375%",
          "type": "BOND",
          "country": "XS",
          "currency": "EUR",
          "maturity": "2026-05-15",
          "coupon": 0.375,
          "yield": 1.27,
          "price": 99.7,
          "change": "+0.00",
          "lastUpdate": "2026-01-08"
        },
        {
          "isin": "XS1878833695",
          "name": "BEI 15/05/2026 0,375%",
          "type": "BOND",
          "country": "XS",
          "currency": "EUR",
          "maturity": "2026-05-15",
          "coupon": 0.375,
          "yield": 1.27,
          "price": 99.7,
          "change": "+0.00",
          "lastUpdate": "2026-01-08"
        },
        {
          "isin": "EU000A1G0DH5",
          "name": "EFSF 31/05/2026 0,4%",
          "type": "BOND",
          "country": "EU",
          "currency": "EUR",
          "maturity": "2026-05-31",
          "coupon": 0.4,
          "yield": 1.19,
          "price": 99.7,
          "change": "+0.00",
          "lastUpdate": "2026-01-08"
        },
        {
          "isin": "EU000A1G0EB6",
          "name": "EFSF 26/01/2026 0,4%",
          "type": "BOND",
          "country": "EU",
          "currency": "EUR",
          "maturity": "2026-01-26",
          "coupon": 0.4,
          "yield": 0.29,
          "price": 100,
          "change": "+0.00",
          "lastUpdate": "2026-01-08"
        },
        {
          "isin": "XS0084162576",
          "name": "WORLD BANK 17/02/2026 ZC ZAR",
          "type": "BOND",
          "country": "XS",
          "currency": "ZAR",
          "maturity": "2026-02-17",
          "coupon": 0,
          "yield": -4.42,
          "price": 100.45,
          "change": "+0.00",
          "lastUpdate": "2026-01-08"
        }
      ]
    },
    "corporate-all": {
      "name": "Corporate",
      "description": "Obbligazioni societarie",
      "count": 102,
      "bonds": [
        {
          "isin": "US345370CQ17",
          "name": "FORD 15/01/2043 4,75% USD",
          "type": "BOND",
          "country": "US",
          "currency": "USD",
          "maturity": "2043-01-15",
          "coupon": 4.75,
          "yield": 6.88,
          "price": 79.8,
          "change": "+0.00",
          "lastUpdate": "2026-01-08"
        },
        {
          "isin": "USF2893TAQ97",
          "name": "EDF 13/10/2045 4,95% USD Call",
          "type": "BOND",
          "country": "US",
          "currency": "USD",
          "maturity": "2045-10-13",
          "coupon": 4.95,
          "yield": 6,
          "price": 88.88,
          "change": "+0.00",
          "lastUpdate": "2026-01-08"
        },
        {
          "isin": "USF2893TAR70",
          "name": "EDF 13/10/2055 5,25% USD Call",
          "type": "BOND",
          "country": "US",
          "currency": "USD",
          "maturity": "2055-10-13",
          "coupon": 5.25,
          "yield": 5.97,
          "price": 91.12,
          "change": "+0.00",
          "lastUpdate": "2026-01-08"
        },
        {
          "isin": "USF2893TAK28",
          "name": "EDF 22/01/2044 4,875% USD",
          "type": "BOND",
          "country": "US",
          "currency": "USD",
          "maturity": "2044-01-22",
          "coupon": 4.875,
          "yield": 5.79,
          "price": 90.7,
          "change": "+0.00",
          "lastUpdate": "2026-01-08"
        },
        {
          "isin": "XS0452187320",
          "name": "ENEL 14/09/2040 5,75% GBP",
          "type": "BOND",
          "country": "XS",
          "currency": "GBP",
          "maturity": "2040-09-14",
          "coupon": 5.75,
          "yield": 5.71,
          "price": 100.4,
          "change": "+0.00",
          "lastUpdate": "2026-01-08"
        },
        {
          "isin": "USF2893TAE67",
          "name": "EDF 27/01/2040 5,6% USD",
          "type": "BOND",
          "country": "US",
          "currency": "USD",
          "maturity": "2040-01-27",
          "coupon": 5.6,
          "yield": 5.62,
          "price": 100.54,
          "change": "+0.00",
          "lastUpdate": "2026-01-08"
        },
        {
          "isin": "US345370CA64",
          "name": "FORD 16/07/2031 7,45% USD",
          "type": "BOND",
          "country": "US",
          "currency": "USD",
          "maturity": "2031-07-16",
          "coupon": 7.45,
          "yield": 5.25,
          "price": 110.78,
          "change": "+0.00",
          "lastUpdate": "2026-01-08"
        },
        {
          "isin": "XS0214965963",
          "name": "TELECOM ITALIA 17/03/2055 5,25%",
          "type": "BOND",
          "country": "XS",
          "currency": "EUR",
          "maturity": "2055-03-17",
          "coupon": 5.25,
          "yield": 5.12,
          "price": 101.89,
          "change": "+0.00",
          "lastUpdate": "2026-01-08"
        },
        {
          "isin": "USF2893TAP15",
          "name": "EDF 13/10/2035 4,75% USD Call",
          "type": "BOND",
          "country": "US",
          "currency": "USD",
          "maturity": "2035-10-13",
          "coupon": 4.75,
          "yield": 4.9,
          "price": 99.31,
          "change": "+0.00",
          "lastUpdate": "2026-01-08"
        },
        {
          "isin": "XS1910948675",
          "name": "VOLKSWAGEN 16/11/2038 4,125%",
          "type": "BOND",
          "country": "XS",
          "currency": "EUR",
          "maturity": "2038-11-16",
          "coupon": 4.125,
          "yield": 4.24,
          "price": 98.89,
          "change": "+0.00",
          "lastUpdate": "2026-01-08"
        },
        {
          "isin": "XS1721422902",
          "name": "VODAFONE GROUP 20/11/2037 2,875%",
          "type": "BOND",
          "country": "XS",
          "currency": "EUR",
          "maturity": "2037-11-20",
          "coupon": 2.875,
          "yield": 4.01,
          "price": 89.48,
          "change": "+0.00",
          "lastUpdate": "2026-01-08"
        },
        {
          "isin": "FR0010014845",
          "name": "GIE PSA TRSORERIE 19/09/2033 6%",
          "type": "BOND",
          "country": "FR",
          "currency": "EUR",
          "maturity": "2033-09-19",
          "coupon": 0,
          "yield": 4,
          "price": 113,
          "change": "+0.00",
          "lastUpdate": "2026-01-08"
        },
        {
          "isin": "FR0011911247",
          "name": "ENGIE 19/05/2026 2,375%",
          "type": "BOND",
          "country": "FR",
          "currency": "EUR",
          "maturity": "2026-05-19",
          "coupon": 2.375,
          "yield": 3.82,
          "price": 99.5,
          "change": "+0.00",
          "lastUpdate": "2026-01-08"
        },
        {
          "isin": "US89236TDR32",
          "name": "TOYOTA 11/01/2027 3,2% USD(No call)",
          "type": "BOND",
          "country": "US",
          "currency": "USD",
          "maturity": "2027-01-11",
          "coupon": 3.2,
          "yield": 3.78,
          "price": 99.47,
          "change": "+0.00",
          "lastUpdate": "2026-01-08"
        },
        {
          "isin": "DE000A2GSCX1",
          "name": "MERCEDES-BENZ GROUP AG 03/07/2037 2,125%",
          "type": "BOND",
          "country": "DE",
          "currency": "EUR",
          "maturity": "2037-07-03",
          "coupon": 2.125,
          "yield": 3.76,
          "price": 85,
          "change": "+0.00",
          "lastUpdate": "2026-01-08"
        },
        {
          "isin": "XS0908570459",
          "name": "VOLKSWAGEN INTERNATIONAL FINANCE 22/03/2033 3,3%",
          "type": "BOND",
          "country": "XS",
          "currency": "EUR",
          "maturity": "2033-03-22",
          "coupon": 3.3,
          "yield": 3.72,
          "price": 97.36,
          "change": "+0.00",
          "lastUpdate": "2026-01-08"
        },
        {
          "isin": "IT0005675597",
          "name": "CASSA DEPOSITI E PRESTITI 27/10/2035 3,5%",
          "type": "BOND",
          "country": "IT",
          "currency": "EUR",
          "maturity": "2035-10-27",
          "coupon": 3.5,
          "yield": 3.69,
          "price": 98.42,
          "change": "+0.00",
          "lastUpdate": "2026-01-08"
        },
        {
          "isin": "XS0161100515",
          "name": "TELECOM ITALIA FINANCE 24/01/2033 7,75%",
          "type": "BOND",
          "country": "XS",
          "currency": "EUR",
          "maturity": "2033-01-24",
          "coupon": 7.75,
          "yield": 3.62,
          "price": 125.22,
          "change": "+0.00",
          "lastUpdate": "2026-01-08"
        },
        {
          "isin": "XS2065946837",
          "name": "ENI 11/10/2034 1%",
          "type": "BOND",
          "country": "XS",
          "currency": "EUR",
          "maturity": "2034-10-11",
          "coupon": 0,
          "yield": 3.61,
          "price": 80.74,
          "change": "+0.00",
          "lastUpdate": "2026-01-08"
        },
        {
          "isin": "XS2625968776",
          "name": "BMW FINANCE 22/05/2035 3,625%",
          "type": "BOND",
          "country": "XS",
          "currency": "EUR",
          "maturity": "2035-05-22",
          "coupon": 3.625,
          "yield": 3.59,
          "price": 100.23,
          "change": "+0.00",
          "lastUpdate": "2026-01-08"
        },
        {
          "isin": "XS3075490261",
          "name": "BMW 20/11/2034 3,75%",
          "type": "BOND",
          "country": "XS",
          "currency": "EUR",
          "maturity": "2034-11-20",
          "coupon": 3.75,
          "yield": 3.59,
          "price": 101.17,
          "change": "+0.00",
          "lastUpdate": "2026-01-08"
        },
        {
          "isin": "XS2887901911",
          "name": "BMW 27/08/2034 3,375%",
          "type": "BOND",
          "country": "XS",
          "currency": "EUR",
          "maturity": "2034-08-27",
          "coupon": 3.375,
          "yield": 3.57,
          "price": 98.53,
          "change": "+0.00",
          "lastUpdate": "2026-01-08"
        },
        {
          "isin": "XS0162990229",
          "name": "EDF 21/02/2033 5,625%",
          "type": "BOND",
          "country": "XS",
          "currency": "EUR",
          "maturity": "2033-02-21",
          "coupon": 5.625,
          "yield": 3.5,
          "price": 113.15,
          "change": "+0.00",
          "lastUpdate": "2026-01-08"
        },
        {
          "isin": "XS2694874533",
          "name": "VOLKSWAGEN GREEN BOND 25/09/2031 4,75%",
          "type": "BOND",
          "country": "XS",
          "currency": "EUR",
          "maturity": "2031-09-25",
          "coupon": 4.75,
          "yield": 3.36,
          "price": 107.1,
          "change": "+0.00",
          "lastUpdate": "2026-01-08"
        },
        {
          "isin": "FR0000471930",
          "name": "ORANGE 28/01/2033 8,125%",
          "type": "BOND",
          "country": "FR",
          "currency": "EUR",
          "maturity": "2033-01-28",
          "coupon": 8.125,
          "yield": 3.32,
          "price": 129.75,
          "change": "+0.00",
          "lastUpdate": "2026-01-08"
        },
        {
          "isin": "XS2745726047",
          "name": "VOLKSWAGEN GREEN BOND 11/04/2031 4%",
          "type": "BOND",
          "country": "XS",
          "currency": "EUR",
          "maturity": "2031-04-11",
          "coupon": 0,
          "yield": 3.3,
          "price": 103.32,
          "change": "+0.00",
          "lastUpdate": "2026-01-08"
        },
        {
          "isin": "XS1910948329",
          "name": "VOLKSWAGEN 18/11/2030 3,25%",
          "type": "BOND",
          "country": "XS",
          "currency": "EUR",
          "maturity": "2030-11-18",
          "coupon": 3.25,
          "yield": 3.28,
          "price": 99.88,
          "change": "+0.00",
          "lastUpdate": "2026-01-08"
        },
        {
          "isin": "DE000A3H3JM4",
          "name": "MERCEDES-BENZ GROUP AG GREEN BOND 11/03/2033 0,75%",
          "type": "BOND",
          "country": "DE",
          "currency": "EUR",
          "maturity": "2033-03-11",
          "coupon": 0.75,
          "yield": 3.26,
          "price": 84.19,
          "change": "+0.00",
          "lastUpdate": "2026-01-08"
        },
        {
          "isin": "XS2837886287",
          "name": "VOLKSWAGEN GREEN BOND 10/09/2030 3,875%",
          "type": "BOND",
          "country": "XS",
          "currency": "EUR",
          "maturity": "2030-09-10",
          "coupon": 3.875,
          "yield": 3.25,
          "price": 102.66,
          "change": "+0.00",
          "lastUpdate": "2026-01-08"
        },
        {
          "isin": "IT0005603284",
          "name": "CASSA DEPOSITI E PRESTITI 12/07/2031 3,875%",
          "type": "BOND",
          "country": "IT",
          "currency": "EUR",
          "maturity": "2031-07-12",
          "coupon": 3.875,
          "yield": 3.15,
          "price": 103.59,
          "change": "+0.00",
          "lastUpdate": "2026-01-08"
        },
        {
          "isin": "XS3075490188",
          "name": "BMW 20/05/2031 3,25%",
          "type": "BOND",
          "country": "XS",
          "currency": "EUR",
          "maturity": "2031-05-20",
          "coupon": 3.25,
          "yield": 3.14,
          "price": 100.51,
          "change": "+0.00",
          "lastUpdate": "2026-01-08"
        },
        {
          "isin": "XS1463101680",
          "name": "VODAFONE GROUP 29/07/2031 1,6%",
          "type": "BOND",
          "country": "XS",
          "currency": "EUR",
          "maturity": "2031-07-29",
          "coupon": 1.6,
          "yield": 3.11,
          "price": 92.42,
          "change": "+0.00",
          "lastUpdate": "2026-01-08"
        },
        {
          "isin": "XS2374594823",
          "name": "VOLKSWAGEN 12/02/2030 0,375%",
          "type": "BOND",
          "country": "XS",
          "currency": "EUR",
          "maturity": "2030-02-12",
          "coupon": 0.375,
          "yield": 3.07,
          "price": 89.79,
          "change": "+0.00",
          "lastUpdate": "2026-01-08"
        },
        {
          "isin": "XS2280845145",
          "name": "BMW FINANCE 11/01/2033 0,2%",
          "type": "BOND",
          "country": "XS",
          "currency": "EUR",
          "maturity": "2033-01-11",
          "coupon": 0.2,
          "yield": 3.07,
          "price": 82.18,
          "change": "+0.00",
          "lastUpdate": "2026-01-08"
        },
        {
          "isin": "XS2176785447",
          "name": "ENI 18/05/2031 2%",
          "type": "BOND",
          "country": "XS",
          "currency": "EUR",
          "maturity": "2031-05-18",
          "coupon": 0,
          "yield": 3.06,
          "price": 94.83,
          "change": "+0.00",
          "lastUpdate": "2026-01-08"
        },
        {
          "isin": "DE000A2TR083",
          "name": "MERCEDES-BENZ GROUP AG 27/02/2031 2%",
          "type": "BOND",
          "country": "DE",
          "currency": "EUR",
          "maturity": "2031-02-27",
          "coupon": 0,
          "yield": 3.03,
          "price": 95.18,
          "change": "+0.00",
          "lastUpdate": "2026-01-08"
        },
        {
          "isin": "XS2032727310",
          "name": "ITALGAS 24/04/2030 0,875%",
          "type": "BOND",
          "country": "XS",
          "currency": "EUR",
          "maturity": "2030-04-24",
          "coupon": 0.875,
          "yield": 3.01,
          "price": 91.53,
          "change": "+0.00",
          "lastUpdate": "2026-01-08"
        },
        {
          "isin": "XS1167667283",
          "name": "VOLKSWAGEN INTERNATIONAL FINANCE 16/01/2030 1,625%",
          "type": "BOND",
          "country": "XS",
          "currency": "EUR",
          "maturity": "2030-01-16",
          "coupon": 1.625,
          "yield": 3.01,
          "price": 94.83,
          "change": "+0.00",
          "lastUpdate": "2026-01-08"
        },
        {
          "isin": "XS2343822503",
          "name": "VOLKSWAGEN LEASING 19/07/2029 0,625%",
          "type": "BOND",
          "country": "XS",
          "currency": "EUR",
          "maturity": "2029-07-19",
          "coupon": 0.625,
          "yield": 3.01,
          "price": 92.15,
          "change": "+0.00",
          "lastUpdate": "2026-01-08"
        },
        {
          "isin": "XS2887901598",
          "name": "BMW 27/08/2030 3,125%",
          "type": "BOND",
          "country": "XS",
          "currency": "EUR",
          "maturity": "2030-08-27",
          "coupon": 3.125,
          "yield": 2.97,
          "price": 100.63,
          "change": "+0.00",
          "lastUpdate": "2026-01-08"
        },
        {
          "isin": "XS2694872594",
          "name": "VOLKSWAGEN LEASING GREEN BOND 25/03/2029 4,625%",
          "type": "BOND",
          "country": "XS",
          "currency": "EUR",
          "maturity": "2029-03-25",
          "coupon": 4.625,
          "yield": 2.95,
          "price": 105.03,
          "change": "+0.00",
          "lastUpdate": "2026-01-08"
        },
        {
          "isin": "XS2745725155",
          "name": "VOLKSWAGEN GREEN BOND 11/10/2028 3,875%",
          "type": "BOND",
          "country": "XS",
          "currency": "EUR",
          "maturity": "2028-10-11",
          "coupon": 3.875,
          "yield": 2.88,
          "price": 102.58,
          "change": "+0.00",
          "lastUpdate": "2026-01-08"
        },
        {
          "isin": "XS2107315470",
          "name": "ENI 23/01/2030 0,625%",
          "type": "BOND",
          "country": "XS",
          "currency": "EUR",
          "maturity": "2030-01-23",
          "coupon": 0.625,
          "yield": 2.87,
          "price": 91.57,
          "change": "+0.00",
          "lastUpdate": "2026-01-08"
        },
        {
          "isin": "XS1120892507",
          "name": "TELEFONICA EMISIONES 17/10/2029 2,932%",
          "type": "BOND",
          "country": "XS",
          "currency": "EUR",
          "maturity": "2029-10-17",
          "coupon": 2.932,
          "yield": 2.85,
          "price": 100.27,
          "change": "+0.00",
          "lastUpdate": "2026-01-08"
        },
        {
          "isin": "DE000A289QR9",
          "name": "MERCEDES-BENZ GROUP AG GREEN BOND 10/09/2030 0,75%",
          "type": "BOND",
          "country": "DE",
          "currency": "EUR",
          "maturity": "2030-09-10",
          "coupon": 0.75,
          "yield": 2.84,
          "price": 91,
          "change": "+0.00",
          "lastUpdate": "2026-01-08"
        },
        {
          "isin": "XS2282095970",
          "name": "VOLKSWAGEN LEASING 12/01/2029 0,5%",
          "type": "BOND",
          "country": "XS",
          "currency": "EUR",
          "maturity": "2029-01-12",
          "coupon": 0.5,
          "yield": 2.83,
          "price": 93.38,
          "change": "+0.00",
          "lastUpdate": "2026-01-08"
        },
        {
          "isin": "XS2152061904",
          "name": "VOLKSWAGEN FINANCIAL SERVICES 06/04/2028 3,375%",
          "type": "BOND",
          "country": "XS",
          "currency": "EUR",
          "maturity": "2028-04-06",
          "coupon": 3.375,
          "yield": 2.81,
          "price": 101.2,
          "change": "+0.00",
          "lastUpdate": "2026-01-08"
        },
        {
          "isin": "IT0005543233",
          "name": "BPER BANCA 26/05/2026",
          "type": "BOND",
          "country": "IT",
          "currency": "EUR",
          "maturity": "2026-05-26",
          "coupon": 0,
          "yield": 2.79,
          "price": 100.73,
          "change": "+0.00",
          "lastUpdate": "2026-01-08"
        },
        {
          "isin": "XS2438616240",
          "name": "VOLKSWAGEN FINANCIAL SERVICES 31/01/2028 0,875%",
          "type": "BOND",
          "country": "XS",
          "currency": "EUR",
          "maturity": "2028-01-31",
          "coupon": 0.875,
          "yield": 2.79,
          "price": 96.24,
          "change": "+0.00",
          "lastUpdate": "2026-01-08"
        },
        {
          "isin": "XS2627121259",
          "name": "FERROVIE DELLO STATO GREEN 23/05/2029 4,125%",
          "type": "BOND",
          "country": "XS",
          "currency": "EUR",
          "maturity": "2029-05-23",
          "coupon": 4.125,
          "yield": 2.77,
          "price": 104.27,
          "change": "+0.00",
          "lastUpdate": "2026-01-08"
        },
        {
          "isin": "XS1023703090",
          "name": "ENI 29/01/2029 3,625%",
          "type": "BOND",
          "country": "XS",
          "currency": "EUR",
          "maturity": "2029-01-29",
          "coupon": 3.625,
          "yield": 2.73,
          "price": 102.57,
          "change": "+0.00",
          "lastUpdate": "2026-01-08"
        },
        {
          "isin": "XS2625968347",
          "name": "BMW FINANCE 22/07/2030 3,25%",
          "type": "BOND",
          "country": "XS",
          "currency": "EUR",
          "maturity": "2030-07-22",
          "coupon": 3.25,
          "yield": 2.73,
          "price": 102.16,
          "change": "+0.00",
          "lastUpdate": "2026-01-08"
        },
        {
          "isin": "DE000A2GSCW3",
          "name": "MERCEDES-BENZ GROUP AG 03/07/2029 1,5%",
          "type": "BOND",
          "country": "DE",
          "currency": "EUR",
          "maturity": "2029-07-03",
          "coupon": 1.5,
          "yield": 2.72,
          "price": 96,
          "change": "+0.00",
          "lastUpdate": "2026-01-08"
        },
        {
          "isin": "XS1685542497",
          "name": "ITALGAS 18/01/2029 1,625%",
          "type": "BOND",
          "country": "XS",
          "currency": "EUR",
          "maturity": "2029-01-18",
          "coupon": 1.625,
          "yield": 2.72,
          "price": 96.87,
          "change": "+0.00",
          "lastUpdate": "2026-01-08"
        },
        {
          "isin": "XS2623496085",
          "name": "FORD 15/05/2028 6,125%",
          "type": "BOND",
          "country": "XS",
          "currency": "EUR",
          "maturity": "2028-05-15",
          "coupon": 6.125,
          "yield": 2.71,
          "price": 107.61,
          "change": "+0.00",
          "lastUpdate": "2026-01-08"
        },
        {
          "isin": "XS1972547696",
          "name": "VOLKSWAGEN FINANCIAL SERVICES 01/10/2027 2,25%",
          "type": "BOND",
          "country": "XS",
          "currency": "EUR",
          "maturity": "2027-10-01",
          "coupon": 2.25,
          "yield": 2.69,
          "price": 99.27,
          "change": "+0.00",
          "lastUpdate": "2026-01-08"
        },
        {
          "isin": "XS1586555945",
          "name": "VOLKSWAGEN 30/03/2027 1,875%",
          "type": "BOND",
          "country": "XS",
          "currency": "EUR",
          "maturity": "2027-03-30",
          "coupon": 1.875,
          "yield": 2.68,
          "price": 99.05,
          "change": "+0.00",
          "lastUpdate": "2026-01-08"
        },
        {
          "isin": "XS1910948162",
          "name": "VOLKSWAGEN 16/11/2027 2,625%",
          "type": "BOND",
          "country": "XS",
          "currency": "EUR",
          "maturity": "2027-11-16",
          "coupon": 2.625,
          "yield": 2.66,
          "price": 99.94,
          "change": "+0.00",
          "lastUpdate": "2026-01-08"
        },
        {
          "isin": "XS1412711217",
          "name": "ENI 17/05/2028 1,625%",
          "type": "BOND",
          "country": "XS",
          "currency": "EUR",
          "maturity": "2028-05-17",
          "coupon": 1.625,
          "yield": 2.64,
          "price": 97.71,
          "change": "+0.00",
          "lastUpdate": "2026-01-08"
        },
        {
          "isin": "XS1505573482",
          "name": "SNAM 25/10/2026 0,875%",
          "type": "BOND",
          "country": "XS",
          "currency": "EUR",
          "maturity": "2026-10-25",
          "coupon": 0.875,
          "yield": 2.62,
          "price": 98.66,
          "change": "+0.00",
          "lastUpdate": "2026-01-08"
        },
        {
          "isin": "XS1503131713",
          "name": "TERNA 11/10/2028 1%",
          "type": "BOND",
          "country": "XS",
          "currency": "EUR",
          "maturity": "2028-10-11",
          "coupon": 0,
          "yield": 2.62,
          "price": 95.76,
          "change": "+0.00",
          "lastUpdate": "2026-01-08"
        },
        {
          "isin": "XS1493328477",
          "name": "ENI 19/09/2028 1,125%",
          "type": "BOND",
          "country": "XS",
          "currency": "EUR",
          "maturity": "2028-09-19",
          "coupon": 1.125,
          "yield": 2.62,
          "price": 96.17,
          "change": "+0.00",
          "lastUpdate": "2026-01-08"
        },
        {
          "isin": "XS1828033834",
          "name": "DEUTSCHE TELEKOM 01/12/2029 2%",
          "type": "BOND",
          "country": "XS",
          "currency": "EUR",
          "maturity": "2029-12-01",
          "coupon": 0,
          "yield": 2.62,
          "price": 97.75,
          "change": "+0.00",
          "lastUpdate": "2026-01-08"
        },
        {
          "isin": "XS3075491152",
          "name": "BMW 20/05/2028 2,625%",
          "type": "BOND",
          "country": "XS",
          "currency": "EUR",
          "maturity": "2028-05-20",
          "coupon": 2.625,
          "yield": 2.59,
          "price": 100.07,
          "change": "+0.00",
          "lastUpdate": "2026-01-08"
        },
        {
          "isin": "XS2447564332",
          "name": "BMW FINANCE 22/05/2028 1%",
          "type": "BOND",
          "country": "XS",
          "currency": "EUR",
          "maturity": "2028-05-22",
          "coupon": 0,
          "yield": 2.59,
          "price": 96.41,
          "change": "+0.00",
          "lastUpdate": "2026-01-08"
        },
        {
          "isin": "DE000A169NC2",
          "name": "DAIMLER 11/05/2028 1,375%",
          "type": "BOND",
          "country": "DE",
          "currency": "EUR",
          "maturity": "2028-05-11",
          "coupon": 1.375,
          "yield": 2.57,
          "price": 97.33,
          "change": "+0.00",
          "lastUpdate": "2026-01-08"
        },
        {
          "isin": "DE000A3LT431",
          "name": "BMW 02/11/2027 3%",
          "type": "BOND",
          "country": "DE",
          "currency": "EUR",
          "maturity": "2027-11-02",
          "coupon": 0,
          "yield": 2.55,
          "price": 100.77,
          "change": "+0.00",
          "lastUpdate": "2026-01-08"
        },
        {
          "isin": "XS1948611840",
          "name": "BMW FINANCE 06/02/2029 1,5%",
          "type": "BOND",
          "country": "XS",
          "currency": "EUR",
          "maturity": "2029-02-06",
          "coupon": 1.5,
          "yield": 2.55,
          "price": 96.95,
          "change": "+0.00",
          "lastUpdate": "2026-01-08"
        },
        {
          "isin": "XS1062900912",
          "name": "GENERALI 04/05/2026 4,125% Junior",
          "type": "BOND",
          "country": "XS",
          "currency": "EUR",
          "maturity": "2026-05-04",
          "coupon": 4.125,
          "yield": 2.53,
          "price": 100.47,
          "change": "+0.00",
          "lastUpdate": "2026-01-08"
        },
        {
          "isin": "XS1893631769",
          "name": "VOLKSWAGEN 16/10/2026 2,25%",
          "type": "BOND",
          "country": "XS",
          "currency": "EUR",
          "maturity": "2026-10-16",
          "coupon": 2.25,
          "yield": 2.49,
          "price": 99.82,
          "change": "+0.00",
          "lastUpdate": "2026-01-08"
        },
        {
          "isin": "XS0553728709",
          "name": "DEUTSCHE TELEKOM INTERNATIONAL FINANCE 28/10/2030 4,5%",
          "type": "BOND",
          "country": "XS",
          "currency": "EUR",
          "maturity": "2030-10-28",
          "coupon": 4.5,
          "yield": 2.48,
          "price": 108.99,
          "change": "+0.00",
          "lastUpdate": "2026-01-08"
        },
        {
          "isin": "XS2026171079",
          "name": "FERROVIE DELLO STATO GREEN BOND 09/07/2026 1,125%",
          "type": "BOND",
          "country": "XS",
          "currency": "EUR",
          "maturity": "2026-07-09",
          "coupon": 1.125,
          "yield": 2.48,
          "price": 99.35,
          "change": "+0.00",
          "lastUpdate": "2026-01-08"
        },
        {
          "isin": "XS1528093799",
          "name": "AUTOSTRADE 01/02/2027 1,75%",
          "type": "BOND",
          "country": "XS",
          "currency": "EUR",
          "maturity": "2027-02-01",
          "coupon": 1.75,
          "yield": 2.47,
          "price": 99.26,
          "change": "+0.00",
          "lastUpdate": "2026-01-08"
        },
        {
          "isin": "XS1327504087",
          "name": "AUTOSTRADE 26/06/2026 1,75%",
          "type": "BOND",
          "country": "XS",
          "currency": "EUR",
          "maturity": "2026-06-26",
          "coupon": 1.75,
          "yield": 2.44,
          "price": 99.69,
          "change": "+0.00",
          "lastUpdate": "2026-01-08"
        },
        {
          "isin": "XS2014291616",
          "name": "VOLKSWAGEN LEASING 19/06/2026 1,5%",
          "type": "BOND",
          "country": "XS",
          "currency": "EUR",
          "maturity": "2026-06-19",
          "coupon": 1.5,
          "yield": 2.43,
          "price": 99.6,
          "change": "+0.00",
          "lastUpdate": "2026-01-08"
        },
        {
          "isin": "XS1747444831",
          "name": "BMW FINANCE 10/01/2028 1,125%",
          "type": "BOND",
          "country": "XS",
          "currency": "EUR",
          "maturity": "2028-01-10",
          "coupon": 1.125,
          "yield": 2.42,
          "price": 97.5,
          "change": "+0.00",
          "lastUpdate": "2026-01-08"
        },
        {
          "isin": "XS2343822842",
          "name": "VOLKSWAGEN LEASING 20/07/2026 0,375%",
          "type": "BOND",
          "country": "XS",
          "currency": "EUR",
          "maturity": "2026-07-20",
          "coupon": 0.375,
          "yield": 2.42,
          "price": 98.96,
          "change": "+0.00",
          "lastUpdate": "2026-01-08"
        },
        {
          "isin": "DE000A2GSLY0",
          "name": "MERCEDES-BENZ GROUP AG 15/11/2027 1%",
          "type": "BOND",
          "country": "DE",
          "currency": "EUR",
          "maturity": "2027-11-15",
          "coupon": 0,
          "yield": 2.41,
          "price": 97.49,
          "change": "+0.00",
          "lastUpdate": "2026-01-08"
        },
        {
          "isin": "XS2745344601",
          "name": "VOLKSWAGEN GREEN BOND 11/10/2026 3,625%",
          "type": "BOND",
          "country": "XS",
          "currency": "EUR",
          "maturity": "2026-10-11",
          "coupon": 3.625,
          "yield": 2.41,
          "price": 100.88,
          "change": "+0.00",
          "lastUpdate": "2026-01-08"
        },
        {
          "isin": "XS1652866002",
          "name": "TERNA 26/07/2027 1,375%",
          "type": "BOND",
          "country": "XS",
          "currency": "EUR",
          "maturity": "2027-07-26",
          "coupon": 1.375,
          "yield": 2.41,
          "price": 98.46,
          "change": "+0.00",
          "lastUpdate": "2026-01-08"
        },
        {
          "isin": "XS2887901325",
          "name": "BMW 27/08/2027 3%",
          "type": "BOND",
          "country": "XS",
          "currency": "EUR",
          "maturity": "2027-08-27",
          "coupon": 0,
          "yield": 2.4,
          "price": 100.93,
          "change": "+0.00",
          "lastUpdate": "2026-01-08"
        },
        {
          "isin": "XS2694872081",
          "name": "VOLKSWAGEN LEASING GREEN BOND 25/03/2026 4,5%",
          "type": "BOND",
          "country": "XS",
          "currency": "EUR",
          "maturity": "2026-03-25",
          "coupon": 4.5,
          "yield": 2.4,
          "price": 100.4,
          "change": "+0.00",
          "lastUpdate": "2026-01-08"
        },
        {
          "isin": "XS2010447238",
          "name": "BMW FINANCE 13/07/2026 0,75%",
          "type": "BOND",
          "country": "XS",
          "currency": "EUR",
          "maturity": "2026-07-13",
          "coupon": 0.75,
          "yield": 2.4,
          "price": 99.19,
          "change": "+0.00",
          "lastUpdate": "2026-01-08"
        },
        {
          "isin": "XS2532681074",
          "name": "FERROVIE DELLO STATO GREEN BOND 14/04/2027 3,75%",
          "type": "BOND",
          "country": "XS",
          "currency": "EUR",
          "maturity": "2027-04-14",
          "coupon": 3.75,
          "yield": 2.37,
          "price": 101.67,
          "change": "+0.00",
          "lastUpdate": "2026-01-08"
        },
        {
          "isin": "FR0011225143",
          "name": "EDF 25/03/2027 4,125%",
          "type": "BOND",
          "country": "FR",
          "currency": "EUR",
          "maturity": "2027-03-25",
          "coupon": 4.125,
          "yield": 2.36,
          "price": 102.05,
          "change": "+0.00",
          "lastUpdate": "2026-01-08"
        },
        {
          "isin": "XS0306646042",
          "name": "ENEL 21/06/2027 5,625%",
          "type": "BOND",
          "country": "XS",
          "currency": "EUR",
          "maturity": "2027-06-21",
          "coupon": 5.625,
          "yield": 2.35,
          "price": 104.56,
          "change": "+0.00",
          "lastUpdate": "2026-01-08"
        },
        {
          "isin": "XS1652855815",
          "name": "VODAFONE GROUP 24/07/2027 1,5%",
          "type": "BOND",
          "country": "XS",
          "currency": "EUR",
          "maturity": "2027-07-24",
          "coupon": 1.5,
          "yield": 2.35,
          "price": 98.74,
          "change": "+0.00",
          "lastUpdate": "2026-01-08"
        },
        {
          "isin": "XS1551917591",
          "name": "ITALGAS 19/01/2027 1,625%",
          "type": "BOND",
          "country": "XS",
          "currency": "EUR",
          "maturity": "2027-01-19",
          "coupon": 1.625,
          "yield": 2.32,
          "price": 99.31,
          "change": "+0.00",
          "lastUpdate": "2026-01-08"
        },
        {
          "isin": "XS1551068676",
          "name": "ENI 17/01/2027 1,5%",
          "type": "BOND",
          "country": "XS",
          "currency": "EUR",
          "maturity": "2027-01-17",
          "coupon": 1.5,
          "yield": 2.31,
          "price": 99.2,
          "change": "+0.00",
          "lastUpdate": "2026-01-08"
        },
        {
          "isin": "XS2055728054",
          "name": "BMW FINANCE 24/09/2027 0,375%",
          "type": "BOND",
          "country": "XS",
          "currency": "EUR",
          "maturity": "2027-09-24",
          "coupon": 0.375,
          "yield": 2.29,
          "price": 96.85,
          "change": "+0.00",
          "lastUpdate": "2026-01-08"
        },
        {
          "isin": "XS1135277140",
          "name": "SHELL INTERNATIONAL FINANCE 20/01/2027 1,625%",
          "type": "BOND",
          "country": "XS",
          "currency": "EUR",
          "maturity": "2027-01-20",
          "coupon": 1.625,
          "yield": 2.29,
          "price": 99.34,
          "change": "+0.00",
          "lastUpdate": "2026-01-08"
        },
        {
          "isin": "XS2625968693",
          "name": "BMW FINANCE 22/11/2026 3,25%",
          "type": "BOND",
          "country": "XS",
          "currency": "EUR",
          "maturity": "2026-11-22",
          "coupon": 3.25,
          "yield": 2.26,
          "price": 100.83,
          "change": "+0.00",
          "lastUpdate": "2026-01-08"
        },
        {
          "isin": "XS0875797515",
          "name": "DEUTSCHE TELEKOM INTERNATIONAL FINANCE 17/01/2028 3,25%",
          "type": "BOND",
          "country": "XS",
          "currency": "EUR",
          "maturity": "2028-01-17",
          "coupon": 3.25,
          "yield": 2.2,
          "price": 102.05,
          "change": "+0.00",
          "lastUpdate": "2026-01-08"
        },
        {
          "isin": "XS1823246803",
          "name": "BMW FINANCE 22/05/2026 1,125%",
          "type": "BOND",
          "country": "XS",
          "currency": "EUR",
          "maturity": "2026-05-22",
          "coupon": 1.125,
          "yield": 2.14,
          "price": 99.64,
          "change": "+0.00",
          "lastUpdate": "2026-01-08"
        },
        {
          "isin": "XS2024715794",
          "name": "DEUTSCHE TELEKOM 05/07/2027 0,5%",
          "type": "BOND",
          "country": "XS",
          "currency": "EUR",
          "maturity": "2027-07-05",
          "coupon": 0.5,
          "yield": 2.14,
          "price": 97.64,
          "change": "+0.00",
          "lastUpdate": "2026-01-08"
        },
        {
          "isin": "XS1419869885",
          "name": "TELECOM ITALIA 25/05/2026 3,625%",
          "type": "BOND",
          "country": "XS",
          "currency": "EUR",
          "maturity": "2026-05-25",
          "coupon": 3.625,
          "yield": 2.1,
          "price": 100.54,
          "change": "+0.00",
          "lastUpdate": "2026-01-08"
        },
        {
          "isin": "XS1372839214",
          "name": "VODAFONE GROUP 25/08/2026 2,2%",
          "type": "BOND",
          "country": "XS",
          "currency": "EUR",
          "maturity": "2026-08-25",
          "coupon": 2.2,
          "yield": 2.06,
          "price": 100.08,
          "change": "+0.00",
          "lastUpdate": "2026-01-08"
        },
        {
          "isin": "XS2013574384",
          "name": "FORD 17/02/2026 2,386%",
          "type": "BOND",
          "country": "XS",
          "currency": "EUR",
          "maturity": "2026-02-17",
          "coupon": 2.386,
          "yield": 2.06,
          "price": 100.03,
          "change": "+0.00",
          "lastUpdate": "2026-01-08"
        },
        {
          "isin": "XS1980270810",
          "name": "TERNA GREEN BOND 10/04/2026 1%",
          "type": "BOND",
          "country": "XS",
          "currency": "EUR",
          "maturity": "2026-04-10",
          "coupon": 0,
          "yield": 1.92,
          "price": 99.78,
          "change": "+0.00",
          "lastUpdate": "2026-01-08"
        },
        {
          "isin": "XS1425966287",
          "name": "ENEL 01/06/2026 1,375%",
          "type": "BOND",
          "country": "XS",
          "currency": "EUR",
          "maturity": "2026-06-01",
          "coupon": 1.375,
          "yield": 1.84,
          "price": 99.82,
          "change": "+0.00",
          "lastUpdate": "2026-01-08"
        },
        {
          "isin": "XS1180451657",
          "name": "ENI 02/02/2026 1,5%",
          "type": "BOND",
          "country": "XS",
          "currency": "EUR",
          "maturity": "2026-02-02",
          "coupon": 1.5,
          "yield": 0.97,
          "price": 100.03,
          "change": "+0.00",
          "lastUpdate": "2026-01-08"
        },
        {
          "isin": "IT0005323438",
          "name": "CASSA DEPOSITI E PRESTITI 07/02/2026 1,875%",
          "type": "BOND",
          "country": "IT",
          "currency": "EUR",
          "maturity": "2026-02-07",
          "coupon": 1.875,
          "yield": -3.73,
          "price": 100.41,
          "change": "+0.00",
          "lastUpdate": "2026-01-08"
        }
      ]
    }
  },
  "statistics": {
    "totalBonds": 885,
    "totalCategories": 15,
    "successfulMonitors": 7,
    "failedMonitors": 0
  }
}